{
  "address": "0x1bF1C65D76F7f8A1802ceB9c7ba0428886aAB49b",
  "abi": [
    {
      "inputs": [
        {
          "internalType": "address",
          "name": "DAI_address",
          "type": "address"
        }
      ],
      "stateMutability": "nonpayable",
      "type": "constructor"
    },
    {
      "anonymous": false,
      "inputs": [
        {
          "indexed": true,
          "internalType": "address",
          "name": "owner",
          "type": "address"
        },
        {
          "indexed": true,
          "internalType": "address",
          "name": "approved",
          "type": "address"
        },
        {
          "indexed": true,
          "internalType": "uint256",
          "name": "tokenId",
          "type": "uint256"
        }
      ],
      "name": "Approval",
      "type": "event"
    },
    {
      "anonymous": false,
      "inputs": [
        {
          "indexed": true,
          "internalType": "address",
          "name": "owner",
          "type": "address"
        },
        {
          "indexed": true,
          "internalType": "address",
          "name": "operator",
          "type": "address"
        },
        {
          "indexed": false,
          "internalType": "bool",
          "name": "approved",
          "type": "bool"
        }
      ],
      "name": "ApprovalForAll",
      "type": "event"
    },
    {
      "anonymous": false,
      "inputs": [
        {
          "indexed": true,
          "internalType": "address",
          "name": "previousOwner",
          "type": "address"
        },
        {
          "indexed": true,
          "internalType": "address",
          "name": "newOwner",
          "type": "address"
        }
      ],
      "name": "OwnershipTransferred",
      "type": "event"
    },
    {
      "anonymous": false,
      "inputs": [
        {
          "indexed": true,
          "internalType": "address",
          "name": "from",
          "type": "address"
        },
        {
          "indexed": true,
          "internalType": "address",
          "name": "to",
          "type": "address"
        },
        {
          "indexed": true,
          "internalType": "uint256",
          "name": "tokenId",
          "type": "uint256"
        }
      ],
      "name": "Transfer",
      "type": "event"
    },
    {
      "inputs": [],
      "name": "activeSale",
      "outputs": [
        {
          "internalType": "bool",
          "name": "",
          "type": "bool"
        }
      ],
      "stateMutability": "view",
      "type": "function"
    },
    {
      "inputs": [
        {
          "internalType": "address",
          "name": "_whitelistedAddress",
          "type": "address"
        }
      ],
      "name": "addToWhitelist",
      "outputs": [],
      "stateMutability": "nonpayable",
      "type": "function"
    },
    {
      "inputs": [
        {
          "internalType": "address",
          "name": "to",
          "type": "address"
        },
        {
          "internalType": "uint256",
          "name": "tokenId",
          "type": "uint256"
        }
      ],
      "name": "approve",
      "outputs": [],
      "stateMutability": "nonpayable",
      "type": "function"
    },
    {
      "inputs": [
        {
          "internalType": "address",
          "name": "owner",
          "type": "address"
        }
      ],
      "name": "balanceOf",
      "outputs": [
        {
          "internalType": "uint256",
          "name": "",
          "type": "uint256"
        }
      ],
      "stateMutability": "view",
      "type": "function"
    },
    {
      "inputs": [],
      "name": "diamondNodePrice",
      "outputs": [
        {
          "internalType": "uint256",
          "name": "",
          "type": "uint256"
        }
      ],
      "stateMutability": "view",
      "type": "function"
    },
    {
      "inputs": [
        {
          "internalType": "uint256",
          "name": "tokenId",
          "type": "uint256"
        }
      ],
      "name": "getApproved",
      "outputs": [
        {
          "internalType": "address",
          "name": "",
          "type": "address"
        }
      ],
      "stateMutability": "view",
      "type": "function"
    },
    {
      "inputs": [],
      "name": "getPrice",
      "outputs": [
        {
          "internalType": "uint256",
          "name": "",
          "type": "uint256"
        }
      ],
      "stateMutability": "view",
      "type": "function"
    },
    {
      "inputs": [],
      "name": "giveAwayMint",
      "outputs": [],
      "stateMutability": "nonpayable",
      "type": "function"
    },
    {
      "inputs": [
        {
          "internalType": "address",
          "name": "owner",
          "type": "address"
        },
        {
          "internalType": "address",
          "name": "operator",
          "type": "address"
        }
      ],
      "name": "isApprovedForAll",
      "outputs": [
        {
          "internalType": "bool",
          "name": "",
          "type": "bool"
        }
      ],
      "stateMutability": "view",
      "type": "function"
    },
    {
      "inputs": [],
      "name": "maxNodesPerWallet",
      "outputs": [
        {
          "internalType": "uint64",
          "name": "",
          "type": "uint64"
        }
      ],
      "stateMutability": "view",
      "type": "function"
    },
    {
      "inputs": [],
      "name": "maxTotalDiamondNodes",
      "outputs": [
        {
          "internalType": "uint64",
          "name": "",
          "type": "uint64"
        }
      ],
      "stateMutability": "view",
      "type": "function"
    },
    {
      "inputs": [
        {
          "internalType": "uint256",
          "name": "amount",
          "type": "uint256"
        }
      ],
      "name": "mintNode",
      "outputs": [],
      "stateMutability": "nonpayable",
      "type": "function"
    },
    {
      "inputs": [],
      "name": "name",
      "outputs": [
        {
          "internalType": "string",
          "name": "",
          "type": "string"
        }
      ],
      "stateMutability": "view",
      "type": "function"
    },
    {
      "inputs": [],
      "name": "owner",
      "outputs": [
        {
          "internalType": "address",
          "name": "",
          "type": "address"
        }
      ],
      "stateMutability": "view",
      "type": "function"
    },
    {
      "inputs": [
        {
          "internalType": "uint256",
          "name": "tokenId",
          "type": "uint256"
        }
      ],
      "name": "ownerOf",
      "outputs": [
        {
          "internalType": "address",
          "name": "",
          "type": "address"
        }
      ],
      "stateMutability": "view",
      "type": "function"
    },
    {
      "inputs": [],
      "name": "renounceOwnership",
      "outputs": [],
      "stateMutability": "nonpayable",
      "type": "function"
    },
    {
      "inputs": [
        {
          "internalType": "address",
          "name": "from",
          "type": "address"
        },
        {
          "internalType": "address",
          "name": "to",
          "type": "address"
        },
        {
          "internalType": "uint256",
          "name": "tokenId",
          "type": "uint256"
        }
      ],
      "name": "safeTransferFrom",
      "outputs": [],
      "stateMutability": "nonpayable",
      "type": "function"
    },
    {
      "inputs": [
        {
          "internalType": "address",
          "name": "from",
          "type": "address"
        },
        {
          "internalType": "address",
          "name": "to",
          "type": "address"
        },
        {
          "internalType": "uint256",
          "name": "tokenId",
          "type": "uint256"
        },
        {
          "internalType": "bytes",
          "name": "_data",
          "type": "bytes"
        }
      ],
      "name": "safeTransferFrom",
      "outputs": [],
      "stateMutability": "nonpayable",
      "type": "function"
    },
    {
      "inputs": [
        {
          "internalType": "address",
          "name": "operator",
          "type": "address"
        },
        {
          "internalType": "bool",
          "name": "approved",
          "type": "bool"
        }
      ],
      "name": "setApprovalForAll",
      "outputs": [],
      "stateMutability": "nonpayable",
      "type": "function"
    },
    {
      "inputs": [
        {
          "internalType": "string",
          "name": "_tokenBaseURI",
          "type": "string"
        }
      ],
      "name": "setBaseURI",
      "outputs": [],
      "stateMutability": "nonpayable",
      "type": "function"
    },
    {
      "inputs": [
        {
          "internalType": "uint64",
          "name": "_newAmount",
          "type": "uint64"
        }
      ],
      "name": "setMaxPerWallet",
      "outputs": [],
      "stateMutability": "nonpayable",
      "type": "function"
    },
    {
      "inputs": [
        {
          "internalType": "uint64",
          "name": "_newNodeAmount",
          "type": "uint64"
        }
      ],
      "name": "setMaxTotalDiamondNodes",
      "outputs": [],
      "stateMutability": "nonpayable",
      "type": "function"
    },
    {
      "inputs": [],
      "name": "setSaleState",
      "outputs": [],
      "stateMutability": "nonpayable",
      "type": "function"
    },
    {
      "inputs": [],
      "name": "setTransferLock",
      "outputs": [],
      "stateMutability": "nonpayable",
      "type": "function"
    },
    {
      "inputs": [
        {
          "internalType": "bytes4",
          "name": "interfaceId",
          "type": "bytes4"
        }
      ],
      "name": "supportsInterface",
      "outputs": [
        {
          "internalType": "bool",
          "name": "",
          "type": "bool"
        }
      ],
      "stateMutability": "view",
      "type": "function"
    },
    {
      "inputs": [],
      "name": "symbol",
      "outputs": [
        {
          "internalType": "string",
          "name": "",
          "type": "string"
        }
      ],
      "stateMutability": "view",
      "type": "function"
    },
    {
      "inputs": [
        {
          "internalType": "uint256",
          "name": "index",
          "type": "uint256"
        }
      ],
      "name": "tokenByIndex",
      "outputs": [
        {
          "internalType": "uint256",
          "name": "",
          "type": "uint256"
        }
      ],
      "stateMutability": "view",
      "type": "function"
    },
    {
      "inputs": [
        {
          "internalType": "address",
          "name": "owner",
          "type": "address"
        },
        {
          "internalType": "uint256",
          "name": "index",
          "type": "uint256"
        }
      ],
      "name": "tokenOfOwnerByIndex",
      "outputs": [
        {
          "internalType": "uint256",
          "name": "",
          "type": "uint256"
        }
      ],
      "stateMutability": "view",
      "type": "function"
    },
    {
      "inputs": [
        {
          "internalType": "uint256",
          "name": "tokenId",
          "type": "uint256"
        }
      ],
      "name": "tokenURI",
      "outputs": [
        {
          "internalType": "string",
          "name": "",
          "type": "string"
        }
      ],
      "stateMutability": "view",
      "type": "function"
    },
    {
      "inputs": [],
      "name": "totalSupply",
      "outputs": [
        {
          "internalType": "uint256",
          "name": "",
          "type": "uint256"
        }
      ],
      "stateMutability": "view",
      "type": "function"
    },
    {
      "inputs": [
        {
          "internalType": "address",
          "name": "from",
          "type": "address"
        },
        {
          "internalType": "address",
          "name": "to",
          "type": "address"
        },
        {
          "internalType": "uint256",
          "name": "tokenId",
          "type": "uint256"
        }
      ],
      "name": "transferFrom",
      "outputs": [],
      "stateMutability": "nonpayable",
      "type": "function"
    },
    {
      "inputs": [
        {
          "internalType": "address",
          "name": "newOwner",
          "type": "address"
        }
      ],
      "name": "transferOwnership",
      "outputs": [],
      "stateMutability": "nonpayable",
      "type": "function"
    }
  ],
  "transactionHash": "0xf4022e2dad0ab72895f65ed28f3f6bebd8106cd34ff61bb55d0fa8e3c0b05684",
  "receipt": {
    "to": null,
    "from": "0x05309918A451156C2cE41f3C8dF89672ce83e944",
    "contractAddress": "0x1bF1C65D76F7f8A1802ceB9c7ba0428886aAB49b",
    "transactionIndex": 0,
    "gasUsed": "2286283",
    "logsBloom": "0x00000000000000000000000000000000000480000000000000800000000000000000000000000000000000000000000000000000000000000000000000000000000000000000000000000020002000000001000000000000000000000000000000000000020000000000000000000800000000000000000000000000000000400000000000000000000000000000000000000040000000000000000000000000000000000000000000000000000000000000000000000000000000000000000000000002000000000000000000000000000000000000000000000000000020000000000000000000000000000000000000000000000000000000000000000000",
    "blockHash": "0x764492855cf3f41d7fc939e7dc358c4f67afc67e1c58bd3bf0c58cf5dd2253e3",
    "transactionHash": "0xf4022e2dad0ab72895f65ed28f3f6bebd8106cd34ff61bb55d0fa8e3c0b05684",
    "logs": [
      {
        "transactionIndex": 0,
        "blockNumber": 13566568,
        "transactionHash": "0xf4022e2dad0ab72895f65ed28f3f6bebd8106cd34ff61bb55d0fa8e3c0b05684",
        "address": "0x1bF1C65D76F7f8A1802ceB9c7ba0428886aAB49b",
        "topics": [
          "0x8be0079c531659141344cd1fd0a4f28419497f9722a3daafe3b4186f6b6457e0",
          "0x0000000000000000000000000000000000000000000000000000000000000000",
          "0x00000000000000000000000005309918a451156c2ce41f3c8df89672ce83e944"
        ],
        "data": "0x",
        "logIndex": 0,
        "blockHash": "0x764492855cf3f41d7fc939e7dc358c4f67afc67e1c58bd3bf0c58cf5dd2253e3"
      }
    ],
    "blockNumber": 13566568,
    "cumulativeGasUsed": "2286283",
    "status": 1,
    "byzantium": true
  },
  "args": [
    "0x3362FE2f7E17A5a9F90DaBE12E4A6E16E146F19a"
  ],
  "numDeployments": 1,
  "solcInputHash": "2287e27c6029eee9f60f47b0937a3206",
  "metadata": "{\"compiler\":{\"version\":\"0.8.15+commit.e14f2714\"},\"language\":\"Solidity\",\"output\":{\"abi\":[{\"inputs\":[{\"internalType\":\"address\",\"name\":\"DAI_address\",\"type\":\"address\"}],\"stateMutability\":\"nonpayable\",\"type\":\"constructor\"},{\"anonymous\":false,\"inputs\":[{\"indexed\":true,\"internalType\":\"address\",\"name\":\"owner\",\"type\":\"address\"},{\"indexed\":true,\"internalType\":\"address\",\"name\":\"approved\",\"type\":\"address\"},{\"indexed\":true,\"internalType\":\"uint256\",\"name\":\"tokenId\",\"type\":\"uint256\"}],\"name\":\"Approval\",\"type\":\"event\"},{\"anonymous\":false,\"inputs\":[{\"indexed\":true,\"internalType\":\"address\",\"name\":\"owner\",\"type\":\"address\"},{\"indexed\":true,\"internalType\":\"address\",\"name\":\"operator\",\"type\":\"address\"},{\"indexed\":false,\"internalType\":\"bool\",\"name\":\"approved\",\"type\":\"bool\"}],\"name\":\"ApprovalForAll\",\"type\":\"event\"},{\"anonymous\":false,\"inputs\":[{\"indexed\":true,\"internalType\":\"address\",\"name\":\"previousOwner\",\"type\":\"address\"},{\"indexed\":true,\"internalType\":\"address\",\"name\":\"newOwner\",\"type\":\"address\"}],\"name\":\"OwnershipTransferred\",\"type\":\"event\"},{\"anonymous\":false,\"inputs\":[{\"indexed\":true,\"internalType\":\"address\",\"name\":\"from\",\"type\":\"address\"},{\"indexed\":true,\"internalType\":\"address\",\"name\":\"to\",\"type\":\"address\"},{\"indexed\":true,\"internalType\":\"uint256\",\"name\":\"tokenId\",\"type\":\"uint256\"}],\"name\":\"Transfer\",\"type\":\"event\"},{\"inputs\":[],\"name\":\"activeSale\",\"outputs\":[{\"internalType\":\"bool\",\"name\":\"\",\"type\":\"bool\"}],\"stateMutability\":\"view\",\"type\":\"function\"},{\"inputs\":[{\"internalType\":\"address\",\"name\":\"_whitelistedAddress\",\"type\":\"address\"}],\"name\":\"addToWhitelist\",\"outputs\":[],\"stateMutability\":\"nonpayable\",\"type\":\"function\"},{\"inputs\":[{\"internalType\":\"address\",\"name\":\"to\",\"type\":\"address\"},{\"internalType\":\"uint256\",\"name\":\"tokenId\",\"type\":\"uint256\"}],\"name\":\"approve\",\"outputs\":[],\"stateMutability\":\"nonpayable\",\"type\":\"function\"},{\"inputs\":[{\"internalType\":\"address\",\"name\":\"owner\",\"type\":\"address\"}],\"name\":\"balanceOf\",\"outputs\":[{\"internalType\":\"uint256\",\"name\":\"\",\"type\":\"uint256\"}],\"stateMutability\":\"view\",\"type\":\"function\"},{\"inputs\":[],\"name\":\"diamondNodePrice\",\"outputs\":[{\"internalType\":\"uint256\",\"name\":\"\",\"type\":\"uint256\"}],\"stateMutability\":\"view\",\"type\":\"function\"},{\"inputs\":[{\"internalType\":\"uint256\",\"name\":\"tokenId\",\"type\":\"uint256\"}],\"name\":\"getApproved\",\"outputs\":[{\"internalType\":\"address\",\"name\":\"\",\"type\":\"address\"}],\"stateMutability\":\"view\",\"type\":\"function\"},{\"inputs\":[],\"name\":\"getPrice\",\"outputs\":[{\"internalType\":\"uint256\",\"name\":\"\",\"type\":\"uint256\"}],\"stateMutability\":\"view\",\"type\":\"function\"},{\"inputs\":[],\"name\":\"giveAwayMint\",\"outputs\":[],\"stateMutability\":\"nonpayable\",\"type\":\"function\"},{\"inputs\":[{\"internalType\":\"address\",\"name\":\"owner\",\"type\":\"address\"},{\"internalType\":\"address\",\"name\":\"operator\",\"type\":\"address\"}],\"name\":\"isApprovedForAll\",\"outputs\":[{\"internalType\":\"bool\",\"name\":\"\",\"type\":\"bool\"}],\"stateMutability\":\"view\",\"type\":\"function\"},{\"inputs\":[],\"name\":\"maxNodesPerWallet\",\"outputs\":[{\"internalType\":\"uint64\",\"name\":\"\",\"type\":\"uint64\"}],\"stateMutability\":\"view\",\"type\":\"function\"},{\"inputs\":[],\"name\":\"maxTotalDiamondNodes\",\"outputs\":[{\"internalType\":\"uint64\",\"name\":\"\",\"type\":\"uint64\"}],\"stateMutability\":\"view\",\"type\":\"function\"},{\"inputs\":[{\"internalType\":\"uint256\",\"name\":\"amount\",\"type\":\"uint256\"}],\"name\":\"mintNode\",\"outputs\":[],\"stateMutability\":\"nonpayable\",\"type\":\"function\"},{\"inputs\":[],\"name\":\"name\",\"outputs\":[{\"internalType\":\"string\",\"name\":\"\",\"type\":\"string\"}],\"stateMutability\":\"view\",\"type\":\"function\"},{\"inputs\":[],\"name\":\"owner\",\"outputs\":[{\"internalType\":\"address\",\"name\":\"\",\"type\":\"address\"}],\"stateMutability\":\"view\",\"type\":\"function\"},{\"inputs\":[{\"internalType\":\"uint256\",\"name\":\"tokenId\",\"type\":\"uint256\"}],\"name\":\"ownerOf\",\"outputs\":[{\"internalType\":\"address\",\"name\":\"\",\"type\":\"address\"}],\"stateMutability\":\"view\",\"type\":\"function\"},{\"inputs\":[],\"name\":\"renounceOwnership\",\"outputs\":[],\"stateMutability\":\"nonpayable\",\"type\":\"function\"},{\"inputs\":[{\"internalType\":\"address\",\"name\":\"from\",\"type\":\"address\"},{\"internalType\":\"address\",\"name\":\"to\",\"type\":\"address\"},{\"internalType\":\"uint256\",\"name\":\"tokenId\",\"type\":\"uint256\"}],\"name\":\"safeTransferFrom\",\"outputs\":[],\"stateMutability\":\"nonpayable\",\"type\":\"function\"},{\"inputs\":[{\"internalType\":\"address\",\"name\":\"from\",\"type\":\"address\"},{\"internalType\":\"address\",\"name\":\"to\",\"type\":\"address\"},{\"internalType\":\"uint256\",\"name\":\"tokenId\",\"type\":\"uint256\"},{\"internalType\":\"bytes\",\"name\":\"_data\",\"type\":\"bytes\"}],\"name\":\"safeTransferFrom\",\"outputs\":[],\"stateMutability\":\"nonpayable\",\"type\":\"function\"},{\"inputs\":[{\"internalType\":\"address\",\"name\":\"operator\",\"type\":\"address\"},{\"internalType\":\"bool\",\"name\":\"approved\",\"type\":\"bool\"}],\"name\":\"setApprovalForAll\",\"outputs\":[],\"stateMutability\":\"nonpayable\",\"type\":\"function\"},{\"inputs\":[{\"internalType\":\"string\",\"name\":\"_tokenBaseURI\",\"type\":\"string\"}],\"name\":\"setBaseURI\",\"outputs\":[],\"stateMutability\":\"nonpayable\",\"type\":\"function\"},{\"inputs\":[{\"internalType\":\"uint64\",\"name\":\"_newAmount\",\"type\":\"uint64\"}],\"name\":\"setMaxPerWallet\",\"outputs\":[],\"stateMutability\":\"nonpayable\",\"type\":\"function\"},{\"inputs\":[{\"internalType\":\"uint64\",\"name\":\"_newNodeAmount\",\"type\":\"uint64\"}],\"name\":\"setMaxTotalDiamondNodes\",\"outputs\":[],\"stateMutability\":\"nonpayable\",\"type\":\"function\"},{\"inputs\":[],\"name\":\"setSaleState\",\"outputs\":[],\"stateMutability\":\"nonpayable\",\"type\":\"function\"},{\"inputs\":[],\"name\":\"setTransferLock\",\"outputs\":[],\"stateMutability\":\"nonpayable\",\"type\":\"function\"},{\"inputs\":[{\"internalType\":\"bytes4\",\"name\":\"interfaceId\",\"type\":\"bytes4\"}],\"name\":\"supportsInterface\",\"outputs\":[{\"internalType\":\"bool\",\"name\":\"\",\"type\":\"bool\"}],\"stateMutability\":\"view\",\"type\":\"function\"},{\"inputs\":[],\"name\":\"symbol\",\"outputs\":[{\"internalType\":\"string\",\"name\":\"\",\"type\":\"string\"}],\"stateMutability\":\"view\",\"type\":\"function\"},{\"inputs\":[{\"internalType\":\"uint256\",\"name\":\"index\",\"type\":\"uint256\"}],\"name\":\"tokenByIndex\",\"outputs\":[{\"internalType\":\"uint256\",\"name\":\"\",\"type\":\"uint256\"}],\"stateMutability\":\"view\",\"type\":\"function\"},{\"inputs\":[{\"internalType\":\"address\",\"name\":\"owner\",\"type\":\"address\"},{\"internalType\":\"uint256\",\"name\":\"index\",\"type\":\"uint256\"}],\"name\":\"tokenOfOwnerByIndex\",\"outputs\":[{\"internalType\":\"uint256\",\"name\":\"\",\"type\":\"uint256\"}],\"stateMutability\":\"view\",\"type\":\"function\"},{\"inputs\":[{\"internalType\":\"uint256\",\"name\":\"tokenId\",\"type\":\"uint256\"}],\"name\":\"tokenURI\",\"outputs\":[{\"internalType\":\"string\",\"name\":\"\",\"type\":\"string\"}],\"stateMutability\":\"view\",\"type\":\"function\"},{\"inputs\":[],\"name\":\"totalSupply\",\"outputs\":[{\"internalType\":\"uint256\",\"name\":\"\",\"type\":\"uint256\"}],\"stateMutability\":\"view\",\"type\":\"function\"},{\"inputs\":[{\"internalType\":\"address\",\"name\":\"from\",\"type\":\"address\"},{\"internalType\":\"address\",\"name\":\"to\",\"type\":\"address\"},{\"internalType\":\"uint256\",\"name\":\"tokenId\",\"type\":\"uint256\"}],\"name\":\"transferFrom\",\"outputs\":[],\"stateMutability\":\"nonpayable\",\"type\":\"function\"},{\"inputs\":[{\"internalType\":\"address\",\"name\":\"newOwner\",\"type\":\"address\"}],\"name\":\"transferOwnership\",\"outputs\":[],\"stateMutability\":\"nonpayable\",\"type\":\"function\"}],\"devdoc\":{\"kind\":\"dev\",\"methods\":{\"approve(address,uint256)\":{\"details\":\"See {IERC721-approve}.\"},\"balanceOf(address)\":{\"details\":\"See {IERC721-balanceOf}.\"},\"getApproved(uint256)\":{\"details\":\"See {IERC721-getApproved}.\"},\"isApprovedForAll(address,address)\":{\"details\":\"See {IERC721-isApprovedForAll}.\"},\"name()\":{\"details\":\"See {IERC721Metadata-name}.\"},\"owner()\":{\"details\":\"Returns the address of the current owner.\"},\"ownerOf(uint256)\":{\"details\":\"See {IERC721-ownerOf}.\"},\"renounceOwnership()\":{\"details\":\"Leaves the contract without owner. It will not be possible to call `onlyOwner` functions anymore. Can only be called by the current owner. NOTE: Renouncing ownership will leave the contract without an owner, thereby removing any functionality that is only available to the owner.\"},\"safeTransferFrom(address,address,uint256)\":{\"details\":\"See {IERC721-safeTransferFrom}.\"},\"safeTransferFrom(address,address,uint256,bytes)\":{\"details\":\"See {IERC721-safeTransferFrom}.\"},\"setApprovalForAll(address,bool)\":{\"details\":\"See {IERC721-setApprovalForAll}.\"},\"supportsInterface(bytes4)\":{\"details\":\"See {IERC165-supportsInterface}.\"},\"symbol()\":{\"details\":\"See {IERC721Metadata-symbol}.\"},\"tokenByIndex(uint256)\":{\"details\":\"See {IERC721Enumerable-tokenByIndex}.\"},\"tokenOfOwnerByIndex(address,uint256)\":{\"details\":\"See {IERC721Enumerable-tokenOfOwnerByIndex}.\"},\"tokenURI(uint256)\":{\"details\":\"See {IERC721Metadata-tokenURI}.\"},\"totalSupply()\":{\"details\":\"See {IERC721Enumerable-totalSupply}.\"},\"transferFrom(address,address,uint256)\":{\"details\":\"See {IERC721-transferFrom}.\"},\"transferOwnership(address)\":{\"details\":\"Transfers ownership of the contract to a new account (`newOwner`). Can only be called by the current owner.\"}},\"title\":\"Defo Diamond Omega Node Minting Contract\",\"version\":1},\"userdoc\":{\"kind\":\"user\",\"methods\":{\"mintNode(uint256)\":{\"notice\":\"allows users to mint diamond nodes\"},\"setBaseURI(string)\":{\"notice\":\"allows the owner to set the baseURI\"},\"setMaxPerWallet(uint64)\":{\"notice\":\"allows the owner to set the max amount of nodes one wallet can hold\"},\"setMaxTotalDiamondNodes(uint64)\":{\"notice\":\"allows the owner to set the total amount of diamond nodes\"},\"setSaleState()\":{\"notice\":\"allows the owner to render the sale inactive/active, in other words pausing and resuming\"}},\"notice\":\"Contract for minting diamond nodes\",\"version\":1}},\"settings\":{\"compilationTarget\":{\"contracts/presale/presaleDiamondOmega.sol\":\"DiamondNodeOmega\"},\"evmVersion\":\"berlin\",\"libraries\":{},\"metadata\":{\"bytecodeHash\":\"ipfs\",\"useLiteralContent\":true},\"optimizer\":{\"enabled\":true,\"runs\":250},\"remappings\":[]},\"sources\":{\"contracts/presale/presaleDiamondOmega.sol\":{\"content\":\"/**\\n *Submitted for verification at snowtrace.io on 2022-03-31\\n*/\\n\\n// File: @openzeppelin/contracts/utils/math/SafeMath.sol\\n\\n\\n// OpenZeppelin Contracts v4.4.1 (utils/math/SafeMath.sol)\\n\\npragma solidity ^0.8.0;\\n\\n// CAUTION\\n// This version of SafeMath should only be used with Solidity 0.8 or later,\\n// because it relies on the compiler's built in overflow checks.\\n\\n/**\\n * @dev Wrappers over Solidity's arithmetic operations.\\n *\\n * NOTE: `SafeMath` is generally not needed starting with Solidity 0.8, since the compiler\\n * now has built in overflow checking.\\n */\\nlibrary SafeMath {\\n    /**\\n     * @dev Returns the addition of two unsigned integers, with an overflow flag.\\n     *\\n     * _Available since v3.4._\\n     */\\n    function tryAdd(uint256 a, uint256 b) internal pure returns (bool, uint256) {\\n    unchecked {\\n        uint256 c = a + b;\\n        if (c < a) return (false, 0);\\n        return (true, c);\\n    }\\n    }\\n\\n    /**\\n     * @dev Returns the substraction of two unsigned integers, with an overflow flag.\\n     *\\n     * _Available since v3.4._\\n     */\\n    function trySub(uint256 a, uint256 b) internal pure returns (bool, uint256) {\\n    unchecked {\\n        if (b > a) return (false, 0);\\n        return (true, a - b);\\n    }\\n    }\\n\\n    /**\\n     * @dev Returns the multiplication of two unsigned integers, with an overflow flag.\\n     *\\n     * _Available since v3.4._\\n     */\\n    function tryMul(uint256 a, uint256 b) internal pure returns (bool, uint256) {\\n    unchecked {\\n        // Gas optimization: this is cheaper than requiring 'a' not being zero, but the\\n        // benefit is lost if 'b' is also tested.\\n        // See: https://github.com/OpenZeppelin/openzeppelin-contracts/pull/522\\n        if (a == 0) return (true, 0);\\n        uint256 c = a * b;\\n        if (c / a != b) return (false, 0);\\n        return (true, c);\\n    }\\n    }\\n\\n    /**\\n     * @dev Returns the division of two unsigned integers, with a division by zero flag.\\n     *\\n     * _Available since v3.4._\\n     */\\n    function tryDiv(uint256 a, uint256 b) internal pure returns (bool, uint256) {\\n    unchecked {\\n        if (b == 0) return (false, 0);\\n        return (true, a / b);\\n    }\\n    }\\n\\n    /**\\n     * @dev Returns the remainder of dividing two unsigned integers, with a division by zero flag.\\n     *\\n     * _Available since v3.4._\\n     */\\n    function tryMod(uint256 a, uint256 b) internal pure returns (bool, uint256) {\\n    unchecked {\\n        if (b == 0) return (false, 0);\\n        return (true, a % b);\\n    }\\n    }\\n\\n    /**\\n     * @dev Returns the addition of two unsigned integers, reverting on\\n     * overflow.\\n     *\\n     * Counterpart to Solidity's `+` operator.\\n     *\\n     * Requirements:\\n     *\\n     * - Addition cannot overflow.\\n     */\\n    function add(uint256 a, uint256 b) internal pure returns (uint256) {\\n        return a + b;\\n    }\\n\\n    /**\\n     * @dev Returns the subtraction of two unsigned integers, reverting on\\n     * overflow (when the result is negative).\\n     *\\n     * Counterpart to Solidity's `-` operator.\\n     *\\n     * Requirements:\\n     *\\n     * - Subtraction cannot overflow.\\n     */\\n    function sub(uint256 a, uint256 b) internal pure returns (uint256) {\\n        return a - b;\\n    }\\n\\n    /**\\n     * @dev Returns the multiplication of two unsigned integers, reverting on\\n     * overflow.\\n     *\\n     * Counterpart to Solidity's `*` operator.\\n     *\\n     * Requirements:\\n     *\\n     * - Multiplication cannot overflow.\\n     */\\n    function mul(uint256 a, uint256 b) internal pure returns (uint256) {\\n        return a * b;\\n    }\\n\\n    /**\\n     * @dev Returns the integer division of two unsigned integers, reverting on\\n     * division by zero. The result is rounded towards zero.\\n     *\\n     * Counterpart to Solidity's `/` operator.\\n     *\\n     * Requirements:\\n     *\\n     * - The divisor cannot be zero.\\n     */\\n    function div(uint256 a, uint256 b) internal pure returns (uint256) {\\n        return a / b;\\n    }\\n\\n    /**\\n     * @dev Returns the remainder of dividing two unsigned integers. (unsigned integer modulo),\\n     * reverting when dividing by zero.\\n     *\\n     * Counterpart to Solidity's `%` operator. This function uses a `revert`\\n     * opcode (which leaves remaining gas untouched) while Solidity uses an\\n     * invalid opcode to revert (consuming all remaining gas).\\n     *\\n     * Requirements:\\n     *\\n     * - The divisor cannot be zero.\\n     */\\n    function mod(uint256 a, uint256 b) internal pure returns (uint256) {\\n        return a % b;\\n    }\\n\\n    /**\\n     * @dev Returns the subtraction of two unsigned integers, reverting with custom message on\\n     * overflow (when the result is negative).\\n     *\\n     * CAUTION: This function is deprecated because it requires allocating memory for the error\\n     * message unnecessarily. For custom revert reasons use {trySub}.\\n     *\\n     * Counterpart to Solidity's `-` operator.\\n     *\\n     * Requirements:\\n     *\\n     * - Subtraction cannot overflow.\\n     */\\n    function sub(\\n        uint256 a,\\n        uint256 b,\\n        string memory errorMessage\\n    ) internal pure returns (uint256) {\\n    unchecked {\\n        require(b <= a, errorMessage);\\n        return a - b;\\n    }\\n    }\\n\\n    /**\\n     * @dev Returns the integer division of two unsigned integers, reverting with custom message on\\n     * division by zero. The result is rounded towards zero.\\n     *\\n     * Counterpart to Solidity's `/` operator. Note: this function uses a\\n     * `revert` opcode (which leaves remaining gas untouched) while Solidity\\n     * uses an invalid opcode to revert (consuming all remaining gas).\\n     *\\n     * Requirements:\\n     *\\n     * - The divisor cannot be zero.\\n     */\\n    function div(\\n        uint256 a,\\n        uint256 b,\\n        string memory errorMessage\\n    ) internal pure returns (uint256) {\\n    unchecked {\\n        require(b > 0, errorMessage);\\n        return a / b;\\n    }\\n    }\\n\\n    /**\\n     * @dev Returns the remainder of dividing two unsigned integers. (unsigned integer modulo),\\n     * reverting with custom message when dividing by zero.\\n     *\\n     * CAUTION: This function is deprecated because it requires allocating memory for the error\\n     * message unnecessarily. For custom revert reasons use {tryMod}.\\n     *\\n     * Counterpart to Solidity's `%` operator. This function uses a `revert`\\n     * opcode (which leaves remaining gas untouched) while Solidity uses an\\n     * invalid opcode to revert (consuming all remaining gas).\\n     *\\n     * Requirements:\\n     *\\n     * - The divisor cannot be zero.\\n     */\\n    function mod(\\n        uint256 a,\\n        uint256 b,\\n        string memory errorMessage\\n    ) internal pure returns (uint256) {\\n    unchecked {\\n        require(b > 0, errorMessage);\\n        return a % b;\\n    }\\n    }\\n}\\n\\n// File: @openzeppelin/contracts/utils/Counters.sol\\n\\n\\n// OpenZeppelin Contracts v4.4.1 (utils/Counters.sol)\\n\\npragma solidity ^0.8.0;\\n\\n/**\\n * @title Counters\\n * @author Matt Condon (@shrugs)\\n * @dev Provides counters that can only be incremented, decremented or reset. This can be used e.g. to track the number\\n * of elements in a mapping, issuing ERC721 ids, or counting request ids.\\n *\\n * Include with `using Counters for Counters.Counter;`\\n */\\nlibrary Counters {\\n    struct Counter {\\n        // This variable should never be directly accessed by users of the library: interactions must be restricted to\\n        // the library's function. As of Solidity v0.5.2, this cannot be enforced, though there is a proposal to add\\n        // this feature: see https://github.com/ethereum/solidity/issues/4637\\n        uint256 _value; // default: 0\\n    }\\n\\n    function current(Counter storage counter) internal view returns (uint256) {\\n        return counter._value;\\n    }\\n\\n    function increment(Counter storage counter) internal {\\n    unchecked {\\n        counter._value += 1;\\n    }\\n    }\\n\\n    function decrement(Counter storage counter) internal {\\n        uint256 value = counter._value;\\n        require(value > 0, \\\"Counter: decrement overflow\\\");\\n    unchecked {\\n        counter._value = value - 1;\\n    }\\n    }\\n\\n    function reset(Counter storage counter) internal {\\n        counter._value = 0;\\n    }\\n}\\n\\n// File: @openzeppelin/contracts/token/ERC20/IERC20.sol\\n\\n\\n// OpenZeppelin Contracts (last updated v4.5.0) (token/ERC20/IERC20.sol)\\n\\npragma solidity ^0.8.0;\\n\\n/**\\n * @dev Interface of the ERC20 standard as defined in the EIP.\\n */\\ninterface IERC20 {\\n    /**\\n     * @dev Returns the amount of tokens in existence.\\n     */\\n    function totalSupply() external view returns (uint256);\\n\\n    /**\\n     * @dev Returns the amount of tokens owned by `account`.\\n     */\\n    function balanceOf(address account) external view returns (uint256);\\n\\n    /**\\n     * @dev Moves `amount` tokens from the caller's account to `to`.\\n     *\\n     * Returns a boolean value indicating whether the operation succeeded.\\n     *\\n     * Emits a {Transfer} event.\\n     */\\n    function transfer(address to, uint256 amount) external returns (bool);\\n\\n    /**\\n     * @dev Returns the remaining number of tokens that `spender` will be\\n     * allowed to spend on behalf of `owner` through {transferFrom}. This is\\n     * zero by default.\\n     *\\n     * This value changes when {approve} or {transferFrom} are called.\\n     */\\n    function allowance(address owner, address spender) external view returns (uint256);\\n\\n    /**\\n     * @dev Sets `amount` as the allowance of `spender` over the caller's tokens.\\n     *\\n     * Returns a boolean value indicating whether the operation succeeded.\\n     *\\n     * IMPORTANT: Beware that changing an allowance with this method brings the risk\\n     * that someone may use both the old and the new allowance by unfortunate\\n     * transaction ordering. One possible solution to mitigate this race\\n     * condition is to first reduce the spender's allowance to 0 and set the\\n     * desired value afterwards:\\n     * https://github.com/ethereum/EIPs/issues/20#issuecomment-263524729\\n     *\\n     * Emits an {Approval} event.\\n     */\\n    function approve(address spender, uint256 amount) external returns (bool);\\n\\n    /**\\n     * @dev Moves `amount` tokens from `from` to `to` using the\\n     * allowance mechanism. `amount` is then deducted from the caller's\\n     * allowance.\\n     *\\n     * Returns a boolean value indicating whether the operation succeeded.\\n     *\\n     * Emits a {Transfer} event.\\n     */\\n    function transferFrom(\\n        address from,\\n        address to,\\n        uint256 amount\\n    ) external returns (bool);\\n\\n    /**\\n     * @dev Emitted when `value` tokens are moved from one account (`from`) to\\n     * another (`to`).\\n     *\\n     * Note that `value` may be zero.\\n     */\\n    event Transfer(address indexed from, address indexed to, uint256 value);\\n\\n    /**\\n     * @dev Emitted when the allowance of a `spender` for an `owner` is set by\\n     * a call to {approve}. `value` is the new allowance.\\n     */\\n    event Approval(address indexed owner, address indexed spender, uint256 value);\\n}\\n\\n// File: @openzeppelin/contracts/utils/Strings.sol\\n\\n\\n// OpenZeppelin Contracts v4.4.1 (utils/Strings.sol)\\n\\npragma solidity ^0.8.0;\\n\\n/**\\n * @dev String operations.\\n */\\nlibrary Strings {\\n    bytes16 private constant _HEX_SYMBOLS = \\\"0123456789abcdef\\\";\\n\\n    /**\\n     * @dev Converts a `uint256` to its ASCII `string` decimal representation.\\n     */\\n    function toString(uint256 value) internal pure returns (string memory) {\\n        // Inspired by OraclizeAPI's implementation - MIT licence\\n        // https://github.com/oraclize/ethereum-api/blob/b42146b063c7d6ee1358846c198246239e9360e8/oraclizeAPI_0.4.25.sol\\n\\n        if (value == 0) {\\n            return \\\"0\\\";\\n        }\\n        uint256 temp = value;\\n        uint256 digits;\\n        while (temp != 0) {\\n            digits++;\\n            temp /= 10;\\n        }\\n        bytes memory buffer = new bytes(digits);\\n        while (value != 0) {\\n            digits -= 1;\\n            buffer[digits] = bytes1(uint8(48 + uint256(value % 10)));\\n            value /= 10;\\n        }\\n        return string(buffer);\\n    }\\n\\n    /**\\n     * @dev Converts a `uint256` to its ASCII `string` hexadecimal representation.\\n     */\\n    function toHexString(uint256 value) internal pure returns (string memory) {\\n        if (value == 0) {\\n            return \\\"0x00\\\";\\n        }\\n        uint256 temp = value;\\n        uint256 length = 0;\\n        while (temp != 0) {\\n            length++;\\n            temp >>= 8;\\n        }\\n        return toHexString(value, length);\\n    }\\n\\n    /**\\n     * @dev Converts a `uint256` to its ASCII `string` hexadecimal representation with fixed length.\\n     */\\n    function toHexString(uint256 value, uint256 length) internal pure returns (string memory) {\\n        bytes memory buffer = new bytes(2 * length + 2);\\n        buffer[0] = \\\"0\\\";\\n        buffer[1] = \\\"x\\\";\\n        for (uint256 i = 2 * length + 1; i > 1; --i) {\\n            buffer[i] = _HEX_SYMBOLS[value & 0xf];\\n            value >>= 4;\\n        }\\n        require(value == 0, \\\"Strings: hex length insufficient\\\");\\n        return string(buffer);\\n    }\\n}\\n\\n// File: @openzeppelin/contracts/utils/Context.sol\\n\\n\\n// OpenZeppelin Contracts v4.4.1 (utils/Context.sol)\\n\\npragma solidity ^0.8.0;\\n\\n/**\\n * @dev Provides information about the current execution context, including the\\n * sender of the transaction and its data. While these are generally available\\n * via msg.sender and msg.data, they should not be accessed in such a direct\\n * manner, since when dealing with meta-transactions the account sending and\\n * paying for execution may not be the actual sender (as far as an application\\n * is concerned).\\n *\\n * This contract is only required for intermediate, library-like contracts.\\n */\\nabstract contract Context {\\n    function _msgSender() internal view virtual returns (address) {\\n        return msg.sender;\\n    }\\n\\n    function _msgData() internal view virtual returns (bytes calldata) {\\n        return msg.data;\\n    }\\n}\\n\\n// File: @openzeppelin/contracts/access/Ownable.sol\\n\\n\\n// OpenZeppelin Contracts v4.4.1 (access/Ownable.sol)\\n\\npragma solidity ^0.8.0;\\n\\n\\n/**\\n * @dev Contract module which provides a basic access control mechanism, where\\n * there is an account (an owner) that can be granted exclusive access to\\n * specific functions.\\n *\\n * By default, the owner account will be the one that deploys the contract. This\\n * can later be changed with {transferOwnership}.\\n *\\n * This module is used through inheritance. It will make available the modifier\\n * `onlyOwner`, which can be applied to your functions to restrict their use to\\n * the owner.\\n */\\nabstract contract Ownable is Context {\\n    address private _owner;\\n\\n    event OwnershipTransferred(address indexed previousOwner, address indexed newOwner);\\n\\n    /**\\n     * @dev Initializes the contract setting the deployer as the initial owner.\\n     */\\n    constructor() {\\n        _transferOwnership(_msgSender());\\n    }\\n\\n    /**\\n     * @dev Returns the address of the current owner.\\n     */\\n    function owner() public view virtual returns (address) {\\n        return _owner;\\n    }\\n\\n    /**\\n     * @dev Throws if called by any account other than the owner.\\n     */\\n    modifier onlyOwner() {\\n        require(owner() == _msgSender(), \\\"Ownable: caller is not the owner\\\");\\n        _;\\n    }\\n\\n    /**\\n     * @dev Leaves the contract without owner. It will not be possible to call\\n     * `onlyOwner` functions anymore. Can only be called by the current owner.\\n     *\\n     * NOTE: Renouncing ownership will leave the contract without an owner,\\n     * thereby removing any functionality that is only available to the owner.\\n     */\\n    function renounceOwnership() public virtual onlyOwner {\\n        _transferOwnership(address(0));\\n    }\\n\\n    /**\\n     * @dev Transfers ownership of the contract to a new account (`newOwner`).\\n     * Can only be called by the current owner.\\n     */\\n    function transferOwnership(address newOwner) public virtual onlyOwner {\\n        require(newOwner != address(0), \\\"Ownable: new owner is the zero address\\\");\\n        _transferOwnership(newOwner);\\n    }\\n\\n    /**\\n     * @dev Transfers ownership of the contract to a new account (`newOwner`).\\n     * Internal function without access restriction.\\n     */\\n    function _transferOwnership(address newOwner) internal virtual {\\n        address oldOwner = _owner;\\n        _owner = newOwner;\\n        emit OwnershipTransferred(oldOwner, newOwner);\\n    }\\n}\\n\\n// File: @openzeppelin/contracts/utils/Address.sol\\n\\n\\n// OpenZeppelin Contracts (last updated v4.5.0) (utils/Address.sol)\\n\\npragma solidity ^0.8.1;\\n\\n/**\\n * @dev Collection of functions related to the address type\\n */\\nlibrary Address {\\n    /**\\n     * @dev Returns true if `account` is a contract.\\n     *\\n     * [IMPORTANT]\\n     * ====\\n     * It is unsafe to assume that an address for which this function returns\\n     * false is an externally-owned account (EOA) and not a contract.\\n     *\\n     * Among others, `isContract` will return false for the following\\n     * types of addresses:\\n     *\\n     *  - an externally-owned account\\n     *  - a contract in construction\\n     *  - an address where a contract will be created\\n     *  - an address where a contract lived, but was destroyed\\n     * ====\\n     *\\n     * [IMPORTANT]\\n     * ====\\n     * You shouldn't rely on `isContract` to protect against flash loan attacks!\\n     *\\n     * Preventing calls from contracts is highly discouraged. It breaks composability, breaks support for smart wallets\\n     * like Gnosis Safe, and does not provide security since it can be circumvented by calling from a contract\\n     * constructor.\\n     * ====\\n     */\\n    function isContract(address account) internal view returns (bool) {\\n        // This method relies on extcodesize/address.code.length, which returns 0\\n        // for contracts in construction, since the code is only stored at the end\\n        // of the constructor execution.\\n\\n        return account.code.length > 0;\\n    }\\n\\n    /**\\n     * @dev Replacement for Solidity's `transfer`: sends `amount` wei to\\n     * `recipient`, forwarding all available gas and reverting on errors.\\n     *\\n     * https://eips.ethereum.org/EIPS/eip-1884[EIP1884] increases the gas cost\\n     * of certain opcodes, possibly making contracts go over the 2300 gas limit\\n     * imposed by `transfer`, making them unable to receive funds via\\n     * `transfer`. {sendValue} removes this limitation.\\n     *\\n     * https://diligence.consensys.net/posts/2019/09/stop-using-soliditys-transfer-now/[Learn more].\\n     *\\n     * IMPORTANT: because control is transferred to `recipient`, care must be\\n     * taken to not create reentrancy vulnerabilities. Consider using\\n     * {ReentrancyGuard} or the\\n     * https://solidity.readthedocs.io/en/v0.5.11/security-considerations.html#use-the-checks-effects-interactions-pattern[checks-effects-interactions pattern].\\n     */\\n    function sendValue(address payable recipient, uint256 amount) internal {\\n        require(address(this).balance >= amount, \\\"Address: insufficient balance\\\");\\n\\n        (bool success,) = recipient.call{value : amount}(\\\"\\\");\\n        require(success, \\\"Address: unable to send value, recipient may have reverted\\\");\\n    }\\n\\n    /**\\n     * @dev Performs a Solidity function call using a low level `call`. A\\n     * plain `call` is an unsafe replacement for a function call: use this\\n     * function instead.\\n     *\\n     * If `target` reverts with a revert reason, it is bubbled up by this\\n     * function (like regular Solidity function calls).\\n     *\\n     * Returns the raw returned data. To convert to the expected return value,\\n     * use https://solidity.readthedocs.io/en/latest/units-and-global-variables.html?highlight=abi.decode#abi-encoding-and-decoding-functions[`abi.decode`].\\n     *\\n     * Requirements:\\n     *\\n     * - `target` must be a contract.\\n     * - calling `target` with `data` must not revert.\\n     *\\n     * _Available since v3.1._\\n     */\\n    function functionCall(address target, bytes memory data) internal returns (bytes memory) {\\n        return functionCall(target, data, \\\"Address: low-level call failed\\\");\\n    }\\n\\n    /**\\n     * @dev Same as {xref-Address-functionCall-address-bytes-}[`functionCall`], but with\\n     * `errorMessage` as a fallback revert reason when `target` reverts.\\n     *\\n     * _Available since v3.1._\\n     */\\n    function functionCall(\\n        address target,\\n        bytes memory data,\\n        string memory errorMessage\\n    ) internal returns (bytes memory) {\\n        return functionCallWithValue(target, data, 0, errorMessage);\\n    }\\n\\n    /**\\n     * @dev Same as {xref-Address-functionCall-address-bytes-}[`functionCall`],\\n     * but also transferring `value` wei to `target`.\\n     *\\n     * Requirements:\\n     *\\n     * - the calling contract must have an ETH balance of at least `value`.\\n     * - the called Solidity function must be `payable`.\\n     *\\n     * _Available since v3.1._\\n     */\\n    function functionCallWithValue(\\n        address target,\\n        bytes memory data,\\n        uint256 value\\n    ) internal returns (bytes memory) {\\n        return functionCallWithValue(target, data, value, \\\"Address: low-level call with value failed\\\");\\n    }\\n\\n    /**\\n     * @dev Same as {xref-Address-functionCallWithValue-address-bytes-uint256-}[`functionCallWithValue`], but\\n     * with `errorMessage` as a fallback revert reason when `target` reverts.\\n     *\\n     * _Available since v3.1._\\n     */\\n    function functionCallWithValue(\\n        address target,\\n        bytes memory data,\\n        uint256 value,\\n        string memory errorMessage\\n    ) internal returns (bytes memory) {\\n        require(address(this).balance >= value, \\\"Address: insufficient balance for call\\\");\\n        require(isContract(target), \\\"Address: call to non-contract\\\");\\n\\n        (bool success, bytes memory returndata) = target.call{value : value}(data);\\n        return verifyCallResult(success, returndata, errorMessage);\\n    }\\n\\n    /**\\n     * @dev Same as {xref-Address-functionCall-address-bytes-}[`functionCall`],\\n     * but performing a static call.\\n     *\\n     * _Available since v3.3._\\n     */\\n    function functionStaticCall(address target, bytes memory data) internal view returns (bytes memory) {\\n        return functionStaticCall(target, data, \\\"Address: low-level static call failed\\\");\\n    }\\n\\n    /**\\n     * @dev Same as {xref-Address-functionCall-address-bytes-string-}[`functionCall`],\\n     * but performing a static call.\\n     *\\n     * _Available since v3.3._\\n     */\\n    function functionStaticCall(\\n        address target,\\n        bytes memory data,\\n        string memory errorMessage\\n    ) internal view returns (bytes memory) {\\n        require(isContract(target), \\\"Address: static call to non-contract\\\");\\n\\n        (bool success, bytes memory returndata) = target.staticcall(data);\\n        return verifyCallResult(success, returndata, errorMessage);\\n    }\\n\\n    /**\\n     * @dev Same as {xref-Address-functionCall-address-bytes-}[`functionCall`],\\n     * but performing a delegate call.\\n     *\\n     * _Available since v3.4._\\n     */\\n    function functionDelegateCall(address target, bytes memory data) internal returns (bytes memory) {\\n        return functionDelegateCall(target, data, \\\"Address: low-level delegate call failed\\\");\\n    }\\n\\n    /**\\n     * @dev Same as {xref-Address-functionCall-address-bytes-string-}[`functionCall`],\\n     * but performing a delegate call.\\n     *\\n     * _Available since v3.4._\\n     */\\n    function functionDelegateCall(\\n        address target,\\n        bytes memory data,\\n        string memory errorMessage\\n    ) internal returns (bytes memory) {\\n        require(isContract(target), \\\"Address: delegate call to non-contract\\\");\\n\\n        (bool success, bytes memory returndata) = target.delegatecall(data);\\n        return verifyCallResult(success, returndata, errorMessage);\\n    }\\n\\n    /**\\n     * @dev Tool to verifies that a low level call was successful, and revert if it wasn't, either by bubbling the\\n     * revert reason using the provided one.\\n     *\\n     * _Available since v4.3._\\n     */\\n    function verifyCallResult(\\n        bool success,\\n        bytes memory returndata,\\n        string memory errorMessage\\n    ) internal pure returns (bytes memory) {\\n        if (success) {\\n            return returndata;\\n        } else {\\n            // Look for revert reason and bubble it up if present\\n            if (returndata.length > 0) {\\n                // The easiest way to bubble the revert reason is using memory via assembly\\n\\n                assembly {\\n                    let returndata_size := mload(returndata)\\n                    revert(add(32, returndata), returndata_size)\\n                }\\n            } else {\\n                revert(errorMessage);\\n            }\\n        }\\n    }\\n}\\n\\n// File: @openzeppelin/contracts/token/ERC721/IERC721Receiver.sol\\n\\n\\n// OpenZeppelin Contracts v4.4.1 (token/ERC721/IERC721Receiver.sol)\\n\\npragma solidity ^0.8.0;\\n\\n/**\\n * @title ERC721 token receiver interface\\n * @dev Interface for any contract that wants to support safeTransfers\\n * from ERC721 asset contracts.\\n */\\ninterface IERC721Receiver {\\n    /**\\n     * @dev Whenever an {IERC721} `tokenId` token is transferred to this contract via {IERC721-safeTransferFrom}\\n     * by `operator` from `from`, this function is called.\\n     *\\n     * It must return its Solidity selector to confirm the token transfer.\\n     * If any other value is returned or the interface is not implemented by the recipient, the transfer will be reverted.\\n     *\\n     * The selector can be obtained in Solidity with `IERC721.onERC721Received.selector`.\\n     */\\n    function onERC721Received(\\n        address operator,\\n        address from,\\n        uint256 tokenId,\\n        bytes calldata data\\n    ) external returns (bytes4);\\n}\\n\\n// File: @openzeppelin/contracts/utils/introspection/IERC165.sol\\n\\n\\n// OpenZeppelin Contracts v4.4.1 (utils/introspection/IERC165.sol)\\n\\npragma solidity ^0.8.0;\\n\\n/**\\n * @dev Interface of the ERC165 standard, as defined in the\\n * https://eips.ethereum.org/EIPS/eip-165[EIP].\\n *\\n * Implementers can declare support of contract interfaces, which can then be\\n * queried by others ({ERC165Checker}).\\n *\\n * For an implementation, see {ERC165}.\\n */\\ninterface IERC165 {\\n    /**\\n     * @dev Returns true if this contract implements the interface defined by\\n     * `interfaceId`. See the corresponding\\n     * https://eips.ethereum.org/EIPS/eip-165#how-interfaces-are-identified[EIP section]\\n     * to learn more about how these ids are created.\\n     *\\n     * This function call must use less than 30 000 gas.\\n     */\\n    function supportsInterface(bytes4 interfaceId) external view returns (bool);\\n}\\n\\n// File: @openzeppelin/contracts/utils/introspection/ERC165.sol\\n\\n\\n// OpenZeppelin Contracts v4.4.1 (utils/introspection/ERC165.sol)\\n\\npragma solidity ^0.8.0;\\n\\n\\n/**\\n * @dev Implementation of the {IERC165} interface.\\n *\\n * Contracts that want to implement ERC165 should inherit from this contract and override {supportsInterface} to check\\n * for the additional interface id that will be supported. For example:\\n *\\n * ```solidity\\n * function supportsInterface(bytes4 interfaceId) public view virtual override returns (bool) {\\n *     return interfaceId == type(MyInterface).interfaceId || super.supportsInterface(interfaceId);\\n * }\\n * ```\\n *\\n * Alternatively, {ERC165Storage} provides an easier to use but more expensive implementation.\\n */\\nabstract contract ERC165 is IERC165 {\\n    /**\\n     * @dev See {IERC165-supportsInterface}.\\n     */\\n    function supportsInterface(bytes4 interfaceId) public view virtual override returns (bool) {\\n        return interfaceId == type(IERC165).interfaceId;\\n    }\\n}\\n\\n// File: @openzeppelin/contracts/token/ERC721/IERC721.sol\\n\\n\\n// OpenZeppelin Contracts v4.4.1 (token/ERC721/IERC721.sol)\\n\\npragma solidity ^0.8.0;\\n\\n\\n/**\\n * @dev Required interface of an ERC721 compliant contract.\\n */\\ninterface IERC721 is IERC165 {\\n    /**\\n     * @dev Emitted when `tokenId` token is transferred from `from` to `to`.\\n     */\\n    event Transfer(address indexed from, address indexed to, uint256 indexed tokenId);\\n\\n    /**\\n     * @dev Emitted when `owner` enables `approved` to manage the `tokenId` token.\\n     */\\n    event Approval(address indexed owner, address indexed approved, uint256 indexed tokenId);\\n\\n    /**\\n     * @dev Emitted when `owner` enables or disables (`approved`) `operator` to manage all of its assets.\\n     */\\n    event ApprovalForAll(address indexed owner, address indexed operator, bool approved);\\n\\n    /**\\n     * @dev Returns the number of tokens in ``owner``'s account.\\n     */\\n    function balanceOf(address owner) external view returns (uint256 balance);\\n\\n    /**\\n     * @dev Returns the owner of the `tokenId` token.\\n     *\\n     * Requirements:\\n     *\\n     * - `tokenId` must exist.\\n     */\\n    function ownerOf(uint256 tokenId) external view returns (address owner);\\n\\n    /**\\n     * @dev Safely transfers `tokenId` token from `from` to `to`, checking first that contract recipients\\n     * are aware of the ERC721 protocol to prevent tokens from being forever locked.\\n     *\\n     * Requirements:\\n     *\\n     * - `from` cannot be the zero address.\\n     * - `to` cannot be the zero address.\\n     * - `tokenId` token must exist and be owned by `from`.\\n     * - If the caller is not `from`, it must be have been allowed to move this token by either {approve} or {setApprovalForAll}.\\n     * - If `to` refers to a smart contract, it must implement {IERC721Receiver-onERC721Received}, which is called upon a safe transfer.\\n     *\\n     * Emits a {Transfer} event.\\n     */\\n    function safeTransferFrom(\\n        address from,\\n        address to,\\n        uint256 tokenId\\n    ) external;\\n\\n    /**\\n     * @dev Transfers `tokenId` token from `from` to `to`.\\n     *\\n     * WARNING: Usage of this method is discouraged, use {safeTransferFrom} whenever possible.\\n     *\\n     * Requirements:\\n     *\\n     * - `from` cannot be the zero address.\\n     * - `to` cannot be the zero address.\\n     * - `tokenId` token must be owned by `from`.\\n     * - If the caller is not `from`, it must be approved to move this token by either {approve} or {setApprovalForAll}.\\n     *\\n     * Emits a {Transfer} event.\\n     */\\n    function transferFrom(\\n        address from,\\n        address to,\\n        uint256 tokenId\\n    ) external;\\n\\n    /**\\n     * @dev Gives permission to `to` to transfer `tokenId` token to another account.\\n     * The approval is cleared when the token is transferred.\\n     *\\n     * Only a single account can be approved at a time, so approving the zero address clears previous approvals.\\n     *\\n     * Requirements:\\n     *\\n     * - The caller must own the token or be an approved operator.\\n     * - `tokenId` must exist.\\n     *\\n     * Emits an {Approval} event.\\n     */\\n    function approve(address to, uint256 tokenId) external;\\n\\n    /**\\n     * @dev Returns the account approved for `tokenId` token.\\n     *\\n     * Requirements:\\n     *\\n     * - `tokenId` must exist.\\n     */\\n    function getApproved(uint256 tokenId) external view returns (address operator);\\n\\n    /**\\n     * @dev Approve or remove `operator` as an operator for the caller.\\n     * Operators can call {transferFrom} or {safeTransferFrom} for any token owned by the caller.\\n     *\\n     * Requirements:\\n     *\\n     * - The `operator` cannot be the caller.\\n     *\\n     * Emits an {ApprovalForAll} event.\\n     */\\n    function setApprovalForAll(address operator, bool _approved) external;\\n\\n    /**\\n     * @dev Returns if the `operator` is allowed to manage all of the assets of `owner`.\\n     *\\n     * See {setApprovalForAll}\\n     */\\n    function isApprovedForAll(address owner, address operator) external view returns (bool);\\n\\n    /**\\n     * @dev Safely transfers `tokenId` token from `from` to `to`.\\n     *\\n     * Requirements:\\n     *\\n     * - `from` cannot be the zero address.\\n     * - `to` cannot be the zero address.\\n     * - `tokenId` token must exist and be owned by `from`.\\n     * - If the caller is not `from`, it must be approved to move this token by either {approve} or {setApprovalForAll}.\\n     * - If `to` refers to a smart contract, it must implement {IERC721Receiver-onERC721Received}, which is called upon a safe transfer.\\n     *\\n     * Emits a {Transfer} event.\\n     */\\n    function safeTransferFrom(\\n        address from,\\n        address to,\\n        uint256 tokenId,\\n        bytes calldata data\\n    ) external;\\n}\\n\\n// File: @openzeppelin/contracts/token/ERC721/extensions/IERC721Enumerable.sol\\n\\n\\n// OpenZeppelin Contracts (last updated v4.5.0) (token/ERC721/extensions/IERC721Enumerable.sol)\\n\\npragma solidity ^0.8.0;\\n\\n\\n/**\\n * @title ERC-721 Non-Fungible Token Standard, optional enumeration extension\\n * @dev See https://eips.ethereum.org/EIPS/eip-721\\n */\\ninterface IERC721Enumerable is IERC721 {\\n    /**\\n     * @dev Returns the total amount of tokens stored by the contract.\\n     */\\n    function totalSupply() external view returns (uint256);\\n\\n    /**\\n     * @dev Returns a token ID owned by `owner` at a given `index` of its token list.\\n     * Use along with {balanceOf} to enumerate all of ``owner``'s tokens.\\n     */\\n    function tokenOfOwnerByIndex(address owner, uint256 index) external view returns (uint256);\\n\\n    /**\\n     * @dev Returns a token ID at a given `index` of all the tokens stored by the contract.\\n     * Use along with {totalSupply} to enumerate all tokens.\\n     */\\n    function tokenByIndex(uint256 index) external view returns (uint256);\\n}\\n\\n// File: @openzeppelin/contracts/token/ERC721/extensions/IERC721Metadata.sol\\n\\n\\n// OpenZeppelin Contracts v4.4.1 (token/ERC721/extensions/IERC721Metadata.sol)\\n\\npragma solidity ^0.8.0;\\n\\n\\n/**\\n * @title ERC-721 Non-Fungible Token Standard, optional metadata extension\\n * @dev See https://eips.ethereum.org/EIPS/eip-721\\n */\\ninterface IERC721Metadata is IERC721 {\\n    /**\\n     * @dev Returns the token collection name.\\n     */\\n    function name() external view returns (string memory);\\n\\n    /**\\n     * @dev Returns the token collection symbol.\\n     */\\n    function symbol() external view returns (string memory);\\n\\n    /**\\n     * @dev Returns the Uniform Resource Identifier (URI) for `tokenId` token.\\n     */\\n    function tokenURI(uint256 tokenId) external view returns (string memory);\\n}\\n\\n// File: @openzeppelin/contracts/token/ERC721/ERC721.sol\\n\\n\\n// OpenZeppelin Contracts (last updated v4.5.0) (token/ERC721/ERC721.sol)\\n\\npragma solidity ^0.8.0;\\n\\n\\n\\n\\n\\n\\n\\n\\n/**\\n * @dev Implementation of https://eips.ethereum.org/EIPS/eip-721[ERC721] Non-Fungible Token Standard, including\\n * the Metadata extension, but not including the Enumerable extension, which is available separately as\\n * {ERC721Enumerable}.\\n */\\ncontract ERC721 is Context, ERC165, IERC721, IERC721Metadata {\\n    using Address for address;\\n    using Strings for uint256;\\n\\n    // Token name\\n    string private _name;\\n\\n    // Token symbol\\n    string private _symbol;\\n\\n    // Mapping from token ID to owner address\\n    mapping(uint256 => address) private _owners;\\n\\n    // Mapping owner address to token count\\n    mapping(address => uint256) private _balances;\\n\\n    // Mapping from token ID to approved address\\n    mapping(uint256 => address) private _tokenApprovals;\\n\\n    // Mapping from owner to operator approvals\\n    mapping(address => mapping(address => bool)) private _operatorApprovals;\\n\\n    /**\\n     * @dev Initializes the contract by setting a `name` and a `symbol` to the token collection.\\n     */\\n    constructor(string memory name_, string memory symbol_) {\\n        _name = name_;\\n        _symbol = symbol_;\\n    }\\n\\n    /**\\n     * @dev See {IERC165-supportsInterface}.\\n     */\\n    function supportsInterface(bytes4 interfaceId) public view virtual override(ERC165, IERC165) returns (bool) {\\n        return\\n        interfaceId == type(IERC721).interfaceId ||\\n        interfaceId == type(IERC721Metadata).interfaceId ||\\n        super.supportsInterface(interfaceId);\\n    }\\n\\n    /**\\n     * @dev See {IERC721-balanceOf}.\\n     */\\n    function balanceOf(address owner) public view virtual override returns (uint256) {\\n        require(owner != address(0), \\\"ERC721: balance query for the zero address\\\");\\n        return _balances[owner];\\n    }\\n\\n    /**\\n     * @dev See {IERC721-ownerOf}.\\n     */\\n    function ownerOf(uint256 tokenId) public view virtual override returns (address) {\\n        address owner = _owners[tokenId];\\n        require(owner != address(0), \\\"ERC721: owner query for nonexistent token\\\");\\n        return owner;\\n    }\\n\\n    /**\\n     * @dev See {IERC721Metadata-name}.\\n     */\\n    function name() public view virtual override returns (string memory) {\\n        return _name;\\n    }\\n\\n    /**\\n     * @dev See {IERC721Metadata-symbol}.\\n     */\\n    function symbol() public view virtual override returns (string memory) {\\n        return _symbol;\\n    }\\n\\n    /**\\n     * @dev See {IERC721Metadata-tokenURI}.\\n     */\\n    function tokenURI(uint256 tokenId) public view virtual override returns (string memory) {\\n        require(_exists(tokenId), \\\"ERC721Metadata: URI query for nonexistent token\\\");\\n\\n        string memory baseURI = _baseURI();\\n        return bytes(baseURI).length > 0 ? string(abi.encodePacked(baseURI, tokenId.toString())) : \\\"\\\";\\n    }\\n\\n    /**\\n     * @dev Base URI for computing {tokenURI}. If set, the resulting URI for each\\n     * token will be the concatenation of the `baseURI` and the `tokenId`. Empty\\n     * by default, can be overriden in child contracts.\\n     */\\n    function _baseURI() internal view virtual returns (string memory) {\\n        return \\\"\\\";\\n    }\\n\\n    /**\\n     * @dev See {IERC721-approve}.\\n     */\\n    function approve(address to, uint256 tokenId) public virtual override {\\n        address owner = ERC721.ownerOf(tokenId);\\n        require(to != owner, \\\"ERC721: approval to current owner\\\");\\n\\n        require(\\n            _msgSender() == owner || isApprovedForAll(owner, _msgSender()),\\n            \\\"ERC721: approve caller is not owner nor approved for all\\\"\\n        );\\n\\n        _approve(to, tokenId);\\n    }\\n\\n    /**\\n     * @dev See {IERC721-getApproved}.\\n     */\\n    function getApproved(uint256 tokenId) public view virtual override returns (address) {\\n        require(_exists(tokenId), \\\"ERC721: approved query for nonexistent token\\\");\\n\\n        return _tokenApprovals[tokenId];\\n    }\\n\\n    /**\\n     * @dev See {IERC721-setApprovalForAll}.\\n     */\\n    function setApprovalForAll(address operator, bool approved) public virtual override {\\n        _setApprovalForAll(_msgSender(), operator, approved);\\n    }\\n\\n    /**\\n     * @dev See {IERC721-isApprovedForAll}.\\n     */\\n    function isApprovedForAll(address owner, address operator) public view virtual override returns (bool) {\\n        return _operatorApprovals[owner][operator];\\n    }\\n\\n    /**\\n     * @dev See {IERC721-transferFrom}.\\n     */\\n    function transferFrom(\\n        address from,\\n        address to,\\n        uint256 tokenId\\n    ) public virtual override {\\n        //solhint-disable-next-line max-line-length\\n        require(_isApprovedOrOwner(_msgSender(), tokenId), \\\"ERC721: transfer caller is not owner nor approved\\\");\\n\\n        _transfer(from, to, tokenId);\\n    }\\n\\n    /**\\n     * @dev See {IERC721-safeTransferFrom}.\\n     */\\n    function safeTransferFrom(\\n        address from,\\n        address to,\\n        uint256 tokenId\\n    ) public virtual override {\\n        safeTransferFrom(from, to, tokenId, \\\"\\\");\\n    }\\n\\n    /**\\n     * @dev See {IERC721-safeTransferFrom}.\\n     */\\n    function safeTransferFrom(\\n        address from,\\n        address to,\\n        uint256 tokenId,\\n        bytes memory _data\\n    ) public virtual override {\\n        require(_isApprovedOrOwner(_msgSender(), tokenId), \\\"ERC721: transfer caller is not owner nor approved\\\");\\n        _safeTransfer(from, to, tokenId, _data);\\n    }\\n\\n    /**\\n     * @dev Safely transfers `tokenId` token from `from` to `to`, checking first that contract recipients\\n     * are aware of the ERC721 protocol to prevent tokens from being forever locked.\\n     *\\n     * `_data` is additional data, it has no specified format and it is sent in call to `to`.\\n     *\\n     * This internal function is equivalent to {safeTransferFrom}, and can be used to e.g.\\n     * implement alternative mechanisms to perform token transfer, such as signature-based.\\n     *\\n     * Requirements:\\n     *\\n     * - `from` cannot be the zero address.\\n     * - `to` cannot be the zero address.\\n     * - `tokenId` token must exist and be owned by `from`.\\n     * - If `to` refers to a smart contract, it must implement {IERC721Receiver-onERC721Received}, which is called upon a safe transfer.\\n     *\\n     * Emits a {Transfer} event.\\n     */\\n    function _safeTransfer(\\n        address from,\\n        address to,\\n        uint256 tokenId,\\n        bytes memory _data\\n    ) internal virtual {\\n        _transfer(from, to, tokenId);\\n        require(_checkOnERC721Received(from, to, tokenId, _data), \\\"ERC721: transfer to non ERC721Receiver implementer\\\");\\n    }\\n\\n    /**\\n     * @dev Returns whether `tokenId` exists.\\n     *\\n     * Tokens can be managed by their owner or approved accounts via {approve} or {setApprovalForAll}.\\n     *\\n     * Tokens start existing when they are minted (`_mint`),\\n     * and stop existing when they are burned (`_burn`).\\n     */\\n    function _exists(uint256 tokenId) internal view virtual returns (bool) {\\n        return _owners[tokenId] != address(0);\\n    }\\n\\n    /**\\n     * @dev Returns whether `spender` is allowed to manage `tokenId`.\\n     *\\n     * Requirements:\\n     *\\n     * - `tokenId` must exist.\\n     */\\n    function _isApprovedOrOwner(address spender, uint256 tokenId) internal view virtual returns (bool) {\\n        require(_exists(tokenId), \\\"ERC721: operator query for nonexistent token\\\");\\n        address owner = ERC721.ownerOf(tokenId);\\n        return (spender == owner || getApproved(tokenId) == spender || isApprovedForAll(owner, spender));\\n    }\\n\\n    /**\\n     * @dev Safely mints `tokenId` and transfers it to `to`.\\n     *\\n     * Requirements:\\n     *\\n     * - `tokenId` must not exist.\\n     * - If `to` refers to a smart contract, it must implement {IERC721Receiver-onERC721Received}, which is called upon a safe transfer.\\n     *\\n     * Emits a {Transfer} event.\\n     */\\n    function _safeMint(address to, uint256 tokenId) internal virtual {\\n        _safeMint(to, tokenId, \\\"\\\");\\n    }\\n\\n    /**\\n     * @dev Same as {xref-ERC721-_safeMint-address-uint256-}[`_safeMint`], with an additional `data` parameter which is\\n     * forwarded in {IERC721Receiver-onERC721Received} to contract recipients.\\n     */\\n    function _safeMint(\\n        address to,\\n        uint256 tokenId,\\n        bytes memory _data\\n    ) internal virtual {\\n        _mint(to, tokenId);\\n        require(\\n            _checkOnERC721Received(address(0), to, tokenId, _data),\\n            \\\"ERC721: transfer to non ERC721Receiver implementer\\\"\\n        );\\n    }\\n\\n    /**\\n     * @dev Mints `tokenId` and transfers it to `to`.\\n     *\\n     * WARNING: Usage of this method is discouraged, use {_safeMint} whenever possible\\n     *\\n     * Requirements:\\n     *\\n     * - `tokenId` must not exist.\\n     * - `to` cannot be the zero address.\\n     *\\n     * Emits a {Transfer} event.\\n     */\\n    function _mint(address to, uint256 tokenId) internal virtual {\\n        require(to != address(0), \\\"ERC721: mint to the zero address\\\");\\n        require(!_exists(tokenId), \\\"ERC721: token already minted\\\");\\n\\n        _beforeTokenTransfer(address(0), to, tokenId);\\n\\n        _balances[to] += 1;\\n        _owners[tokenId] = to;\\n\\n        emit Transfer(address(0), to, tokenId);\\n\\n        _afterTokenTransfer(address(0), to, tokenId);\\n    }\\n\\n    /**\\n     * @dev Destroys `tokenId`.\\n     * The approval is cleared when the token is burned.\\n     *\\n     * Requirements:\\n     *\\n     * - `tokenId` must exist.\\n     *\\n     * Emits a {Transfer} event.\\n     */\\n    function _burn(uint256 tokenId) internal virtual {\\n        address owner = ERC721.ownerOf(tokenId);\\n\\n        _beforeTokenTransfer(owner, address(0), tokenId);\\n\\n        // Clear approvals\\n        _approve(address(0), tokenId);\\n\\n        _balances[owner] -= 1;\\n        delete _owners[tokenId];\\n\\n        emit Transfer(owner, address(0), tokenId);\\n\\n        _afterTokenTransfer(owner, address(0), tokenId);\\n    }\\n\\n    /**\\n     * @dev Transfers `tokenId` from `from` to `to`.\\n     *  As opposed to {transferFrom}, this imposes no restrictions on msg.sender.\\n     *\\n     * Requirements:\\n     *\\n     * - `to` cannot be the zero address.\\n     * - `tokenId` token must be owned by `from`.\\n     *\\n     * Emits a {Transfer} event.\\n     */\\n    function _transfer(\\n        address from,\\n        address to,\\n        uint256 tokenId\\n    ) internal virtual {\\n        require(ERC721.ownerOf(tokenId) == from, \\\"ERC721: transfer from incorrect owner\\\");\\n        require(to != address(0), \\\"ERC721: transfer to the zero address\\\");\\n\\n        _beforeTokenTransfer(from, to, tokenId);\\n\\n        // Clear approvals from the previous owner\\n        _approve(address(0), tokenId);\\n\\n        _balances[from] -= 1;\\n        _balances[to] += 1;\\n        _owners[tokenId] = to;\\n\\n        emit Transfer(from, to, tokenId);\\n\\n        _afterTokenTransfer(from, to, tokenId);\\n    }\\n\\n    /**\\n     * @dev Approve `to` to operate on `tokenId`\\n     *\\n     * Emits a {Approval} event.\\n     */\\n    function _approve(address to, uint256 tokenId) internal virtual {\\n        _tokenApprovals[tokenId] = to;\\n        emit Approval(ERC721.ownerOf(tokenId), to, tokenId);\\n    }\\n\\n    /**\\n     * @dev Approve `operator` to operate on all of `owner` tokens\\n     *\\n     * Emits a {ApprovalForAll} event.\\n     */\\n    function _setApprovalForAll(\\n        address owner,\\n        address operator,\\n        bool approved\\n    ) internal virtual {\\n        require(owner != operator, \\\"ERC721: approve to caller\\\");\\n        _operatorApprovals[owner][operator] = approved;\\n        emit ApprovalForAll(owner, operator, approved);\\n    }\\n\\n    /**\\n     * @dev Internal function to invoke {IERC721Receiver-onERC721Received} on a target address.\\n     * The call is not executed if the target address is not a contract.\\n     *\\n     * @param from address representing the previous owner of the given token ID\\n     * @param to target address that will receive the tokens\\n     * @param tokenId uint256 ID of the token to be transferred\\n     * @param _data bytes optional data to send along with the call\\n     * @return bool whether the call correctly returned the expected magic value\\n     */\\n    function _checkOnERC721Received(\\n        address from,\\n        address to,\\n        uint256 tokenId,\\n        bytes memory _data\\n    ) private returns (bool) {\\n        if (to.isContract()) {\\n            try IERC721Receiver(to).onERC721Received(_msgSender(), from, tokenId, _data) returns (bytes4 retval) {\\n                return retval == IERC721Receiver.onERC721Received.selector;\\n            } catch (bytes memory reason) {\\n                if (reason.length == 0) {\\n                    revert(\\\"ERC721: transfer to non ERC721Receiver implementer\\\");\\n                } else {\\n                    assembly {\\n                        revert(add(32, reason), mload(reason))\\n                    }\\n                }\\n            }\\n        } else {\\n            return true;\\n        }\\n    }\\n\\n    /**\\n     * @dev Hook that is called before any token transfer. This includes minting\\n     * and burning.\\n     *\\n     * Calling conditions:\\n     *\\n     * - When `from` and `to` are both non-zero, ``from``'s `tokenId` will be\\n     * transferred to `to`.\\n     * - When `from` is zero, `tokenId` will be minted for `to`.\\n     * - When `to` is zero, ``from``'s `tokenId` will be burned.\\n     * - `from` and `to` are never both zero.\\n     *\\n     * To learn more about hooks, head to xref:ROOT:extending-contracts.adoc#using-hooks[Using Hooks].\\n     */\\n    function _beforeTokenTransfer(\\n        address from,\\n        address to,\\n        uint256 tokenId\\n    ) internal virtual {}\\n\\n    /**\\n     * @dev Hook that is called after any transfer of tokens. This includes\\n     * minting and burning.\\n     *\\n     * Calling conditions:\\n     *\\n     * - when `from` and `to` are both non-zero.\\n     * - `from` and `to` are never both zero.\\n     *\\n     * To learn more about hooks, head to xref:ROOT:extending-contracts.adoc#using-hooks[Using Hooks].\\n     */\\n    function _afterTokenTransfer(\\n        address from,\\n        address to,\\n        uint256 tokenId\\n    ) internal virtual {}\\n}\\n\\n// File: @openzeppelin/contracts/token/ERC721/extensions/ERC721Enumerable.sol\\n\\n\\n// OpenZeppelin Contracts v4.4.1 (token/ERC721/extensions/ERC721Enumerable.sol)\\n\\npragma solidity ^0.8.0;\\n\\n\\n\\n/**\\n * @dev This implements an optional extension of {ERC721} defined in the EIP that adds\\n * enumerability of all the token ids in the contract as well as all token ids owned by each\\n * account.\\n */\\nabstract contract ERC721Enumerable is ERC721, IERC721Enumerable {\\n    // Mapping from owner to list of owned token IDs\\n    mapping(address => mapping(uint256 => uint256)) private _ownedTokens;\\n\\n    // Mapping from token ID to index of the owner tokens list\\n    mapping(uint256 => uint256) private _ownedTokensIndex;\\n\\n    // Array with all token ids, used for enumeration\\n    uint256[] private _allTokens;\\n\\n    // Mapping from token id to position in the allTokens array\\n    mapping(uint256 => uint256) private _allTokensIndex;\\n\\n    /**\\n     * @dev See {IERC165-supportsInterface}.\\n     */\\n    function supportsInterface(bytes4 interfaceId) public view virtual override(IERC165, ERC721) returns (bool) {\\n        return interfaceId == type(IERC721Enumerable).interfaceId || super.supportsInterface(interfaceId);\\n    }\\n\\n    /**\\n     * @dev See {IERC721Enumerable-tokenOfOwnerByIndex}.\\n     */\\n    function tokenOfOwnerByIndex(address owner, uint256 index) public view virtual override returns (uint256) {\\n        require(index < ERC721.balanceOf(owner), \\\"ERC721Enumerable: owner index out of bounds\\\");\\n        return _ownedTokens[owner][index];\\n    }\\n\\n    /**\\n     * @dev See {IERC721Enumerable-totalSupply}.\\n     */\\n    function totalSupply() public view virtual override returns (uint256) {\\n        return _allTokens.length;\\n    }\\n\\n    /**\\n     * @dev See {IERC721Enumerable-tokenByIndex}.\\n     */\\n    function tokenByIndex(uint256 index) public view virtual override returns (uint256) {\\n        require(index < ERC721Enumerable.totalSupply(), \\\"ERC721Enumerable: global index out of bounds\\\");\\n        return _allTokens[index];\\n    }\\n\\n    /**\\n     * @dev Hook that is called before any token transfer. This includes minting\\n     * and burning.\\n     *\\n     * Calling conditions:\\n     *\\n     * - When `from` and `to` are both non-zero, ``from``'s `tokenId` will be\\n     * transferred to `to`.\\n     * - When `from` is zero, `tokenId` will be minted for `to`.\\n     * - When `to` is zero, ``from``'s `tokenId` will be burned.\\n     * - `from` cannot be the zero address.\\n     * - `to` cannot be the zero address.\\n     *\\n     * To learn more about hooks, head to xref:ROOT:extending-contracts.adoc#using-hooks[Using Hooks].\\n     */\\n    function _beforeTokenTransfer(\\n        address from,\\n        address to,\\n        uint256 tokenId\\n    ) internal virtual override {\\n        super._beforeTokenTransfer(from, to, tokenId);\\n\\n        if (from == address(0)) {\\n            _addTokenToAllTokensEnumeration(tokenId);\\n        } else if (from != to) {\\n            _removeTokenFromOwnerEnumeration(from, tokenId);\\n        }\\n        if (to == address(0)) {\\n            _removeTokenFromAllTokensEnumeration(tokenId);\\n        } else if (to != from) {\\n            _addTokenToOwnerEnumeration(to, tokenId);\\n        }\\n    }\\n\\n    /**\\n     * @dev Private function to add a token to this extension's ownership-tracking data structures.\\n     * @param to address representing the new owner of the given token ID\\n     * @param tokenId uint256 ID of the token to be added to the tokens list of the given address\\n     */\\n    function _addTokenToOwnerEnumeration(address to, uint256 tokenId) private {\\n        uint256 length = ERC721.balanceOf(to);\\n        _ownedTokens[to][length] = tokenId;\\n        _ownedTokensIndex[tokenId] = length;\\n    }\\n\\n    /**\\n     * @dev Private function to add a token to this extension's token tracking data structures.\\n     * @param tokenId uint256 ID of the token to be added to the tokens list\\n     */\\n    function _addTokenToAllTokensEnumeration(uint256 tokenId) private {\\n        _allTokensIndex[tokenId] = _allTokens.length;\\n        _allTokens.push(tokenId);\\n    }\\n\\n    /**\\n     * @dev Private function to remove a token from this extension's ownership-tracking data structures. Note that\\n     * while the token is not assigned a new owner, the `_ownedTokensIndex` mapping is _not_ updated: this allows for\\n     * gas optimizations e.g. when performing a transfer operation (avoiding double writes).\\n     * This has O(1) time complexity, but alters the order of the _ownedTokens array.\\n     * @param from address representing the previous owner of the given token ID\\n     * @param tokenId uint256 ID of the token to be removed from the tokens list of the given address\\n     */\\n    function _removeTokenFromOwnerEnumeration(address from, uint256 tokenId) private {\\n        // To prevent a gap in from's tokens array, we store the last token in the index of the token to delete, and\\n        // then delete the last slot (swap and pop).\\n\\n        uint256 lastTokenIndex = ERC721.balanceOf(from) - 1;\\n        uint256 tokenIndex = _ownedTokensIndex[tokenId];\\n\\n        // When the token to delete is the last token, the swap operation is unnecessary\\n        if (tokenIndex != lastTokenIndex) {\\n            uint256 lastTokenId = _ownedTokens[from][lastTokenIndex];\\n\\n            _ownedTokens[from][tokenIndex] = lastTokenId;\\n            // Move the last token to the slot of the to-delete token\\n            _ownedTokensIndex[lastTokenId] = tokenIndex;\\n            // Update the moved token's index\\n        }\\n\\n        // This also deletes the contents at the last position of the array\\n        delete _ownedTokensIndex[tokenId];\\n        delete _ownedTokens[from][lastTokenIndex];\\n    }\\n\\n    /**\\n     * @dev Private function to remove a token from this extension's token tracking data structures.\\n     * This has O(1) time complexity, but alters the order of the _allTokens array.\\n     * @param tokenId uint256 ID of the token to be removed from the tokens list\\n     */\\n    function _removeTokenFromAllTokensEnumeration(uint256 tokenId) private {\\n        // To prevent a gap in the tokens array, we store the last token in the index of the token to delete, and\\n        // then delete the last slot (swap and pop).\\n\\n        uint256 lastTokenIndex = _allTokens.length - 1;\\n        uint256 tokenIndex = _allTokensIndex[tokenId];\\n\\n        // When the token to delete is the last token, the swap operation is unnecessary. However, since this occurs so\\n        // rarely (when the last minted token is burnt) that we still do the swap here to avoid the gas cost of adding\\n        // an 'if' statement (like in _removeTokenFromOwnerEnumeration)\\n        uint256 lastTokenId = _allTokens[lastTokenIndex];\\n\\n        _allTokens[tokenIndex] = lastTokenId;\\n        // Move the last token to the slot of the to-delete token\\n        _allTokensIndex[lastTokenId] = tokenIndex;\\n        // Update the moved token's index\\n\\n        // This also deletes the contents at the last position of the array\\n        delete _allTokensIndex[tokenId];\\n        _allTokens.pop();\\n    }\\n}\\n\\n// File: hardhat/console.sol\\n\\n\\npragma solidity >= 0.4.22 <0.9.0;\\n\\nlibrary console {\\n    address constant CONSOLE_ADDRESS = address(0x000000000000000000636F6e736F6c652e6c6f67);\\n\\n    function _sendLogPayload(bytes memory payload) private view {\\n        uint256 payloadLength = payload.length;\\n        address consoleAddress = CONSOLE_ADDRESS;\\n        assembly {\\n            let payloadStart := add(payload, 32)\\n            let r := staticcall(gas(), consoleAddress, payloadStart, payloadLength, 0, 0)\\n        }\\n    }\\n\\n    function log() internal view {\\n        _sendLogPayload(abi.encodeWithSignature(\\\"log()\\\"));\\n    }\\n\\n    function logInt(int p0) internal view {\\n        _sendLogPayload(abi.encodeWithSignature(\\\"log(int)\\\", p0));\\n    }\\n\\n    function logUint(uint p0) internal view {\\n        _sendLogPayload(abi.encodeWithSignature(\\\"log(uint)\\\", p0));\\n    }\\n\\n    function logString(string memory p0) internal view {\\n        _sendLogPayload(abi.encodeWithSignature(\\\"log(string)\\\", p0));\\n    }\\n\\n    function logBool(bool p0) internal view {\\n        _sendLogPayload(abi.encodeWithSignature(\\\"log(bool)\\\", p0));\\n    }\\n\\n    function logAddress(address p0) internal view {\\n        _sendLogPayload(abi.encodeWithSignature(\\\"log(address)\\\", p0));\\n    }\\n\\n    function logBytes(bytes memory p0) internal view {\\n        _sendLogPayload(abi.encodeWithSignature(\\\"log(bytes)\\\", p0));\\n    }\\n\\n    function logBytes1(bytes1 p0) internal view {\\n        _sendLogPayload(abi.encodeWithSignature(\\\"log(bytes1)\\\", p0));\\n    }\\n\\n    function logBytes2(bytes2 p0) internal view {\\n        _sendLogPayload(abi.encodeWithSignature(\\\"log(bytes2)\\\", p0));\\n    }\\n\\n    function logBytes3(bytes3 p0) internal view {\\n        _sendLogPayload(abi.encodeWithSignature(\\\"log(bytes3)\\\", p0));\\n    }\\n\\n    function logBytes4(bytes4 p0) internal view {\\n        _sendLogPayload(abi.encodeWithSignature(\\\"log(bytes4)\\\", p0));\\n    }\\n\\n    function logBytes5(bytes5 p0) internal view {\\n        _sendLogPayload(abi.encodeWithSignature(\\\"log(bytes5)\\\", p0));\\n    }\\n\\n    function logBytes6(bytes6 p0) internal view {\\n        _sendLogPayload(abi.encodeWithSignature(\\\"log(bytes6)\\\", p0));\\n    }\\n\\n    function logBytes7(bytes7 p0) internal view {\\n        _sendLogPayload(abi.encodeWithSignature(\\\"log(bytes7)\\\", p0));\\n    }\\n\\n    function logBytes8(bytes8 p0) internal view {\\n        _sendLogPayload(abi.encodeWithSignature(\\\"log(bytes8)\\\", p0));\\n    }\\n\\n    function logBytes9(bytes9 p0) internal view {\\n        _sendLogPayload(abi.encodeWithSignature(\\\"log(bytes9)\\\", p0));\\n    }\\n\\n    function logBytes10(bytes10 p0) internal view {\\n        _sendLogPayload(abi.encodeWithSignature(\\\"log(bytes10)\\\", p0));\\n    }\\n\\n    function logBytes11(bytes11 p0) internal view {\\n        _sendLogPayload(abi.encodeWithSignature(\\\"log(bytes11)\\\", p0));\\n    }\\n\\n    function logBytes12(bytes12 p0) internal view {\\n        _sendLogPayload(abi.encodeWithSignature(\\\"log(bytes12)\\\", p0));\\n    }\\n\\n    function logBytes13(bytes13 p0) internal view {\\n        _sendLogPayload(abi.encodeWithSignature(\\\"log(bytes13)\\\", p0));\\n    }\\n\\n    function logBytes14(bytes14 p0) internal view {\\n        _sendLogPayload(abi.encodeWithSignature(\\\"log(bytes14)\\\", p0));\\n    }\\n\\n    function logBytes15(bytes15 p0) internal view {\\n        _sendLogPayload(abi.encodeWithSignature(\\\"log(bytes15)\\\", p0));\\n    }\\n\\n    function logBytes16(bytes16 p0) internal view {\\n        _sendLogPayload(abi.encodeWithSignature(\\\"log(bytes16)\\\", p0));\\n    }\\n\\n    function logBytes17(bytes17 p0) internal view {\\n        _sendLogPayload(abi.encodeWithSignature(\\\"log(bytes17)\\\", p0));\\n    }\\n\\n    function logBytes18(bytes18 p0) internal view {\\n        _sendLogPayload(abi.encodeWithSignature(\\\"log(bytes18)\\\", p0));\\n    }\\n\\n    function logBytes19(bytes19 p0) internal view {\\n        _sendLogPayload(abi.encodeWithSignature(\\\"log(bytes19)\\\", p0));\\n    }\\n\\n    function logBytes20(bytes20 p0) internal view {\\n        _sendLogPayload(abi.encodeWithSignature(\\\"log(bytes20)\\\", p0));\\n    }\\n\\n    function logBytes21(bytes21 p0) internal view {\\n        _sendLogPayload(abi.encodeWithSignature(\\\"log(bytes21)\\\", p0));\\n    }\\n\\n    function logBytes22(bytes22 p0) internal view {\\n        _sendLogPayload(abi.encodeWithSignature(\\\"log(bytes22)\\\", p0));\\n    }\\n\\n    function logBytes23(bytes23 p0) internal view {\\n        _sendLogPayload(abi.encodeWithSignature(\\\"log(bytes23)\\\", p0));\\n    }\\n\\n    function logBytes24(bytes24 p0) internal view {\\n        _sendLogPayload(abi.encodeWithSignature(\\\"log(bytes24)\\\", p0));\\n    }\\n\\n    function logBytes25(bytes25 p0) internal view {\\n        _sendLogPayload(abi.encodeWithSignature(\\\"log(bytes25)\\\", p0));\\n    }\\n\\n    function logBytes26(bytes26 p0) internal view {\\n        _sendLogPayload(abi.encodeWithSignature(\\\"log(bytes26)\\\", p0));\\n    }\\n\\n    function logBytes27(bytes27 p0) internal view {\\n        _sendLogPayload(abi.encodeWithSignature(\\\"log(bytes27)\\\", p0));\\n    }\\n\\n    function logBytes28(bytes28 p0) internal view {\\n        _sendLogPayload(abi.encodeWithSignature(\\\"log(bytes28)\\\", p0));\\n    }\\n\\n    function logBytes29(bytes29 p0) internal view {\\n        _sendLogPayload(abi.encodeWithSignature(\\\"log(bytes29)\\\", p0));\\n    }\\n\\n    function logBytes30(bytes30 p0) internal view {\\n        _sendLogPayload(abi.encodeWithSignature(\\\"log(bytes30)\\\", p0));\\n    }\\n\\n    function logBytes31(bytes31 p0) internal view {\\n        _sendLogPayload(abi.encodeWithSignature(\\\"log(bytes31)\\\", p0));\\n    }\\n\\n    function logBytes32(bytes32 p0) internal view {\\n        _sendLogPayload(abi.encodeWithSignature(\\\"log(bytes32)\\\", p0));\\n    }\\n\\n    function log(uint p0) internal view {\\n        _sendLogPayload(abi.encodeWithSignature(\\\"log(uint)\\\", p0));\\n    }\\n\\n    function log(string memory p0) internal view {\\n        _sendLogPayload(abi.encodeWithSignature(\\\"log(string)\\\", p0));\\n    }\\n\\n    function log(bool p0) internal view {\\n        _sendLogPayload(abi.encodeWithSignature(\\\"log(bool)\\\", p0));\\n    }\\n\\n    function log(address p0) internal view {\\n        _sendLogPayload(abi.encodeWithSignature(\\\"log(address)\\\", p0));\\n    }\\n\\n    function log(uint p0, uint p1) internal view {\\n        _sendLogPayload(abi.encodeWithSignature(\\\"log(uint,uint)\\\", p0, p1));\\n    }\\n\\n    function log(uint p0, string memory p1) internal view {\\n        _sendLogPayload(abi.encodeWithSignature(\\\"log(uint,string)\\\", p0, p1));\\n    }\\n\\n    function log(uint p0, bool p1) internal view {\\n        _sendLogPayload(abi.encodeWithSignature(\\\"log(uint,bool)\\\", p0, p1));\\n    }\\n\\n    function log(uint p0, address p1) internal view {\\n        _sendLogPayload(abi.encodeWithSignature(\\\"log(uint,address)\\\", p0, p1));\\n    }\\n\\n    function log(string memory p0, uint p1) internal view {\\n        _sendLogPayload(abi.encodeWithSignature(\\\"log(string,uint)\\\", p0, p1));\\n    }\\n\\n    function log(string memory p0, string memory p1) internal view {\\n        _sendLogPayload(abi.encodeWithSignature(\\\"log(string,string)\\\", p0, p1));\\n    }\\n\\n    function log(string memory p0, bool p1) internal view {\\n        _sendLogPayload(abi.encodeWithSignature(\\\"log(string,bool)\\\", p0, p1));\\n    }\\n\\n    function log(string memory p0, address p1) internal view {\\n        _sendLogPayload(abi.encodeWithSignature(\\\"log(string,address)\\\", p0, p1));\\n    }\\n\\n    function log(bool p0, uint p1) internal view {\\n        _sendLogPayload(abi.encodeWithSignature(\\\"log(bool,uint)\\\", p0, p1));\\n    }\\n\\n    function log(bool p0, string memory p1) internal view {\\n        _sendLogPayload(abi.encodeWithSignature(\\\"log(bool,string)\\\", p0, p1));\\n    }\\n\\n    function log(bool p0, bool p1) internal view {\\n        _sendLogPayload(abi.encodeWithSignature(\\\"log(bool,bool)\\\", p0, p1));\\n    }\\n\\n    function log(bool p0, address p1) internal view {\\n        _sendLogPayload(abi.encodeWithSignature(\\\"log(bool,address)\\\", p0, p1));\\n    }\\n\\n    function log(address p0, uint p1) internal view {\\n        _sendLogPayload(abi.encodeWithSignature(\\\"log(address,uint)\\\", p0, p1));\\n    }\\n\\n    function log(address p0, string memory p1) internal view {\\n        _sendLogPayload(abi.encodeWithSignature(\\\"log(address,string)\\\", p0, p1));\\n    }\\n\\n    function log(address p0, bool p1) internal view {\\n        _sendLogPayload(abi.encodeWithSignature(\\\"log(address,bool)\\\", p0, p1));\\n    }\\n\\n    function log(address p0, address p1) internal view {\\n        _sendLogPayload(abi.encodeWithSignature(\\\"log(address,address)\\\", p0, p1));\\n    }\\n\\n    function log(uint p0, uint p1, uint p2) internal view {\\n        _sendLogPayload(abi.encodeWithSignature(\\\"log(uint,uint,uint)\\\", p0, p1, p2));\\n    }\\n\\n    function log(uint p0, uint p1, string memory p2) internal view {\\n        _sendLogPayload(abi.encodeWithSignature(\\\"log(uint,uint,string)\\\", p0, p1, p2));\\n    }\\n\\n    function log(uint p0, uint p1, bool p2) internal view {\\n        _sendLogPayload(abi.encodeWithSignature(\\\"log(uint,uint,bool)\\\", p0, p1, p2));\\n    }\\n\\n    function log(uint p0, uint p1, address p2) internal view {\\n        _sendLogPayload(abi.encodeWithSignature(\\\"log(uint,uint,address)\\\", p0, p1, p2));\\n    }\\n\\n    function log(uint p0, string memory p1, uint p2) internal view {\\n        _sendLogPayload(abi.encodeWithSignature(\\\"log(uint,string,uint)\\\", p0, p1, p2));\\n    }\\n\\n    function log(uint p0, string memory p1, string memory p2) internal view {\\n        _sendLogPayload(abi.encodeWithSignature(\\\"log(uint,string,string)\\\", p0, p1, p2));\\n    }\\n\\n    function log(uint p0, string memory p1, bool p2) internal view {\\n        _sendLogPayload(abi.encodeWithSignature(\\\"log(uint,string,bool)\\\", p0, p1, p2));\\n    }\\n\\n    function log(uint p0, string memory p1, address p2) internal view {\\n        _sendLogPayload(abi.encodeWithSignature(\\\"log(uint,string,address)\\\", p0, p1, p2));\\n    }\\n\\n    function log(uint p0, bool p1, uint p2) internal view {\\n        _sendLogPayload(abi.encodeWithSignature(\\\"log(uint,bool,uint)\\\", p0, p1, p2));\\n    }\\n\\n    function log(uint p0, bool p1, string memory p2) internal view {\\n        _sendLogPayload(abi.encodeWithSignature(\\\"log(uint,bool,string)\\\", p0, p1, p2));\\n    }\\n\\n    function log(uint p0, bool p1, bool p2) internal view {\\n        _sendLogPayload(abi.encodeWithSignature(\\\"log(uint,bool,bool)\\\", p0, p1, p2));\\n    }\\n\\n    function log(uint p0, bool p1, address p2) internal view {\\n        _sendLogPayload(abi.encodeWithSignature(\\\"log(uint,bool,address)\\\", p0, p1, p2));\\n    }\\n\\n    function log(uint p0, address p1, uint p2) internal view {\\n        _sendLogPayload(abi.encodeWithSignature(\\\"log(uint,address,uint)\\\", p0, p1, p2));\\n    }\\n\\n    function log(uint p0, address p1, string memory p2) internal view {\\n        _sendLogPayload(abi.encodeWithSignature(\\\"log(uint,address,string)\\\", p0, p1, p2));\\n    }\\n\\n    function log(uint p0, address p1, bool p2) internal view {\\n        _sendLogPayload(abi.encodeWithSignature(\\\"log(uint,address,bool)\\\", p0, p1, p2));\\n    }\\n\\n    function log(uint p0, address p1, address p2) internal view {\\n        _sendLogPayload(abi.encodeWithSignature(\\\"log(uint,address,address)\\\", p0, p1, p2));\\n    }\\n\\n    function log(string memory p0, uint p1, uint p2) internal view {\\n        _sendLogPayload(abi.encodeWithSignature(\\\"log(string,uint,uint)\\\", p0, p1, p2));\\n    }\\n\\n    function log(string memory p0, uint p1, string memory p2) internal view {\\n        _sendLogPayload(abi.encodeWithSignature(\\\"log(string,uint,string)\\\", p0, p1, p2));\\n    }\\n\\n    function log(string memory p0, uint p1, bool p2) internal view {\\n        _sendLogPayload(abi.encodeWithSignature(\\\"log(string,uint,bool)\\\", p0, p1, p2));\\n    }\\n\\n    function log(string memory p0, uint p1, address p2) internal view {\\n        _sendLogPayload(abi.encodeWithSignature(\\\"log(string,uint,address)\\\", p0, p1, p2));\\n    }\\n\\n    function log(string memory p0, string memory p1, uint p2) internal view {\\n        _sendLogPayload(abi.encodeWithSignature(\\\"log(string,string,uint)\\\", p0, p1, p2));\\n    }\\n\\n    function log(string memory p0, string memory p1, string memory p2) internal view {\\n        _sendLogPayload(abi.encodeWithSignature(\\\"log(string,string,string)\\\", p0, p1, p2));\\n    }\\n\\n    function log(string memory p0, string memory p1, bool p2) internal view {\\n        _sendLogPayload(abi.encodeWithSignature(\\\"log(string,string,bool)\\\", p0, p1, p2));\\n    }\\n\\n    function log(string memory p0, string memory p1, address p2) internal view {\\n        _sendLogPayload(abi.encodeWithSignature(\\\"log(string,string,address)\\\", p0, p1, p2));\\n    }\\n\\n    function log(string memory p0, bool p1, uint p2) internal view {\\n        _sendLogPayload(abi.encodeWithSignature(\\\"log(string,bool,uint)\\\", p0, p1, p2));\\n    }\\n\\n    function log(string memory p0, bool p1, string memory p2) internal view {\\n        _sendLogPayload(abi.encodeWithSignature(\\\"log(string,bool,string)\\\", p0, p1, p2));\\n    }\\n\\n    function log(string memory p0, bool p1, bool p2) internal view {\\n        _sendLogPayload(abi.encodeWithSignature(\\\"log(string,bool,bool)\\\", p0, p1, p2));\\n    }\\n\\n    function log(string memory p0, bool p1, address p2) internal view {\\n        _sendLogPayload(abi.encodeWithSignature(\\\"log(string,bool,address)\\\", p0, p1, p2));\\n    }\\n\\n    function log(string memory p0, address p1, uint p2) internal view {\\n        _sendLogPayload(abi.encodeWithSignature(\\\"log(string,address,uint)\\\", p0, p1, p2));\\n    }\\n\\n    function log(string memory p0, address p1, string memory p2) internal view {\\n        _sendLogPayload(abi.encodeWithSignature(\\\"log(string,address,string)\\\", p0, p1, p2));\\n    }\\n\\n    function log(string memory p0, address p1, bool p2) internal view {\\n        _sendLogPayload(abi.encodeWithSignature(\\\"log(string,address,bool)\\\", p0, p1, p2));\\n    }\\n\\n    function log(string memory p0, address p1, address p2) internal view {\\n        _sendLogPayload(abi.encodeWithSignature(\\\"log(string,address,address)\\\", p0, p1, p2));\\n    }\\n\\n    function log(bool p0, uint p1, uint p2) internal view {\\n        _sendLogPayload(abi.encodeWithSignature(\\\"log(bool,uint,uint)\\\", p0, p1, p2));\\n    }\\n\\n    function log(bool p0, uint p1, string memory p2) internal view {\\n        _sendLogPayload(abi.encodeWithSignature(\\\"log(bool,uint,string)\\\", p0, p1, p2));\\n    }\\n\\n    function log(bool p0, uint p1, bool p2) internal view {\\n        _sendLogPayload(abi.encodeWithSignature(\\\"log(bool,uint,bool)\\\", p0, p1, p2));\\n    }\\n\\n    function log(bool p0, uint p1, address p2) internal view {\\n        _sendLogPayload(abi.encodeWithSignature(\\\"log(bool,uint,address)\\\", p0, p1, p2));\\n    }\\n\\n    function log(bool p0, string memory p1, uint p2) internal view {\\n        _sendLogPayload(abi.encodeWithSignature(\\\"log(bool,string,uint)\\\", p0, p1, p2));\\n    }\\n\\n    function log(bool p0, string memory p1, string memory p2) internal view {\\n        _sendLogPayload(abi.encodeWithSignature(\\\"log(bool,string,string)\\\", p0, p1, p2));\\n    }\\n\\n    function log(bool p0, string memory p1, bool p2) internal view {\\n        _sendLogPayload(abi.encodeWithSignature(\\\"log(bool,string,bool)\\\", p0, p1, p2));\\n    }\\n\\n    function log(bool p0, string memory p1, address p2) internal view {\\n        _sendLogPayload(abi.encodeWithSignature(\\\"log(bool,string,address)\\\", p0, p1, p2));\\n    }\\n\\n    function log(bool p0, bool p1, uint p2) internal view {\\n        _sendLogPayload(abi.encodeWithSignature(\\\"log(bool,bool,uint)\\\", p0, p1, p2));\\n    }\\n\\n    function log(bool p0, bool p1, string memory p2) internal view {\\n        _sendLogPayload(abi.encodeWithSignature(\\\"log(bool,bool,string)\\\", p0, p1, p2));\\n    }\\n\\n    function log(bool p0, bool p1, bool p2) internal view {\\n        _sendLogPayload(abi.encodeWithSignature(\\\"log(bool,bool,bool)\\\", p0, p1, p2));\\n    }\\n\\n    function log(bool p0, bool p1, address p2) internal view {\\n        _sendLogPayload(abi.encodeWithSignature(\\\"log(bool,bool,address)\\\", p0, p1, p2));\\n    }\\n\\n    function log(bool p0, address p1, uint p2) internal view {\\n        _sendLogPayload(abi.encodeWithSignature(\\\"log(bool,address,uint)\\\", p0, p1, p2));\\n    }\\n\\n    function log(bool p0, address p1, string memory p2) internal view {\\n        _sendLogPayload(abi.encodeWithSignature(\\\"log(bool,address,string)\\\", p0, p1, p2));\\n    }\\n\\n    function log(bool p0, address p1, bool p2) internal view {\\n        _sendLogPayload(abi.encodeWithSignature(\\\"log(bool,address,bool)\\\", p0, p1, p2));\\n    }\\n\\n    function log(bool p0, address p1, address p2) internal view {\\n        _sendLogPayload(abi.encodeWithSignature(\\\"log(bool,address,address)\\\", p0, p1, p2));\\n    }\\n\\n    function log(address p0, uint p1, uint p2) internal view {\\n        _sendLogPayload(abi.encodeWithSignature(\\\"log(address,uint,uint)\\\", p0, p1, p2));\\n    }\\n\\n    function log(address p0, uint p1, string memory p2) internal view {\\n        _sendLogPayload(abi.encodeWithSignature(\\\"log(address,uint,string)\\\", p0, p1, p2));\\n    }\\n\\n    function log(address p0, uint p1, bool p2) internal view {\\n        _sendLogPayload(abi.encodeWithSignature(\\\"log(address,uint,bool)\\\", p0, p1, p2));\\n    }\\n\\n    function log(address p0, uint p1, address p2) internal view {\\n        _sendLogPayload(abi.encodeWithSignature(\\\"log(address,uint,address)\\\", p0, p1, p2));\\n    }\\n\\n    function log(address p0, string memory p1, uint p2) internal view {\\n        _sendLogPayload(abi.encodeWithSignature(\\\"log(address,string,uint)\\\", p0, p1, p2));\\n    }\\n\\n    function log(address p0, string memory p1, string memory p2) internal view {\\n        _sendLogPayload(abi.encodeWithSignature(\\\"log(address,string,string)\\\", p0, p1, p2));\\n    }\\n\\n    function log(address p0, string memory p1, bool p2) internal view {\\n        _sendLogPayload(abi.encodeWithSignature(\\\"log(address,string,bool)\\\", p0, p1, p2));\\n    }\\n\\n    function log(address p0, string memory p1, address p2) internal view {\\n        _sendLogPayload(abi.encodeWithSignature(\\\"log(address,string,address)\\\", p0, p1, p2));\\n    }\\n\\n    function log(address p0, bool p1, uint p2) internal view {\\n        _sendLogPayload(abi.encodeWithSignature(\\\"log(address,bool,uint)\\\", p0, p1, p2));\\n    }\\n\\n    function log(address p0, bool p1, string memory p2) internal view {\\n        _sendLogPayload(abi.encodeWithSignature(\\\"log(address,bool,string)\\\", p0, p1, p2));\\n    }\\n\\n    function log(address p0, bool p1, bool p2) internal view {\\n        _sendLogPayload(abi.encodeWithSignature(\\\"log(address,bool,bool)\\\", p0, p1, p2));\\n    }\\n\\n    function log(address p0, bool p1, address p2) internal view {\\n        _sendLogPayload(abi.encodeWithSignature(\\\"log(address,bool,address)\\\", p0, p1, p2));\\n    }\\n\\n    function log(address p0, address p1, uint p2) internal view {\\n        _sendLogPayload(abi.encodeWithSignature(\\\"log(address,address,uint)\\\", p0, p1, p2));\\n    }\\n\\n    function log(address p0, address p1, string memory p2) internal view {\\n        _sendLogPayload(abi.encodeWithSignature(\\\"log(address,address,string)\\\", p0, p1, p2));\\n    }\\n\\n    function log(address p0, address p1, bool p2) internal view {\\n        _sendLogPayload(abi.encodeWithSignature(\\\"log(address,address,bool)\\\", p0, p1, p2));\\n    }\\n\\n    function log(address p0, address p1, address p2) internal view {\\n        _sendLogPayload(abi.encodeWithSignature(\\\"log(address,address,address)\\\", p0, p1, p2));\\n    }\\n\\n    function log(uint p0, uint p1, uint p2, uint p3) internal view {\\n        _sendLogPayload(abi.encodeWithSignature(\\\"log(uint,uint,uint,uint)\\\", p0, p1, p2, p3));\\n    }\\n\\n    function log(uint p0, uint p1, uint p2, string memory p3) internal view {\\n        _sendLogPayload(abi.encodeWithSignature(\\\"log(uint,uint,uint,string)\\\", p0, p1, p2, p3));\\n    }\\n\\n    function log(uint p0, uint p1, uint p2, bool p3) internal view {\\n        _sendLogPayload(abi.encodeWithSignature(\\\"log(uint,uint,uint,bool)\\\", p0, p1, p2, p3));\\n    }\\n\\n    function log(uint p0, uint p1, uint p2, address p3) internal view {\\n        _sendLogPayload(abi.encodeWithSignature(\\\"log(uint,uint,uint,address)\\\", p0, p1, p2, p3));\\n    }\\n\\n    function log(uint p0, uint p1, string memory p2, uint p3) internal view {\\n        _sendLogPayload(abi.encodeWithSignature(\\\"log(uint,uint,string,uint)\\\", p0, p1, p2, p3));\\n    }\\n\\n    function log(uint p0, uint p1, string memory p2, string memory p3) internal view {\\n        _sendLogPayload(abi.encodeWithSignature(\\\"log(uint,uint,string,string)\\\", p0, p1, p2, p3));\\n    }\\n\\n    function log(uint p0, uint p1, string memory p2, bool p3) internal view {\\n        _sendLogPayload(abi.encodeWithSignature(\\\"log(uint,uint,string,bool)\\\", p0, p1, p2, p3));\\n    }\\n\\n    function log(uint p0, uint p1, string memory p2, address p3) internal view {\\n        _sendLogPayload(abi.encodeWithSignature(\\\"log(uint,uint,string,address)\\\", p0, p1, p2, p3));\\n    }\\n\\n    function log(uint p0, uint p1, bool p2, uint p3) internal view {\\n        _sendLogPayload(abi.encodeWithSignature(\\\"log(uint,uint,bool,uint)\\\", p0, p1, p2, p3));\\n    }\\n\\n    function log(uint p0, uint p1, bool p2, string memory p3) internal view {\\n        _sendLogPayload(abi.encodeWithSignature(\\\"log(uint,uint,bool,string)\\\", p0, p1, p2, p3));\\n    }\\n\\n    function log(uint p0, uint p1, bool p2, bool p3) internal view {\\n        _sendLogPayload(abi.encodeWithSignature(\\\"log(uint,uint,bool,bool)\\\", p0, p1, p2, p3));\\n    }\\n\\n    function log(uint p0, uint p1, bool p2, address p3) internal view {\\n        _sendLogPayload(abi.encodeWithSignature(\\\"log(uint,uint,bool,address)\\\", p0, p1, p2, p3));\\n    }\\n\\n    function log(uint p0, uint p1, address p2, uint p3) internal view {\\n        _sendLogPayload(abi.encodeWithSignature(\\\"log(uint,uint,address,uint)\\\", p0, p1, p2, p3));\\n    }\\n\\n    function log(uint p0, uint p1, address p2, string memory p3) internal view {\\n        _sendLogPayload(abi.encodeWithSignature(\\\"log(uint,uint,address,string)\\\", p0, p1, p2, p3));\\n    }\\n\\n    function log(uint p0, uint p1, address p2, bool p3) internal view {\\n        _sendLogPayload(abi.encodeWithSignature(\\\"log(uint,uint,address,bool)\\\", p0, p1, p2, p3));\\n    }\\n\\n    function log(uint p0, uint p1, address p2, address p3) internal view {\\n        _sendLogPayload(abi.encodeWithSignature(\\\"log(uint,uint,address,address)\\\", p0, p1, p2, p3));\\n    }\\n\\n    function log(uint p0, string memory p1, uint p2, uint p3) internal view {\\n        _sendLogPayload(abi.encodeWithSignature(\\\"log(uint,string,uint,uint)\\\", p0, p1, p2, p3));\\n    }\\n\\n    function log(uint p0, string memory p1, uint p2, string memory p3) internal view {\\n        _sendLogPayload(abi.encodeWithSignature(\\\"log(uint,string,uint,string)\\\", p0, p1, p2, p3));\\n    }\\n\\n    function log(uint p0, string memory p1, uint p2, bool p3) internal view {\\n        _sendLogPayload(abi.encodeWithSignature(\\\"log(uint,string,uint,bool)\\\", p0, p1, p2, p3));\\n    }\\n\\n    function log(uint p0, string memory p1, uint p2, address p3) internal view {\\n        _sendLogPayload(abi.encodeWithSignature(\\\"log(uint,string,uint,address)\\\", p0, p1, p2, p3));\\n    }\\n\\n    function log(uint p0, string memory p1, string memory p2, uint p3) internal view {\\n        _sendLogPayload(abi.encodeWithSignature(\\\"log(uint,string,string,uint)\\\", p0, p1, p2, p3));\\n    }\\n\\n    function log(uint p0, string memory p1, string memory p2, string memory p3) internal view {\\n        _sendLogPayload(abi.encodeWithSignature(\\\"log(uint,string,string,string)\\\", p0, p1, p2, p3));\\n    }\\n\\n    function log(uint p0, string memory p1, string memory p2, bool p3) internal view {\\n        _sendLogPayload(abi.encodeWithSignature(\\\"log(uint,string,string,bool)\\\", p0, p1, p2, p3));\\n    }\\n\\n    function log(uint p0, string memory p1, string memory p2, address p3) internal view {\\n        _sendLogPayload(abi.encodeWithSignature(\\\"log(uint,string,string,address)\\\", p0, p1, p2, p3));\\n    }\\n\\n    function log(uint p0, string memory p1, bool p2, uint p3) internal view {\\n        _sendLogPayload(abi.encodeWithSignature(\\\"log(uint,string,bool,uint)\\\", p0, p1, p2, p3));\\n    }\\n\\n    function log(uint p0, string memory p1, bool p2, string memory p3) internal view {\\n        _sendLogPayload(abi.encodeWithSignature(\\\"log(uint,string,bool,string)\\\", p0, p1, p2, p3));\\n    }\\n\\n    function log(uint p0, string memory p1, bool p2, bool p3) internal view {\\n        _sendLogPayload(abi.encodeWithSignature(\\\"log(uint,string,bool,bool)\\\", p0, p1, p2, p3));\\n    }\\n\\n    function log(uint p0, string memory p1, bool p2, address p3) internal view {\\n        _sendLogPayload(abi.encodeWithSignature(\\\"log(uint,string,bool,address)\\\", p0, p1, p2, p3));\\n    }\\n\\n    function log(uint p0, string memory p1, address p2, uint p3) internal view {\\n        _sendLogPayload(abi.encodeWithSignature(\\\"log(uint,string,address,uint)\\\", p0, p1, p2, p3));\\n    }\\n\\n    function log(uint p0, string memory p1, address p2, string memory p3) internal view {\\n        _sendLogPayload(abi.encodeWithSignature(\\\"log(uint,string,address,string)\\\", p0, p1, p2, p3));\\n    }\\n\\n    function log(uint p0, string memory p1, address p2, bool p3) internal view {\\n        _sendLogPayload(abi.encodeWithSignature(\\\"log(uint,string,address,bool)\\\", p0, p1, p2, p3));\\n    }\\n\\n    function log(uint p0, string memory p1, address p2, address p3) internal view {\\n        _sendLogPayload(abi.encodeWithSignature(\\\"log(uint,string,address,address)\\\", p0, p1, p2, p3));\\n    }\\n\\n    function log(uint p0, bool p1, uint p2, uint p3) internal view {\\n        _sendLogPayload(abi.encodeWithSignature(\\\"log(uint,bool,uint,uint)\\\", p0, p1, p2, p3));\\n    }\\n\\n    function log(uint p0, bool p1, uint p2, string memory p3) internal view {\\n        _sendLogPayload(abi.encodeWithSignature(\\\"log(uint,bool,uint,string)\\\", p0, p1, p2, p3));\\n    }\\n\\n    function log(uint p0, bool p1, uint p2, bool p3) internal view {\\n        _sendLogPayload(abi.encodeWithSignature(\\\"log(uint,bool,uint,bool)\\\", p0, p1, p2, p3));\\n    }\\n\\n    function log(uint p0, bool p1, uint p2, address p3) internal view {\\n        _sendLogPayload(abi.encodeWithSignature(\\\"log(uint,bool,uint,address)\\\", p0, p1, p2, p3));\\n    }\\n\\n    function log(uint p0, bool p1, string memory p2, uint p3) internal view {\\n        _sendLogPayload(abi.encodeWithSignature(\\\"log(uint,bool,string,uint)\\\", p0, p1, p2, p3));\\n    }\\n\\n    function log(uint p0, bool p1, string memory p2, string memory p3) internal view {\\n        _sendLogPayload(abi.encodeWithSignature(\\\"log(uint,bool,string,string)\\\", p0, p1, p2, p3));\\n    }\\n\\n    function log(uint p0, bool p1, string memory p2, bool p3) internal view {\\n        _sendLogPayload(abi.encodeWithSignature(\\\"log(uint,bool,string,bool)\\\", p0, p1, p2, p3));\\n    }\\n\\n    function log(uint p0, bool p1, string memory p2, address p3) internal view {\\n        _sendLogPayload(abi.encodeWithSignature(\\\"log(uint,bool,string,address)\\\", p0, p1, p2, p3));\\n    }\\n\\n    function log(uint p0, bool p1, bool p2, uint p3) internal view {\\n        _sendLogPayload(abi.encodeWithSignature(\\\"log(uint,bool,bool,uint)\\\", p0, p1, p2, p3));\\n    }\\n\\n    function log(uint p0, bool p1, bool p2, string memory p3) internal view {\\n        _sendLogPayload(abi.encodeWithSignature(\\\"log(uint,bool,bool,string)\\\", p0, p1, p2, p3));\\n    }\\n\\n    function log(uint p0, bool p1, bool p2, bool p3) internal view {\\n        _sendLogPayload(abi.encodeWithSignature(\\\"log(uint,bool,bool,bool)\\\", p0, p1, p2, p3));\\n    }\\n\\n    function log(uint p0, bool p1, bool p2, address p3) internal view {\\n        _sendLogPayload(abi.encodeWithSignature(\\\"log(uint,bool,bool,address)\\\", p0, p1, p2, p3));\\n    }\\n\\n    function log(uint p0, bool p1, address p2, uint p3) internal view {\\n        _sendLogPayload(abi.encodeWithSignature(\\\"log(uint,bool,address,uint)\\\", p0, p1, p2, p3));\\n    }\\n\\n    function log(uint p0, bool p1, address p2, string memory p3) internal view {\\n        _sendLogPayload(abi.encodeWithSignature(\\\"log(uint,bool,address,string)\\\", p0, p1, p2, p3));\\n    }\\n\\n    function log(uint p0, bool p1, address p2, bool p3) internal view {\\n        _sendLogPayload(abi.encodeWithSignature(\\\"log(uint,bool,address,bool)\\\", p0, p1, p2, p3));\\n    }\\n\\n    function log(uint p0, bool p1, address p2, address p3) internal view {\\n        _sendLogPayload(abi.encodeWithSignature(\\\"log(uint,bool,address,address)\\\", p0, p1, p2, p3));\\n    }\\n\\n    function log(uint p0, address p1, uint p2, uint p3) internal view {\\n        _sendLogPayload(abi.encodeWithSignature(\\\"log(uint,address,uint,uint)\\\", p0, p1, p2, p3));\\n    }\\n\\n    function log(uint p0, address p1, uint p2, string memory p3) internal view {\\n        _sendLogPayload(abi.encodeWithSignature(\\\"log(uint,address,uint,string)\\\", p0, p1, p2, p3));\\n    }\\n\\n    function log(uint p0, address p1, uint p2, bool p3) internal view {\\n        _sendLogPayload(abi.encodeWithSignature(\\\"log(uint,address,uint,bool)\\\", p0, p1, p2, p3));\\n    }\\n\\n    function log(uint p0, address p1, uint p2, address p3) internal view {\\n        _sendLogPayload(abi.encodeWithSignature(\\\"log(uint,address,uint,address)\\\", p0, p1, p2, p3));\\n    }\\n\\n    function log(uint p0, address p1, string memory p2, uint p3) internal view {\\n        _sendLogPayload(abi.encodeWithSignature(\\\"log(uint,address,string,uint)\\\", p0, p1, p2, p3));\\n    }\\n\\n    function log(uint p0, address p1, string memory p2, string memory p3) internal view {\\n        _sendLogPayload(abi.encodeWithSignature(\\\"log(uint,address,string,string)\\\", p0, p1, p2, p3));\\n    }\\n\\n    function log(uint p0, address p1, string memory p2, bool p3) internal view {\\n        _sendLogPayload(abi.encodeWithSignature(\\\"log(uint,address,string,bool)\\\", p0, p1, p2, p3));\\n    }\\n\\n    function log(uint p0, address p1, string memory p2, address p3) internal view {\\n        _sendLogPayload(abi.encodeWithSignature(\\\"log(uint,address,string,address)\\\", p0, p1, p2, p3));\\n    }\\n\\n    function log(uint p0, address p1, bool p2, uint p3) internal view {\\n        _sendLogPayload(abi.encodeWithSignature(\\\"log(uint,address,bool,uint)\\\", p0, p1, p2, p3));\\n    }\\n\\n    function log(uint p0, address p1, bool p2, string memory p3) internal view {\\n        _sendLogPayload(abi.encodeWithSignature(\\\"log(uint,address,bool,string)\\\", p0, p1, p2, p3));\\n    }\\n\\n    function log(uint p0, address p1, bool p2, bool p3) internal view {\\n        _sendLogPayload(abi.encodeWithSignature(\\\"log(uint,address,bool,bool)\\\", p0, p1, p2, p3));\\n    }\\n\\n    function log(uint p0, address p1, bool p2, address p3) internal view {\\n        _sendLogPayload(abi.encodeWithSignature(\\\"log(uint,address,bool,address)\\\", p0, p1, p2, p3));\\n    }\\n\\n    function log(uint p0, address p1, address p2, uint p3) internal view {\\n        _sendLogPayload(abi.encodeWithSignature(\\\"log(uint,address,address,uint)\\\", p0, p1, p2, p3));\\n    }\\n\\n    function log(uint p0, address p1, address p2, string memory p3) internal view {\\n        _sendLogPayload(abi.encodeWithSignature(\\\"log(uint,address,address,string)\\\", p0, p1, p2, p3));\\n    }\\n\\n    function log(uint p0, address p1, address p2, bool p3) internal view {\\n        _sendLogPayload(abi.encodeWithSignature(\\\"log(uint,address,address,bool)\\\", p0, p1, p2, p3));\\n    }\\n\\n    function log(uint p0, address p1, address p2, address p3) internal view {\\n        _sendLogPayload(abi.encodeWithSignature(\\\"log(uint,address,address,address)\\\", p0, p1, p2, p3));\\n    }\\n\\n    function log(string memory p0, uint p1, uint p2, uint p3) internal view {\\n        _sendLogPayload(abi.encodeWithSignature(\\\"log(string,uint,uint,uint)\\\", p0, p1, p2, p3));\\n    }\\n\\n    function log(string memory p0, uint p1, uint p2, string memory p3) internal view {\\n        _sendLogPayload(abi.encodeWithSignature(\\\"log(string,uint,uint,string)\\\", p0, p1, p2, p3));\\n    }\\n\\n    function log(string memory p0, uint p1, uint p2, bool p3) internal view {\\n        _sendLogPayload(abi.encodeWithSignature(\\\"log(string,uint,uint,bool)\\\", p0, p1, p2, p3));\\n    }\\n\\n    function log(string memory p0, uint p1, uint p2, address p3) internal view {\\n        _sendLogPayload(abi.encodeWithSignature(\\\"log(string,uint,uint,address)\\\", p0, p1, p2, p3));\\n    }\\n\\n    function log(string memory p0, uint p1, string memory p2, uint p3) internal view {\\n        _sendLogPayload(abi.encodeWithSignature(\\\"log(string,uint,string,uint)\\\", p0, p1, p2, p3));\\n    }\\n\\n    function log(string memory p0, uint p1, string memory p2, string memory p3) internal view {\\n        _sendLogPayload(abi.encodeWithSignature(\\\"log(string,uint,string,string)\\\", p0, p1, p2, p3));\\n    }\\n\\n    function log(string memory p0, uint p1, string memory p2, bool p3) internal view {\\n        _sendLogPayload(abi.encodeWithSignature(\\\"log(string,uint,string,bool)\\\", p0, p1, p2, p3));\\n    }\\n\\n    function log(string memory p0, uint p1, string memory p2, address p3) internal view {\\n        _sendLogPayload(abi.encodeWithSignature(\\\"log(string,uint,string,address)\\\", p0, p1, p2, p3));\\n    }\\n\\n    function log(string memory p0, uint p1, bool p2, uint p3) internal view {\\n        _sendLogPayload(abi.encodeWithSignature(\\\"log(string,uint,bool,uint)\\\", p0, p1, p2, p3));\\n    }\\n\\n    function log(string memory p0, uint p1, bool p2, string memory p3) internal view {\\n        _sendLogPayload(abi.encodeWithSignature(\\\"log(string,uint,bool,string)\\\", p0, p1, p2, p3));\\n    }\\n\\n    function log(string memory p0, uint p1, bool p2, bool p3) internal view {\\n        _sendLogPayload(abi.encodeWithSignature(\\\"log(string,uint,bool,bool)\\\", p0, p1, p2, p3));\\n    }\\n\\n    function log(string memory p0, uint p1, bool p2, address p3) internal view {\\n        _sendLogPayload(abi.encodeWithSignature(\\\"log(string,uint,bool,address)\\\", p0, p1, p2, p3));\\n    }\\n\\n    function log(string memory p0, uint p1, address p2, uint p3) internal view {\\n        _sendLogPayload(abi.encodeWithSignature(\\\"log(string,uint,address,uint)\\\", p0, p1, p2, p3));\\n    }\\n\\n    function log(string memory p0, uint p1, address p2, string memory p3) internal view {\\n        _sendLogPayload(abi.encodeWithSignature(\\\"log(string,uint,address,string)\\\", p0, p1, p2, p3));\\n    }\\n\\n    function log(string memory p0, uint p1, address p2, bool p3) internal view {\\n        _sendLogPayload(abi.encodeWithSignature(\\\"log(string,uint,address,bool)\\\", p0, p1, p2, p3));\\n    }\\n\\n    function log(string memory p0, uint p1, address p2, address p3) internal view {\\n        _sendLogPayload(abi.encodeWithSignature(\\\"log(string,uint,address,address)\\\", p0, p1, p2, p3));\\n    }\\n\\n    function log(string memory p0, string memory p1, uint p2, uint p3) internal view {\\n        _sendLogPayload(abi.encodeWithSignature(\\\"log(string,string,uint,uint)\\\", p0, p1, p2, p3));\\n    }\\n\\n    function log(string memory p0, string memory p1, uint p2, string memory p3) internal view {\\n        _sendLogPayload(abi.encodeWithSignature(\\\"log(string,string,uint,string)\\\", p0, p1, p2, p3));\\n    }\\n\\n    function log(string memory p0, string memory p1, uint p2, bool p3) internal view {\\n        _sendLogPayload(abi.encodeWithSignature(\\\"log(string,string,uint,bool)\\\", p0, p1, p2, p3));\\n    }\\n\\n    function log(string memory p0, string memory p1, uint p2, address p3) internal view {\\n        _sendLogPayload(abi.encodeWithSignature(\\\"log(string,string,uint,address)\\\", p0, p1, p2, p3));\\n    }\\n\\n    function log(string memory p0, string memory p1, string memory p2, uint p3) internal view {\\n        _sendLogPayload(abi.encodeWithSignature(\\\"log(string,string,string,uint)\\\", p0, p1, p2, p3));\\n    }\\n\\n    function log(string memory p0, string memory p1, string memory p2, string memory p3) internal view {\\n        _sendLogPayload(abi.encodeWithSignature(\\\"log(string,string,string,string)\\\", p0, p1, p2, p3));\\n    }\\n\\n    function log(string memory p0, string memory p1, string memory p2, bool p3) internal view {\\n        _sendLogPayload(abi.encodeWithSignature(\\\"log(string,string,string,bool)\\\", p0, p1, p2, p3));\\n    }\\n\\n    function log(string memory p0, string memory p1, string memory p2, address p3) internal view {\\n        _sendLogPayload(abi.encodeWithSignature(\\\"log(string,string,string,address)\\\", p0, p1, p2, p3));\\n    }\\n\\n    function log(string memory p0, string memory p1, bool p2, uint p3) internal view {\\n        _sendLogPayload(abi.encodeWithSignature(\\\"log(string,string,bool,uint)\\\", p0, p1, p2, p3));\\n    }\\n\\n    function log(string memory p0, string memory p1, bool p2, string memory p3) internal view {\\n        _sendLogPayload(abi.encodeWithSignature(\\\"log(string,string,bool,string)\\\", p0, p1, p2, p3));\\n    }\\n\\n    function log(string memory p0, string memory p1, bool p2, bool p3) internal view {\\n        _sendLogPayload(abi.encodeWithSignature(\\\"log(string,string,bool,bool)\\\", p0, p1, p2, p3));\\n    }\\n\\n    function log(string memory p0, string memory p1, bool p2, address p3) internal view {\\n        _sendLogPayload(abi.encodeWithSignature(\\\"log(string,string,bool,address)\\\", p0, p1, p2, p3));\\n    }\\n\\n    function log(string memory p0, string memory p1, address p2, uint p3) internal view {\\n        _sendLogPayload(abi.encodeWithSignature(\\\"log(string,string,address,uint)\\\", p0, p1, p2, p3));\\n    }\\n\\n    function log(string memory p0, string memory p1, address p2, string memory p3) internal view {\\n        _sendLogPayload(abi.encodeWithSignature(\\\"log(string,string,address,string)\\\", p0, p1, p2, p3));\\n    }\\n\\n    function log(string memory p0, string memory p1, address p2, bool p3) internal view {\\n        _sendLogPayload(abi.encodeWithSignature(\\\"log(string,string,address,bool)\\\", p0, p1, p2, p3));\\n    }\\n\\n    function log(string memory p0, string memory p1, address p2, address p3) internal view {\\n        _sendLogPayload(abi.encodeWithSignature(\\\"log(string,string,address,address)\\\", p0, p1, p2, p3));\\n    }\\n\\n    function log(string memory p0, bool p1, uint p2, uint p3) internal view {\\n        _sendLogPayload(abi.encodeWithSignature(\\\"log(string,bool,uint,uint)\\\", p0, p1, p2, p3));\\n    }\\n\\n    function log(string memory p0, bool p1, uint p2, string memory p3) internal view {\\n        _sendLogPayload(abi.encodeWithSignature(\\\"log(string,bool,uint,string)\\\", p0, p1, p2, p3));\\n    }\\n\\n    function log(string memory p0, bool p1, uint p2, bool p3) internal view {\\n        _sendLogPayload(abi.encodeWithSignature(\\\"log(string,bool,uint,bool)\\\", p0, p1, p2, p3));\\n    }\\n\\n    function log(string memory p0, bool p1, uint p2, address p3) internal view {\\n        _sendLogPayload(abi.encodeWithSignature(\\\"log(string,bool,uint,address)\\\", p0, p1, p2, p3));\\n    }\\n\\n    function log(string memory p0, bool p1, string memory p2, uint p3) internal view {\\n        _sendLogPayload(abi.encodeWithSignature(\\\"log(string,bool,string,uint)\\\", p0, p1, p2, p3));\\n    }\\n\\n    function log(string memory p0, bool p1, string memory p2, string memory p3) internal view {\\n        _sendLogPayload(abi.encodeWithSignature(\\\"log(string,bool,string,string)\\\", p0, p1, p2, p3));\\n    }\\n\\n    function log(string memory p0, bool p1, string memory p2, bool p3) internal view {\\n        _sendLogPayload(abi.encodeWithSignature(\\\"log(string,bool,string,bool)\\\", p0, p1, p2, p3));\\n    }\\n\\n    function log(string memory p0, bool p1, string memory p2, address p3) internal view {\\n        _sendLogPayload(abi.encodeWithSignature(\\\"log(string,bool,string,address)\\\", p0, p1, p2, p3));\\n    }\\n\\n    function log(string memory p0, bool p1, bool p2, uint p3) internal view {\\n        _sendLogPayload(abi.encodeWithSignature(\\\"log(string,bool,bool,uint)\\\", p0, p1, p2, p3));\\n    }\\n\\n    function log(string memory p0, bool p1, bool p2, string memory p3) internal view {\\n        _sendLogPayload(abi.encodeWithSignature(\\\"log(string,bool,bool,string)\\\", p0, p1, p2, p3));\\n    }\\n\\n    function log(string memory p0, bool p1, bool p2, bool p3) internal view {\\n        _sendLogPayload(abi.encodeWithSignature(\\\"log(string,bool,bool,bool)\\\", p0, p1, p2, p3));\\n    }\\n\\n    function log(string memory p0, bool p1, bool p2, address p3) internal view {\\n        _sendLogPayload(abi.encodeWithSignature(\\\"log(string,bool,bool,address)\\\", p0, p1, p2, p3));\\n    }\\n\\n    function log(string memory p0, bool p1, address p2, uint p3) internal view {\\n        _sendLogPayload(abi.encodeWithSignature(\\\"log(string,bool,address,uint)\\\", p0, p1, p2, p3));\\n    }\\n\\n    function log(string memory p0, bool p1, address p2, string memory p3) internal view {\\n        _sendLogPayload(abi.encodeWithSignature(\\\"log(string,bool,address,string)\\\", p0, p1, p2, p3));\\n    }\\n\\n    function log(string memory p0, bool p1, address p2, bool p3) internal view {\\n        _sendLogPayload(abi.encodeWithSignature(\\\"log(string,bool,address,bool)\\\", p0, p1, p2, p3));\\n    }\\n\\n    function log(string memory p0, bool p1, address p2, address p3) internal view {\\n        _sendLogPayload(abi.encodeWithSignature(\\\"log(string,bool,address,address)\\\", p0, p1, p2, p3));\\n    }\\n\\n    function log(string memory p0, address p1, uint p2, uint p3) internal view {\\n        _sendLogPayload(abi.encodeWithSignature(\\\"log(string,address,uint,uint)\\\", p0, p1, p2, p3));\\n    }\\n\\n    function log(string memory p0, address p1, uint p2, string memory p3) internal view {\\n        _sendLogPayload(abi.encodeWithSignature(\\\"log(string,address,uint,string)\\\", p0, p1, p2, p3));\\n    }\\n\\n    function log(string memory p0, address p1, uint p2, bool p3) internal view {\\n        _sendLogPayload(abi.encodeWithSignature(\\\"log(string,address,uint,bool)\\\", p0, p1, p2, p3));\\n    }\\n\\n    function log(string memory p0, address p1, uint p2, address p3) internal view {\\n        _sendLogPayload(abi.encodeWithSignature(\\\"log(string,address,uint,address)\\\", p0, p1, p2, p3));\\n    }\\n\\n    function log(string memory p0, address p1, string memory p2, uint p3) internal view {\\n        _sendLogPayload(abi.encodeWithSignature(\\\"log(string,address,string,uint)\\\", p0, p1, p2, p3));\\n    }\\n\\n    function log(string memory p0, address p1, string memory p2, string memory p3) internal view {\\n        _sendLogPayload(abi.encodeWithSignature(\\\"log(string,address,string,string)\\\", p0, p1, p2, p3));\\n    }\\n\\n    function log(string memory p0, address p1, string memory p2, bool p3) internal view {\\n        _sendLogPayload(abi.encodeWithSignature(\\\"log(string,address,string,bool)\\\", p0, p1, p2, p3));\\n    }\\n\\n    function log(string memory p0, address p1, string memory p2, address p3) internal view {\\n        _sendLogPayload(abi.encodeWithSignature(\\\"log(string,address,string,address)\\\", p0, p1, p2, p3));\\n    }\\n\\n    function log(string memory p0, address p1, bool p2, uint p3) internal view {\\n        _sendLogPayload(abi.encodeWithSignature(\\\"log(string,address,bool,uint)\\\", p0, p1, p2, p3));\\n    }\\n\\n    function log(string memory p0, address p1, bool p2, string memory p3) internal view {\\n        _sendLogPayload(abi.encodeWithSignature(\\\"log(string,address,bool,string)\\\", p0, p1, p2, p3));\\n    }\\n\\n    function log(string memory p0, address p1, bool p2, bool p3) internal view {\\n        _sendLogPayload(abi.encodeWithSignature(\\\"log(string,address,bool,bool)\\\", p0, p1, p2, p3));\\n    }\\n\\n    function log(string memory p0, address p1, bool p2, address p3) internal view {\\n        _sendLogPayload(abi.encodeWithSignature(\\\"log(string,address,bool,address)\\\", p0, p1, p2, p3));\\n    }\\n\\n    function log(string memory p0, address p1, address p2, uint p3) internal view {\\n        _sendLogPayload(abi.encodeWithSignature(\\\"log(string,address,address,uint)\\\", p0, p1, p2, p3));\\n    }\\n\\n    function log(string memory p0, address p1, address p2, string memory p3) internal view {\\n        _sendLogPayload(abi.encodeWithSignature(\\\"log(string,address,address,string)\\\", p0, p1, p2, p3));\\n    }\\n\\n    function log(string memory p0, address p1, address p2, bool p3) internal view {\\n        _sendLogPayload(abi.encodeWithSignature(\\\"log(string,address,address,bool)\\\", p0, p1, p2, p3));\\n    }\\n\\n    function log(string memory p0, address p1, address p2, address p3) internal view {\\n        _sendLogPayload(abi.encodeWithSignature(\\\"log(string,address,address,address)\\\", p0, p1, p2, p3));\\n    }\\n\\n    function log(bool p0, uint p1, uint p2, uint p3) internal view {\\n        _sendLogPayload(abi.encodeWithSignature(\\\"log(bool,uint,uint,uint)\\\", p0, p1, p2, p3));\\n    }\\n\\n    function log(bool p0, uint p1, uint p2, string memory p3) internal view {\\n        _sendLogPayload(abi.encodeWithSignature(\\\"log(bool,uint,uint,string)\\\", p0, p1, p2, p3));\\n    }\\n\\n    function log(bool p0, uint p1, uint p2, bool p3) internal view {\\n        _sendLogPayload(abi.encodeWithSignature(\\\"log(bool,uint,uint,bool)\\\", p0, p1, p2, p3));\\n    }\\n\\n    function log(bool p0, uint p1, uint p2, address p3) internal view {\\n        _sendLogPayload(abi.encodeWithSignature(\\\"log(bool,uint,uint,address)\\\", p0, p1, p2, p3));\\n    }\\n\\n    function log(bool p0, uint p1, string memory p2, uint p3) internal view {\\n        _sendLogPayload(abi.encodeWithSignature(\\\"log(bool,uint,string,uint)\\\", p0, p1, p2, p3));\\n    }\\n\\n    function log(bool p0, uint p1, string memory p2, string memory p3) internal view {\\n        _sendLogPayload(abi.encodeWithSignature(\\\"log(bool,uint,string,string)\\\", p0, p1, p2, p3));\\n    }\\n\\n    function log(bool p0, uint p1, string memory p2, bool p3) internal view {\\n        _sendLogPayload(abi.encodeWithSignature(\\\"log(bool,uint,string,bool)\\\", p0, p1, p2, p3));\\n    }\\n\\n    function log(bool p0, uint p1, string memory p2, address p3) internal view {\\n        _sendLogPayload(abi.encodeWithSignature(\\\"log(bool,uint,string,address)\\\", p0, p1, p2, p3));\\n    }\\n\\n    function log(bool p0, uint p1, bool p2, uint p3) internal view {\\n        _sendLogPayload(abi.encodeWithSignature(\\\"log(bool,uint,bool,uint)\\\", p0, p1, p2, p3));\\n    }\\n\\n    function log(bool p0, uint p1, bool p2, string memory p3) internal view {\\n        _sendLogPayload(abi.encodeWithSignature(\\\"log(bool,uint,bool,string)\\\", p0, p1, p2, p3));\\n    }\\n\\n    function log(bool p0, uint p1, bool p2, bool p3) internal view {\\n        _sendLogPayload(abi.encodeWithSignature(\\\"log(bool,uint,bool,bool)\\\", p0, p1, p2, p3));\\n    }\\n\\n    function log(bool p0, uint p1, bool p2, address p3) internal view {\\n        _sendLogPayload(abi.encodeWithSignature(\\\"log(bool,uint,bool,address)\\\", p0, p1, p2, p3));\\n    }\\n\\n    function log(bool p0, uint p1, address p2, uint p3) internal view {\\n        _sendLogPayload(abi.encodeWithSignature(\\\"log(bool,uint,address,uint)\\\", p0, p1, p2, p3));\\n    }\\n\\n    function log(bool p0, uint p1, address p2, string memory p3) internal view {\\n        _sendLogPayload(abi.encodeWithSignature(\\\"log(bool,uint,address,string)\\\", p0, p1, p2, p3));\\n    }\\n\\n    function log(bool p0, uint p1, address p2, bool p3) internal view {\\n        _sendLogPayload(abi.encodeWithSignature(\\\"log(bool,uint,address,bool)\\\", p0, p1, p2, p3));\\n    }\\n\\n    function log(bool p0, uint p1, address p2, address p3) internal view {\\n        _sendLogPayload(abi.encodeWithSignature(\\\"log(bool,uint,address,address)\\\", p0, p1, p2, p3));\\n    }\\n\\n    function log(bool p0, string memory p1, uint p2, uint p3) internal view {\\n        _sendLogPayload(abi.encodeWithSignature(\\\"log(bool,string,uint,uint)\\\", p0, p1, p2, p3));\\n    }\\n\\n    function log(bool p0, string memory p1, uint p2, string memory p3) internal view {\\n        _sendLogPayload(abi.encodeWithSignature(\\\"log(bool,string,uint,string)\\\", p0, p1, p2, p3));\\n    }\\n\\n    function log(bool p0, string memory p1, uint p2, bool p3) internal view {\\n        _sendLogPayload(abi.encodeWithSignature(\\\"log(bool,string,uint,bool)\\\", p0, p1, p2, p3));\\n    }\\n\\n    function log(bool p0, string memory p1, uint p2, address p3) internal view {\\n        _sendLogPayload(abi.encodeWithSignature(\\\"log(bool,string,uint,address)\\\", p0, p1, p2, p3));\\n    }\\n\\n    function log(bool p0, string memory p1, string memory p2, uint p3) internal view {\\n        _sendLogPayload(abi.encodeWithSignature(\\\"log(bool,string,string,uint)\\\", p0, p1, p2, p3));\\n    }\\n\\n    function log(bool p0, string memory p1, string memory p2, string memory p3) internal view {\\n        _sendLogPayload(abi.encodeWithSignature(\\\"log(bool,string,string,string)\\\", p0, p1, p2, p3));\\n    }\\n\\n    function log(bool p0, string memory p1, string memory p2, bool p3) internal view {\\n        _sendLogPayload(abi.encodeWithSignature(\\\"log(bool,string,string,bool)\\\", p0, p1, p2, p3));\\n    }\\n\\n    function log(bool p0, string memory p1, string memory p2, address p3) internal view {\\n        _sendLogPayload(abi.encodeWithSignature(\\\"log(bool,string,string,address)\\\", p0, p1, p2, p3));\\n    }\\n\\n    function log(bool p0, string memory p1, bool p2, uint p3) internal view {\\n        _sendLogPayload(abi.encodeWithSignature(\\\"log(bool,string,bool,uint)\\\", p0, p1, p2, p3));\\n    }\\n\\n    function log(bool p0, string memory p1, bool p2, string memory p3) internal view {\\n        _sendLogPayload(abi.encodeWithSignature(\\\"log(bool,string,bool,string)\\\", p0, p1, p2, p3));\\n    }\\n\\n    function log(bool p0, string memory p1, bool p2, bool p3) internal view {\\n        _sendLogPayload(abi.encodeWithSignature(\\\"log(bool,string,bool,bool)\\\", p0, p1, p2, p3));\\n    }\\n\\n    function log(bool p0, string memory p1, bool p2, address p3) internal view {\\n        _sendLogPayload(abi.encodeWithSignature(\\\"log(bool,string,bool,address)\\\", p0, p1, p2, p3));\\n    }\\n\\n    function log(bool p0, string memory p1, address p2, uint p3) internal view {\\n        _sendLogPayload(abi.encodeWithSignature(\\\"log(bool,string,address,uint)\\\", p0, p1, p2, p3));\\n    }\\n\\n    function log(bool p0, string memory p1, address p2, string memory p3) internal view {\\n        _sendLogPayload(abi.encodeWithSignature(\\\"log(bool,string,address,string)\\\", p0, p1, p2, p3));\\n    }\\n\\n    function log(bool p0, string memory p1, address p2, bool p3) internal view {\\n        _sendLogPayload(abi.encodeWithSignature(\\\"log(bool,string,address,bool)\\\", p0, p1, p2, p3));\\n    }\\n\\n    function log(bool p0, string memory p1, address p2, address p3) internal view {\\n        _sendLogPayload(abi.encodeWithSignature(\\\"log(bool,string,address,address)\\\", p0, p1, p2, p3));\\n    }\\n\\n    function log(bool p0, bool p1, uint p2, uint p3) internal view {\\n        _sendLogPayload(abi.encodeWithSignature(\\\"log(bool,bool,uint,uint)\\\", p0, p1, p2, p3));\\n    }\\n\\n    function log(bool p0, bool p1, uint p2, string memory p3) internal view {\\n        _sendLogPayload(abi.encodeWithSignature(\\\"log(bool,bool,uint,string)\\\", p0, p1, p2, p3));\\n    }\\n\\n    function log(bool p0, bool p1, uint p2, bool p3) internal view {\\n        _sendLogPayload(abi.encodeWithSignature(\\\"log(bool,bool,uint,bool)\\\", p0, p1, p2, p3));\\n    }\\n\\n    function log(bool p0, bool p1, uint p2, address p3) internal view {\\n        _sendLogPayload(abi.encodeWithSignature(\\\"log(bool,bool,uint,address)\\\", p0, p1, p2, p3));\\n    }\\n\\n    function log(bool p0, bool p1, string memory p2, uint p3) internal view {\\n        _sendLogPayload(abi.encodeWithSignature(\\\"log(bool,bool,string,uint)\\\", p0, p1, p2, p3));\\n    }\\n\\n    function log(bool p0, bool p1, string memory p2, string memory p3) internal view {\\n        _sendLogPayload(abi.encodeWithSignature(\\\"log(bool,bool,string,string)\\\", p0, p1, p2, p3));\\n    }\\n\\n    function log(bool p0, bool p1, string memory p2, bool p3) internal view {\\n        _sendLogPayload(abi.encodeWithSignature(\\\"log(bool,bool,string,bool)\\\", p0, p1, p2, p3));\\n    }\\n\\n    function log(bool p0, bool p1, string memory p2, address p3) internal view {\\n        _sendLogPayload(abi.encodeWithSignature(\\\"log(bool,bool,string,address)\\\", p0, p1, p2, p3));\\n    }\\n\\n    function log(bool p0, bool p1, bool p2, uint p3) internal view {\\n        _sendLogPayload(abi.encodeWithSignature(\\\"log(bool,bool,bool,uint)\\\", p0, p1, p2, p3));\\n    }\\n\\n    function log(bool p0, bool p1, bool p2, string memory p3) internal view {\\n        _sendLogPayload(abi.encodeWithSignature(\\\"log(bool,bool,bool,string)\\\", p0, p1, p2, p3));\\n    }\\n\\n    function log(bool p0, bool p1, bool p2, bool p3) internal view {\\n        _sendLogPayload(abi.encodeWithSignature(\\\"log(bool,bool,bool,bool)\\\", p0, p1, p2, p3));\\n    }\\n\\n    function log(bool p0, bool p1, bool p2, address p3) internal view {\\n        _sendLogPayload(abi.encodeWithSignature(\\\"log(bool,bool,bool,address)\\\", p0, p1, p2, p3));\\n    }\\n\\n    function log(bool p0, bool p1, address p2, uint p3) internal view {\\n        _sendLogPayload(abi.encodeWithSignature(\\\"log(bool,bool,address,uint)\\\", p0, p1, p2, p3));\\n    }\\n\\n    function log(bool p0, bool p1, address p2, string memory p3) internal view {\\n        _sendLogPayload(abi.encodeWithSignature(\\\"log(bool,bool,address,string)\\\", p0, p1, p2, p3));\\n    }\\n\\n    function log(bool p0, bool p1, address p2, bool p3) internal view {\\n        _sendLogPayload(abi.encodeWithSignature(\\\"log(bool,bool,address,bool)\\\", p0, p1, p2, p3));\\n    }\\n\\n    function log(bool p0, bool p1, address p2, address p3) internal view {\\n        _sendLogPayload(abi.encodeWithSignature(\\\"log(bool,bool,address,address)\\\", p0, p1, p2, p3));\\n    }\\n\\n    function log(bool p0, address p1, uint p2, uint p3) internal view {\\n        _sendLogPayload(abi.encodeWithSignature(\\\"log(bool,address,uint,uint)\\\", p0, p1, p2, p3));\\n    }\\n\\n    function log(bool p0, address p1, uint p2, string memory p3) internal view {\\n        _sendLogPayload(abi.encodeWithSignature(\\\"log(bool,address,uint,string)\\\", p0, p1, p2, p3));\\n    }\\n\\n    function log(bool p0, address p1, uint p2, bool p3) internal view {\\n        _sendLogPayload(abi.encodeWithSignature(\\\"log(bool,address,uint,bool)\\\", p0, p1, p2, p3));\\n    }\\n\\n    function log(bool p0, address p1, uint p2, address p3) internal view {\\n        _sendLogPayload(abi.encodeWithSignature(\\\"log(bool,address,uint,address)\\\", p0, p1, p2, p3));\\n    }\\n\\n    function log(bool p0, address p1, string memory p2, uint p3) internal view {\\n        _sendLogPayload(abi.encodeWithSignature(\\\"log(bool,address,string,uint)\\\", p0, p1, p2, p3));\\n    }\\n\\n    function log(bool p0, address p1, string memory p2, string memory p3) internal view {\\n        _sendLogPayload(abi.encodeWithSignature(\\\"log(bool,address,string,string)\\\", p0, p1, p2, p3));\\n    }\\n\\n    function log(bool p0, address p1, string memory p2, bool p3) internal view {\\n        _sendLogPayload(abi.encodeWithSignature(\\\"log(bool,address,string,bool)\\\", p0, p1, p2, p3));\\n    }\\n\\n    function log(bool p0, address p1, string memory p2, address p3) internal view {\\n        _sendLogPayload(abi.encodeWithSignature(\\\"log(bool,address,string,address)\\\", p0, p1, p2, p3));\\n    }\\n\\n    function log(bool p0, address p1, bool p2, uint p3) internal view {\\n        _sendLogPayload(abi.encodeWithSignature(\\\"log(bool,address,bool,uint)\\\", p0, p1, p2, p3));\\n    }\\n\\n    function log(bool p0, address p1, bool p2, string memory p3) internal view {\\n        _sendLogPayload(abi.encodeWithSignature(\\\"log(bool,address,bool,string)\\\", p0, p1, p2, p3));\\n    }\\n\\n    function log(bool p0, address p1, bool p2, bool p3) internal view {\\n        _sendLogPayload(abi.encodeWithSignature(\\\"log(bool,address,bool,bool)\\\", p0, p1, p2, p3));\\n    }\\n\\n    function log(bool p0, address p1, bool p2, address p3) internal view {\\n        _sendLogPayload(abi.encodeWithSignature(\\\"log(bool,address,bool,address)\\\", p0, p1, p2, p3));\\n    }\\n\\n    function log(bool p0, address p1, address p2, uint p3) internal view {\\n        _sendLogPayload(abi.encodeWithSignature(\\\"log(bool,address,address,uint)\\\", p0, p1, p2, p3));\\n    }\\n\\n    function log(bool p0, address p1, address p2, string memory p3) internal view {\\n        _sendLogPayload(abi.encodeWithSignature(\\\"log(bool,address,address,string)\\\", p0, p1, p2, p3));\\n    }\\n\\n    function log(bool p0, address p1, address p2, bool p3) internal view {\\n        _sendLogPayload(abi.encodeWithSignature(\\\"log(bool,address,address,bool)\\\", p0, p1, p2, p3));\\n    }\\n\\n    function log(bool p0, address p1, address p2, address p3) internal view {\\n        _sendLogPayload(abi.encodeWithSignature(\\\"log(bool,address,address,address)\\\", p0, p1, p2, p3));\\n    }\\n\\n    function log(address p0, uint p1, uint p2, uint p3) internal view {\\n        _sendLogPayload(abi.encodeWithSignature(\\\"log(address,uint,uint,uint)\\\", p0, p1, p2, p3));\\n    }\\n\\n    function log(address p0, uint p1, uint p2, string memory p3) internal view {\\n        _sendLogPayload(abi.encodeWithSignature(\\\"log(address,uint,uint,string)\\\", p0, p1, p2, p3));\\n    }\\n\\n    function log(address p0, uint p1, uint p2, bool p3) internal view {\\n        _sendLogPayload(abi.encodeWithSignature(\\\"log(address,uint,uint,bool)\\\", p0, p1, p2, p3));\\n    }\\n\\n    function log(address p0, uint p1, uint p2, address p3) internal view {\\n        _sendLogPayload(abi.encodeWithSignature(\\\"log(address,uint,uint,address)\\\", p0, p1, p2, p3));\\n    }\\n\\n    function log(address p0, uint p1, string memory p2, uint p3) internal view {\\n        _sendLogPayload(abi.encodeWithSignature(\\\"log(address,uint,string,uint)\\\", p0, p1, p2, p3));\\n    }\\n\\n    function log(address p0, uint p1, string memory p2, string memory p3) internal view {\\n        _sendLogPayload(abi.encodeWithSignature(\\\"log(address,uint,string,string)\\\", p0, p1, p2, p3));\\n    }\\n\\n    function log(address p0, uint p1, string memory p2, bool p3) internal view {\\n        _sendLogPayload(abi.encodeWithSignature(\\\"log(address,uint,string,bool)\\\", p0, p1, p2, p3));\\n    }\\n\\n    function log(address p0, uint p1, string memory p2, address p3) internal view {\\n        _sendLogPayload(abi.encodeWithSignature(\\\"log(address,uint,string,address)\\\", p0, p1, p2, p3));\\n    }\\n\\n    function log(address p0, uint p1, bool p2, uint p3) internal view {\\n        _sendLogPayload(abi.encodeWithSignature(\\\"log(address,uint,bool,uint)\\\", p0, p1, p2, p3));\\n    }\\n\\n    function log(address p0, uint p1, bool p2, string memory p3) internal view {\\n        _sendLogPayload(abi.encodeWithSignature(\\\"log(address,uint,bool,string)\\\", p0, p1, p2, p3));\\n    }\\n\\n    function log(address p0, uint p1, bool p2, bool p3) internal view {\\n        _sendLogPayload(abi.encodeWithSignature(\\\"log(address,uint,bool,bool)\\\", p0, p1, p2, p3));\\n    }\\n\\n    function log(address p0, uint p1, bool p2, address p3) internal view {\\n        _sendLogPayload(abi.encodeWithSignature(\\\"log(address,uint,bool,address)\\\", p0, p1, p2, p3));\\n    }\\n\\n    function log(address p0, uint p1, address p2, uint p3) internal view {\\n        _sendLogPayload(abi.encodeWithSignature(\\\"log(address,uint,address,uint)\\\", p0, p1, p2, p3));\\n    }\\n\\n    function log(address p0, uint p1, address p2, string memory p3) internal view {\\n        _sendLogPayload(abi.encodeWithSignature(\\\"log(address,uint,address,string)\\\", p0, p1, p2, p3));\\n    }\\n\\n    function log(address p0, uint p1, address p2, bool p3) internal view {\\n        _sendLogPayload(abi.encodeWithSignature(\\\"log(address,uint,address,bool)\\\", p0, p1, p2, p3));\\n    }\\n\\n    function log(address p0, uint p1, address p2, address p3) internal view {\\n        _sendLogPayload(abi.encodeWithSignature(\\\"log(address,uint,address,address)\\\", p0, p1, p2, p3));\\n    }\\n\\n    function log(address p0, string memory p1, uint p2, uint p3) internal view {\\n        _sendLogPayload(abi.encodeWithSignature(\\\"log(address,string,uint,uint)\\\", p0, p1, p2, p3));\\n    }\\n\\n    function log(address p0, string memory p1, uint p2, string memory p3) internal view {\\n        _sendLogPayload(abi.encodeWithSignature(\\\"log(address,string,uint,string)\\\", p0, p1, p2, p3));\\n    }\\n\\n    function log(address p0, string memory p1, uint p2, bool p3) internal view {\\n        _sendLogPayload(abi.encodeWithSignature(\\\"log(address,string,uint,bool)\\\", p0, p1, p2, p3));\\n    }\\n\\n    function log(address p0, string memory p1, uint p2, address p3) internal view {\\n        _sendLogPayload(abi.encodeWithSignature(\\\"log(address,string,uint,address)\\\", p0, p1, p2, p3));\\n    }\\n\\n    function log(address p0, string memory p1, string memory p2, uint p3) internal view {\\n        _sendLogPayload(abi.encodeWithSignature(\\\"log(address,string,string,uint)\\\", p0, p1, p2, p3));\\n    }\\n\\n    function log(address p0, string memory p1, string memory p2, string memory p3) internal view {\\n        _sendLogPayload(abi.encodeWithSignature(\\\"log(address,string,string,string)\\\", p0, p1, p2, p3));\\n    }\\n\\n    function log(address p0, string memory p1, string memory p2, bool p3) internal view {\\n        _sendLogPayload(abi.encodeWithSignature(\\\"log(address,string,string,bool)\\\", p0, p1, p2, p3));\\n    }\\n\\n    function log(address p0, string memory p1, string memory p2, address p3) internal view {\\n        _sendLogPayload(abi.encodeWithSignature(\\\"log(address,string,string,address)\\\", p0, p1, p2, p3));\\n    }\\n\\n    function log(address p0, string memory p1, bool p2, uint p3) internal view {\\n        _sendLogPayload(abi.encodeWithSignature(\\\"log(address,string,bool,uint)\\\", p0, p1, p2, p3));\\n    }\\n\\n    function log(address p0, string memory p1, bool p2, string memory p3) internal view {\\n        _sendLogPayload(abi.encodeWithSignature(\\\"log(address,string,bool,string)\\\", p0, p1, p2, p3));\\n    }\\n\\n    function log(address p0, string memory p1, bool p2, bool p3) internal view {\\n        _sendLogPayload(abi.encodeWithSignature(\\\"log(address,string,bool,bool)\\\", p0, p1, p2, p3));\\n    }\\n\\n    function log(address p0, string memory p1, bool p2, address p3) internal view {\\n        _sendLogPayload(abi.encodeWithSignature(\\\"log(address,string,bool,address)\\\", p0, p1, p2, p3));\\n    }\\n\\n    function log(address p0, string memory p1, address p2, uint p3) internal view {\\n        _sendLogPayload(abi.encodeWithSignature(\\\"log(address,string,address,uint)\\\", p0, p1, p2, p3));\\n    }\\n\\n    function log(address p0, string memory p1, address p2, string memory p3) internal view {\\n        _sendLogPayload(abi.encodeWithSignature(\\\"log(address,string,address,string)\\\", p0, p1, p2, p3));\\n    }\\n\\n    function log(address p0, string memory p1, address p2, bool p3) internal view {\\n        _sendLogPayload(abi.encodeWithSignature(\\\"log(address,string,address,bool)\\\", p0, p1, p2, p3));\\n    }\\n\\n    function log(address p0, string memory p1, address p2, address p3) internal view {\\n        _sendLogPayload(abi.encodeWithSignature(\\\"log(address,string,address,address)\\\", p0, p1, p2, p3));\\n    }\\n\\n    function log(address p0, bool p1, uint p2, uint p3) internal view {\\n        _sendLogPayload(abi.encodeWithSignature(\\\"log(address,bool,uint,uint)\\\", p0, p1, p2, p3));\\n    }\\n\\n    function log(address p0, bool p1, uint p2, string memory p3) internal view {\\n        _sendLogPayload(abi.encodeWithSignature(\\\"log(address,bool,uint,string)\\\", p0, p1, p2, p3));\\n    }\\n\\n    function log(address p0, bool p1, uint p2, bool p3) internal view {\\n        _sendLogPayload(abi.encodeWithSignature(\\\"log(address,bool,uint,bool)\\\", p0, p1, p2, p3));\\n    }\\n\\n    function log(address p0, bool p1, uint p2, address p3) internal view {\\n        _sendLogPayload(abi.encodeWithSignature(\\\"log(address,bool,uint,address)\\\", p0, p1, p2, p3));\\n    }\\n\\n    function log(address p0, bool p1, string memory p2, uint p3) internal view {\\n        _sendLogPayload(abi.encodeWithSignature(\\\"log(address,bool,string,uint)\\\", p0, p1, p2, p3));\\n    }\\n\\n    function log(address p0, bool p1, string memory p2, string memory p3) internal view {\\n        _sendLogPayload(abi.encodeWithSignature(\\\"log(address,bool,string,string)\\\", p0, p1, p2, p3));\\n    }\\n\\n    function log(address p0, bool p1, string memory p2, bool p3) internal view {\\n        _sendLogPayload(abi.encodeWithSignature(\\\"log(address,bool,string,bool)\\\", p0, p1, p2, p3));\\n    }\\n\\n    function log(address p0, bool p1, string memory p2, address p3) internal view {\\n        _sendLogPayload(abi.encodeWithSignature(\\\"log(address,bool,string,address)\\\", p0, p1, p2, p3));\\n    }\\n\\n    function log(address p0, bool p1, bool p2, uint p3) internal view {\\n        _sendLogPayload(abi.encodeWithSignature(\\\"log(address,bool,bool,uint)\\\", p0, p1, p2, p3));\\n    }\\n\\n    function log(address p0, bool p1, bool p2, string memory p3) internal view {\\n        _sendLogPayload(abi.encodeWithSignature(\\\"log(address,bool,bool,string)\\\", p0, p1, p2, p3));\\n    }\\n\\n    function log(address p0, bool p1, bool p2, bool p3) internal view {\\n        _sendLogPayload(abi.encodeWithSignature(\\\"log(address,bool,bool,bool)\\\", p0, p1, p2, p3));\\n    }\\n\\n    function log(address p0, bool p1, bool p2, address p3) internal view {\\n        _sendLogPayload(abi.encodeWithSignature(\\\"log(address,bool,bool,address)\\\", p0, p1, p2, p3));\\n    }\\n\\n    function log(address p0, bool p1, address p2, uint p3) internal view {\\n        _sendLogPayload(abi.encodeWithSignature(\\\"log(address,bool,address,uint)\\\", p0, p1, p2, p3));\\n    }\\n\\n    function log(address p0, bool p1, address p2, string memory p3) internal view {\\n        _sendLogPayload(abi.encodeWithSignature(\\\"log(address,bool,address,string)\\\", p0, p1, p2, p3));\\n    }\\n\\n    function log(address p0, bool p1, address p2, bool p3) internal view {\\n        _sendLogPayload(abi.encodeWithSignature(\\\"log(address,bool,address,bool)\\\", p0, p1, p2, p3));\\n    }\\n\\n    function log(address p0, bool p1, address p2, address p3) internal view {\\n        _sendLogPayload(abi.encodeWithSignature(\\\"log(address,bool,address,address)\\\", p0, p1, p2, p3));\\n    }\\n\\n    function log(address p0, address p1, uint p2, uint p3) internal view {\\n        _sendLogPayload(abi.encodeWithSignature(\\\"log(address,address,uint,uint)\\\", p0, p1, p2, p3));\\n    }\\n\\n    function log(address p0, address p1, uint p2, string memory p3) internal view {\\n        _sendLogPayload(abi.encodeWithSignature(\\\"log(address,address,uint,string)\\\", p0, p1, p2, p3));\\n    }\\n\\n    function log(address p0, address p1, uint p2, bool p3) internal view {\\n        _sendLogPayload(abi.encodeWithSignature(\\\"log(address,address,uint,bool)\\\", p0, p1, p2, p3));\\n    }\\n\\n    function log(address p0, address p1, uint p2, address p3) internal view {\\n        _sendLogPayload(abi.encodeWithSignature(\\\"log(address,address,uint,address)\\\", p0, p1, p2, p3));\\n    }\\n\\n    function log(address p0, address p1, string memory p2, uint p3) internal view {\\n        _sendLogPayload(abi.encodeWithSignature(\\\"log(address,address,string,uint)\\\", p0, p1, p2, p3));\\n    }\\n\\n    function log(address p0, address p1, string memory p2, string memory p3) internal view {\\n        _sendLogPayload(abi.encodeWithSignature(\\\"log(address,address,string,string)\\\", p0, p1, p2, p3));\\n    }\\n\\n    function log(address p0, address p1, string memory p2, bool p3) internal view {\\n        _sendLogPayload(abi.encodeWithSignature(\\\"log(address,address,string,bool)\\\", p0, p1, p2, p3));\\n    }\\n\\n    function log(address p0, address p1, string memory p2, address p3) internal view {\\n        _sendLogPayload(abi.encodeWithSignature(\\\"log(address,address,string,address)\\\", p0, p1, p2, p3));\\n    }\\n\\n    function log(address p0, address p1, bool p2, uint p3) internal view {\\n        _sendLogPayload(abi.encodeWithSignature(\\\"log(address,address,bool,uint)\\\", p0, p1, p2, p3));\\n    }\\n\\n    function log(address p0, address p1, bool p2, string memory p3) internal view {\\n        _sendLogPayload(abi.encodeWithSignature(\\\"log(address,address,bool,string)\\\", p0, p1, p2, p3));\\n    }\\n\\n    function log(address p0, address p1, bool p2, bool p3) internal view {\\n        _sendLogPayload(abi.encodeWithSignature(\\\"log(address,address,bool,bool)\\\", p0, p1, p2, p3));\\n    }\\n\\n    function log(address p0, address p1, bool p2, address p3) internal view {\\n        _sendLogPayload(abi.encodeWithSignature(\\\"log(address,address,bool,address)\\\", p0, p1, p2, p3));\\n    }\\n\\n    function log(address p0, address p1, address p2, uint p3) internal view {\\n        _sendLogPayload(abi.encodeWithSignature(\\\"log(address,address,address,uint)\\\", p0, p1, p2, p3));\\n    }\\n\\n    function log(address p0, address p1, address p2, string memory p3) internal view {\\n        _sendLogPayload(abi.encodeWithSignature(\\\"log(address,address,address,string)\\\", p0, p1, p2, p3));\\n    }\\n\\n    function log(address p0, address p1, address p2, bool p3) internal view {\\n        _sendLogPayload(abi.encodeWithSignature(\\\"log(address,address,address,bool)\\\", p0, p1, p2, p3));\\n    }\\n\\n    function log(address p0, address p1, address p2, address p3) internal view {\\n        _sendLogPayload(abi.encodeWithSignature(\\\"log(address,address,address,address)\\\", p0, p1, p2, p3));\\n    }\\n\\n}\\n\\n// File: contracts/DiamondNodeOmega.sol\\n\\n//SPDX-License-Identifier: MIT\\npragma solidity ^0.8.0;\\n\\n\\n\\n\\n\\n\\n\\n\\n/// @title Defo Diamond Omega Node Minting Contract\\n/// @notice Contract for minting diamond nodes\\ncontract DiamondNodeOmega is ERC721Enumerable, Ownable {\\n    using SafeMath for uint256;\\n    using Counters for Counters.Counter;\\n    Counters.Counter private supply;\\n\\n    bool public activeSale = false;\\n    uint64 public maxTotalDiamondNodes = 35; // total supply of diamond nodes\\n    uint64 public maxNodesPerWallet = 1; // max number of diamond nodes one can hold per wallet\\n    uint256 public diamondNodePrice = 2000; // the current price for minting a diamond node\\n    string private baseURI;\\n    address private constant FEE_COLLECTOR =\\n    0xAEf6Bd49e374C067672bABC554A7AEe36fb71267;\\n    uint256 constant DECIMAL_MULTIPLIER = 10 ** 18;\\n    bool transferLock = true;\\n    address[] whitelist;\\n    /// @notice DAI token address\\n    IERC20 DAIToken;\\n\\n    constructor(address DAI_address)\\n    ERC721(\\\"Defo Diamond Omega Node \\\", \\\"DDON\\\")\\n    {\\n        DAIToken = IERC20(DAI_address);\\n        whitelist.push(address(0));\\n        whitelist.push(address(0x000000000000000000000000000000000000dEaD));\\n        whitelist.push(address(FEE_COLLECTOR));\\n        /*for (uint256 index = 0; index < 6; index++) {\\n            supply.increment();\\n            _safeMint(FEE_COLLECTOR, supply.current());\\n        }*/\\n    }\\n\\n    /// @notice allows users to mint diamond nodes\\n    function mintNode(uint256 amount) public {\\n        require(activeSale == true, \\\"Sale is not currently active\\\");\\n        require(\\n            balanceOf(msg.sender) + amount <= maxNodesPerWallet,\\n            \\\"Cannot mint more than `maxNodePerWallet` nodes\\\"\\n        );\\n        require(\\n            supply.current() + amount < maxTotalDiamondNodes,\\n            \\\"No more diamond nodes to mint\\\"\\n        );\\n        require(\\n            DAIToken.balanceOf(msg.sender) >=\\n            (diamondNodePrice * DECIMAL_MULTIPLIER) * amount,\\n            \\\"Insuffucient DAI balance\\\"\\n        );\\n\\n        DAIToken.transferFrom(\\n            msg.sender,\\n            FEE_COLLECTOR,\\n            (diamondNodePrice * DECIMAL_MULTIPLIER) * amount\\n        );\\n        for (uint256 index = 0; index < amount; index++) {\\n            supply.increment();\\n            _safeMint(msg.sender, supply.current());\\n        }\\n    }\\n\\n    function giveAwayMint() public onlyOwner {\\n        require(\\n            supply.current() < maxTotalDiamondNodes,\\n            \\\"No more diamond nodes to mint\\\"\\n        );\\n        supply.increment();\\n        _safeMint(msg.sender, supply.current());\\n    }\\n\\n    /// @notice allows the owner to set the total amount of diamond nodes\\n    function setMaxTotalDiamondNodes(uint64 _newNodeAmount) external onlyOwner {\\n        maxTotalDiamondNodes = _newNodeAmount;\\n    }\\n\\n    /// @notice allows the owner to render the sale inactive/active, in other words pausing and resuming\\n    function setSaleState() external onlyOwner {\\n        activeSale = !activeSale;\\n    }\\n\\n    ///@notice allows the owner to set the max amount of nodes one wallet can hold\\n    function setMaxPerWallet(uint64 _newAmount) external onlyOwner {\\n        maxNodesPerWallet = _newAmount;\\n    }\\n\\n    /// @notice allows the owner to set the baseURI\\n    function setBaseURI(string memory _tokenBaseURI) external onlyOwner {\\n        baseURI = _tokenBaseURI;\\n    }\\n\\n    /// @notice returns the baseURI\\n    function _baseURI() internal view virtual override returns (string memory) {\\n        return baseURI;\\n    }\\n\\n    function totalSupply() public view override returns (uint256) {\\n        return (supply.current());\\n    }\\n\\n    function setTransferLock() public onlyOwner {\\n        transferLock = !transferLock;\\n    }\\n\\n    function addToWhitelist(address _whitelistedAddress) public onlyOwner {\\n        whitelist.push(_whitelistedAddress);\\n    }\\n\\n    function getPrice() external view returns (uint256) {\\n        return diamondNodePrice;\\n    }\\n\\n    /// @dev lock transfer\\n    function _transfer(\\n        address from,\\n        address to,\\n        uint256 tokenId\\n    ) internal override {\\n        if (transferLock) {\\n            bool transferblock = true;\\n            for (uint256 index = 0; index < whitelist.length; index++) {\\n                if (from == whitelist[index] || to == whitelist[index]) {\\n                    transferblock = false;\\n                    continue;\\n                }\\n            }\\n            require(!transferblock, \\\"Transfer is forbidden\\\");\\n        }\\n        super._transfer(from, to, tokenId);\\n    }\\n}\\n\",\"keccak256\":\"0xf33e37c5fdb4a3b1a27347a1179e702a0c21c8e807211faaa512e3e0a996c200\",\"license\":\"MIT\"}},\"version\":1}",
  "bytecode": "0x6080604052600c80546001600160881b03191669010000000000000023001790556107d0600d55600f805460ff191660011790553480156200004057600080fd5b506040516200279f3803806200279f8339810160408190526200006391620001e0565b6040518060400160405280601881526020017f4465666f204469616d6f6e64204f6d656761204e6f646520000000000000000081525060405180604001604052806004815260200163222227a760e11b8152508160009081620000c79190620002b7565b506001620000d68282620002b7565b505050620000f3620000ed6200018a60201b60201c565b6200018e565b601180546001600160a01b039092166001600160a01b0319928316179055601080546001818101835560008390527f1b6847dc741a1b0cd08d278845f9d819d87b734759afb55fe2de5cb82a9ae6729182018054851690558254808201845582018054851661dead179055825490810190925501805490911673aef6bd49e374c067672babc554a7aee36fb7126717905562000383565b3390565b600a80546001600160a01b038381166001600160a01b0319831681179093556040519116919082907f8be0079c531659141344cd1fd0a4f28419497f9722a3daafe3b4186f6b6457e090600090a35050565b600060208284031215620001f357600080fd5b81516001600160a01b03811681146200020b57600080fd5b9392505050565b634e487b7160e01b600052604160045260246000fd5b600181811c908216806200023d57607f821691505b6020821081036200025e57634e487b7160e01b600052602260045260246000fd5b50919050565b601f821115620002b257600081815260208120601f850160051c810160208610156200028d5750805b601f850160051c820191505b81811015620002ae5782815560010162000299565b5050505b505050565b81516001600160401b03811115620002d357620002d362000212565b620002eb81620002e4845462000228565b8462000264565b602080601f8311600181146200032357600084156200030a5750858301515b600019600386901b1c1916600185901b178555620002ae565b600085815260208120601f198616915b82811015620003545788860151825594840194600190910190840162000333565b5085821015620003735787850151600019600388901b60f8161c191681555b5050505050600190811b01905550565b61240c80620003936000396000f3fe608060405234801561001057600080fd5b50600436106101f05760003560e01c80635fc4442b1161010f578063a2a7b0f2116100a2578063e43252d711610071578063e43252d714610410578063e985e9c514610423578063ef704bc81461045f578063f2fde38b1461047257600080fd5b8063a2a7b0f2146103c7578063b88d4fde146103e2578063c7d6d9c5146103f5578063c87b56dd146103fd57600080fd5b80638da5cb5b116100de5780638da5cb5b1461039357806395d89b41146103a457806398d5fdca146103ac578063a22cb465146103b457600080fd5b80635fc4442b1461035d5780636352211e1461036557806370a0823114610378578063715018a61461038b57600080fd5b806323b872dd1161018757806345a8d86f1161015657806345a8d86f146102f85780634e17700a1461032a5780634f6ccce71461033757806355f804b31461034a57600080fd5b806323b872dd146102ac5780632f745c59146102bf5780633e9f610b146102d257806342842e0e146102e557600080fd5b80630debc023116101c35780630debc0231461027257806318160ddd146102855780631ce9edc71461029b5780631ed40559146102a457600080fd5b806301ffc9a7146101f557806306fdde031461021d578063081812fc14610232578063095ea7b31461025d575b600080fd5b610208610203366004611ce0565b610485565b60405190151581526020015b60405180910390f35b6102256104b0565b6040516102149190611d55565b610245610240366004611d68565b610542565b6040516001600160a01b039091168152602001610214565b61027061026b366004611d9d565b6105dc565b005b610270610280366004611d68565b6106f1565b61028d610a2d565b604051908152602001610214565b61028d600d5481565b610270610a3d565b6102706102ba366004611dc7565b610a7b565b61028d6102cd366004611d9d565b610aac565b6102706102e0366004611e03565b610b42565b6102706102f3366004611dc7565b610ba0565b600c5461031190610100900467ffffffffffffffff1681565b60405167ffffffffffffffff9091168152602001610214565b600c546102089060ff1681565b61028d610345366004611d68565b610bbb565b610270610358366004611eb9565b610c4e565b610270610c84565b610245610373366004611d68565b610d34565b61028d610386366004611f02565b610dab565b610270610e32565b600a546001600160a01b0316610245565b610225610e66565b600d5461028d565b6102706103c2366004611f2b565b610e75565b600c5461031190600160481b900467ffffffffffffffff1681565b6102706103f0366004611f62565b610e80565b610270610eb8565b61022561040b366004611d68565b610ef6565b61027061041e366004611f02565b610fd1565b610208610431366004611fde565b6001600160a01b03918216600090815260056020908152604080832093909416825291909152205460ff1690565b61027061046d366004611e03565b61104d565b610270610480366004611f02565b6110a1565b60006001600160e01b0319821663780e9d6360e01b14806104aa57506104aa8261113c565b92915050565b6060600080546104bf90612011565b80601f01602080910402602001604051908101604052809291908181526020018280546104eb90612011565b80156105385780601f1061050d57610100808354040283529160200191610538565b820191906000526020600020905b81548152906001019060200180831161051b57829003601f168201915b5050505050905090565b6000818152600260205260408120546001600160a01b03166105c05760405162461bcd60e51b815260206004820152602c60248201527f4552433732313a20617070726f76656420717565727920666f72206e6f6e657860448201526b34b9ba32b73a103a37b5b2b760a11b60648201526084015b60405180910390fd5b506000908152600460205260409020546001600160a01b031690565b60006105e782610d34565b9050806001600160a01b0316836001600160a01b0316036106545760405162461bcd60e51b815260206004820152602160248201527f4552433732313a20617070726f76616c20746f2063757272656e74206f776e656044820152603960f91b60648201526084016105b7565b336001600160a01b038216148061067057506106708133610431565b6106e25760405162461bcd60e51b815260206004820152603860248201527f4552433732313a20617070726f76652063616c6c6572206973206e6f74206f7760448201527f6e6572206e6f7220617070726f76656420666f7220616c6c000000000000000060648201526084016105b7565b6106ec838361118c565b505050565b600c5460ff1615156001146107485760405162461bcd60e51b815260206004820152601c60248201527f53616c65206973206e6f742063757272656e746c79206163746976650000000060448201526064016105b7565b600c54600160481b900467ffffffffffffffff168161076633610dab565b6107709190612061565b11156107d55760405162461bcd60e51b815260206004820152602e60248201527f43616e6e6f74206d696e74206d6f7265207468616e20606d61784e6f6465506560448201526d7257616c6c657460206e6f64657360901b60648201526084016105b7565b600c5467ffffffffffffffff61010090910416816107f2600b5490565b6107fc9190612061565b106108495760405162461bcd60e51b815260206004820152601d60248201527f4e6f206d6f7265206469616d6f6e64206e6f64657320746f206d696e7400000060448201526064016105b7565b80670de0b6b3a7640000600d546108609190612079565b61086a9190612079565b6011546040516370a0823160e01b81523360048201526001600160a01b03909116906370a0823190602401602060405180830381865afa1580156108b2573d6000803e3d6000fd5b505050506040513d601f19601f820116820180604052508101906108d69190612098565b10156109245760405162461bcd60e51b815260206004820152601860248201527f496e73756666756369656e74204441492062616c616e6365000000000000000060448201526064016105b7565b601154600d546001600160a01b03909116906323b872dd90339073aef6bd49e374c067672babc554a7aee36fb7126790859061096990670de0b6b3a764000090612079565b6109739190612079565b6040516001600160e01b031960e086901b1681526001600160a01b03938416600482015292909116602483015260448201526064016020604051808303816000875af11580156109c7573d6000803e3d6000fd5b505050506040513d601f19601f820116820180604052508101906109eb91906120b1565b5060005b81811015610a2957610a05600b80546001019055565b610a1733610a12600b5490565b6111fa565b80610a21816120ce565b9150506109ef565b5050565b6000610a38600b5490565b905090565b600a546001600160a01b03163314610a675760405162461bcd60e51b81526004016105b7906120e7565b600c805460ff19811660ff90911615179055565b610a853382611214565b610aa15760405162461bcd60e51b81526004016105b79061211c565b6106ec83838361130b565b6000610ab783610dab565b8210610b195760405162461bcd60e51b815260206004820152602b60248201527f455243373231456e756d657261626c653a206f776e657220696e646578206f7560448201526a74206f6620626f756e647360a81b60648201526084016105b7565b506001600160a01b03919091166000908152600660209081526040808320938352929052205490565b600a546001600160a01b03163314610b6c5760405162461bcd60e51b81526004016105b7906120e7565b600c805467ffffffffffffffff909216600160481b0270ffffffffffffffff00000000000000000019909216919091179055565b6106ec83838360405180602001604052806000815250610e80565b6000610bc660085490565b8210610c295760405162461bcd60e51b815260206004820152602c60248201527f455243373231456e756d657261626c653a20676c6f62616c20696e646578206f60448201526b7574206f6620626f756e647360a01b60648201526084016105b7565b60088281548110610c3c57610c3c61216d565b90600052602060002001549050919050565b600a546001600160a01b03163314610c785760405162461bcd60e51b81526004016105b7906120e7565b600e610a2982826121d1565b600a546001600160a01b03163314610cae5760405162461bcd60e51b81526004016105b7906120e7565b600c5467ffffffffffffffff61010090910416610cca600b5490565b10610d175760405162461bcd60e51b815260206004820152601d60248201527f4e6f206d6f7265206469616d6f6e64206e6f64657320746f206d696e7400000060448201526064016105b7565b610d25600b80546001019055565b610d3233610a12600b5490565b565b6000818152600260205260408120546001600160a01b0316806104aa5760405162461bcd60e51b815260206004820152602960248201527f4552433732313a206f776e657220717565727920666f72206e6f6e657869737460448201526832b73a103a37b5b2b760b91b60648201526084016105b7565b60006001600160a01b038216610e165760405162461bcd60e51b815260206004820152602a60248201527f4552433732313a2062616c616e636520717565727920666f7220746865207a65604482015269726f206164647265737360b01b60648201526084016105b7565b506001600160a01b031660009081526003602052604090205490565b600a546001600160a01b03163314610e5c5760405162461bcd60e51b81526004016105b7906120e7565b610d3260006113f6565b6060600180546104bf90612011565b610a29338383611448565b610e8a3383611214565b610ea65760405162461bcd60e51b81526004016105b79061211c565b610eb284848484611516565b50505050565b600a546001600160a01b03163314610ee25760405162461bcd60e51b81526004016105b7906120e7565b600f805460ff19811660ff90911615179055565b6000818152600260205260409020546060906001600160a01b0316610f755760405162461bcd60e51b815260206004820152602f60248201527f4552433732314d657461646174613a2055524920717565727920666f72206e6f60448201526e3732bc34b9ba32b73a103a37b5b2b760891b60648201526084016105b7565b6000610f7f611549565b90506000815111610f9f5760405180602001604052806000815250610fca565b80610fa984611558565b604051602001610fba929190612291565b6040516020818303038152906040525b9392505050565b600a546001600160a01b03163314610ffb5760405162461bcd60e51b81526004016105b7906120e7565b601080546001810182556000919091527f1b6847dc741a1b0cd08d278845f9d819d87b734759afb55fe2de5cb82a9ae6720180546001600160a01b0319166001600160a01b0392909216919091179055565b600a546001600160a01b031633146110775760405162461bcd60e51b81526004016105b7906120e7565b600c805467ffffffffffffffff9092166101000268ffffffffffffffff0019909216919091179055565b600a546001600160a01b031633146110cb5760405162461bcd60e51b81526004016105b7906120e7565b6001600160a01b0381166111305760405162461bcd60e51b815260206004820152602660248201527f4f776e61626c653a206e6577206f776e657220697320746865207a65726f206160448201526564647265737360d01b60648201526084016105b7565b611139816113f6565b50565b60006001600160e01b031982166380ac58cd60e01b148061116d57506001600160e01b03198216635b5e139f60e01b145b806104aa57506301ffc9a760e01b6001600160e01b03198316146104aa565b600081815260046020526040902080546001600160a01b0319166001600160a01b03841690811790915581906111c182610d34565b6001600160a01b03167f8c5be1e5ebec7d5bd14f71427d1e84f3dd0314c0f7b2291e5b200ac8c7c3b92560405160405180910390a45050565b610a29828260405180602001604052806000815250611659565b6000818152600260205260408120546001600160a01b031661128d5760405162461bcd60e51b815260206004820152602c60248201527f4552433732313a206f70657261746f7220717565727920666f72206e6f6e657860448201526b34b9ba32b73a103a37b5b2b760a11b60648201526084016105b7565b600061129883610d34565b9050806001600160a01b0316846001600160a01b031614806112d35750836001600160a01b03166112c884610542565b6001600160a01b0316145b8061130357506001600160a01b0380821660009081526005602090815260408083209388168352929052205460ff165b949350505050565b600f5460ff16156113eb57600160005b6010548110156113a257601081815481106113385761133861216d565b6000918252602090912001546001600160a01b038681169116148061138657506010818154811061136b5761136b61216d565b6000918252602090912001546001600160a01b038581169116145b1561139057600091505b8061139a816120ce565b91505061131b565b5080156113e95760405162461bcd60e51b81526020600482015260156024820152742a3930b739b332b91034b9903337b93134b23232b760591b60448201526064016105b7565b505b6106ec83838361168c565b600a80546001600160a01b038381166001600160a01b0319831681179093556040519116919082907f8be0079c531659141344cd1fd0a4f28419497f9722a3daafe3b4186f6b6457e090600090a35050565b816001600160a01b0316836001600160a01b0316036114a95760405162461bcd60e51b815260206004820152601960248201527f4552433732313a20617070726f766520746f2063616c6c65720000000000000060448201526064016105b7565b6001600160a01b03838116600081815260056020908152604080832094871680845294825291829020805460ff191686151590811790915591519182527f17307eab39ab6107e8899845ad3d59bd9653f200f220920489ca2b5937696c31910160405180910390a3505050565b61152184848461130b565b61152d84848484611833565b610eb25760405162461bcd60e51b81526004016105b7906122c0565b6060600e80546104bf90612011565b60608160000361157f5750506040805180820190915260018152600360fc1b602082015290565b8160005b81156115a95780611593816120ce565b91506115a29050600a83612328565b9150611583565b60008167ffffffffffffffff8111156115c4576115c4611e2d565b6040519080825280601f01601f1916602001820160405280156115ee576020820181803683370190505b5090505b84156113035761160360018361233c565b9150611610600a86612353565b61161b906030612061565b60f81b8183815181106116305761163061216d565b60200101906001600160f81b031916908160001a905350611652600a86612328565b94506115f2565b6116638383611934565b6116706000848484611833565b6106ec5760405162461bcd60e51b81526004016105b7906122c0565b826001600160a01b031661169f82610d34565b6001600160a01b0316146117035760405162461bcd60e51b815260206004820152602560248201527f4552433732313a207472616e736665722066726f6d20696e636f72726563742060448201526437bbb732b960d91b60648201526084016105b7565b6001600160a01b0382166117655760405162461bcd60e51b8152602060048201526024808201527f4552433732313a207472616e7366657220746f20746865207a65726f206164646044820152637265737360e01b60648201526084016105b7565b611770838383611a82565b61177b60008261118c565b6001600160a01b03831660009081526003602052604081208054600192906117a490849061233c565b90915550506001600160a01b03821660009081526003602052604081208054600192906117d2908490612061565b909155505060008181526002602052604080822080546001600160a01b0319166001600160a01b0386811691821790925591518493918716917fddf252ad1be2c89b69c2b068fc378daa952ba7f163c4a11628f55a4df523b3ef91a4505050565b60006001600160a01b0384163b1561192957604051630a85bd0160e11b81526001600160a01b0385169063150b7a0290611877903390899088908890600401612367565b6020604051808303816000875af19250505080156118b2575060408051601f3d908101601f191682019092526118af918101906123a3565b60015b61190f573d8080156118e0576040519150601f19603f3d011682016040523d82523d6000602084013e6118e5565b606091505b5080516000036119075760405162461bcd60e51b81526004016105b7906122c0565b805181602001fd5b6001600160e01b031916630a85bd0160e11b149050611303565b506001949350505050565b6001600160a01b03821661198a5760405162461bcd60e51b815260206004820181905260248201527f4552433732313a206d696e7420746f20746865207a65726f206164647265737360448201526064016105b7565b6000818152600260205260409020546001600160a01b0316156119ef5760405162461bcd60e51b815260206004820152601c60248201527f4552433732313a20746f6b656e20616c7265616479206d696e7465640000000060448201526064016105b7565b6119fb60008383611a82565b6001600160a01b0382166000908152600360205260408120805460019290611a24908490612061565b909155505060008181526002602052604080822080546001600160a01b0319166001600160a01b03861690811790915590518392907fddf252ad1be2c89b69c2b068fc378daa952ba7f163c4a11628f55a4df523b3ef908290a45050565b6001600160a01b038316611add57611ad881600880546000838152600960205260408120829055600182018355919091527ff3f7a9fe364faab93b216da50a3214154f22a0a2b415b23a84c8169e8b636ee30155565b611b00565b816001600160a01b0316836001600160a01b031614611b0057611b008382611b3a565b6001600160a01b038216611b17576106ec81611bd7565b826001600160a01b0316826001600160a01b0316146106ec576106ec8282611c86565b60006001611b4784610dab565b611b51919061233c565b600083815260076020526040902054909150808214611ba4576001600160a01b03841660009081526006602090815260408083208584528252808320548484528184208190558352600790915290208190555b5060009182526007602090815260408084208490556001600160a01b039094168352600681528383209183525290812055565b600854600090611be99060019061233c565b60008381526009602052604081205460088054939450909284908110611c1157611c1161216d565b906000526020600020015490508060088381548110611c3257611c3261216d565b6000918252602080832090910192909255828152600990915260408082208490558582528120556008805480611c6a57611c6a6123c0565b6001900381819060005260206000200160009055905550505050565b6000611c9183610dab565b6001600160a01b039093166000908152600660209081526040808320868452825280832085905593825260079052919091209190915550565b6001600160e01b03198116811461113957600080fd5b600060208284031215611cf257600080fd5b8135610fca81611cca565b60005b83811015611d18578181015183820152602001611d00565b83811115610eb25750506000910152565b60008151808452611d41816020860160208601611cfd565b601f01601f19169290920160200192915050565b602081526000610fca6020830184611d29565b600060208284031215611d7a57600080fd5b5035919050565b80356001600160a01b0381168114611d9857600080fd5b919050565b60008060408385031215611db057600080fd5b611db983611d81565b946020939093013593505050565b600080600060608486031215611ddc57600080fd5b611de584611d81565b9250611df360208501611d81565b9150604084013590509250925092565b600060208284031215611e1557600080fd5b813567ffffffffffffffff81168114610fca57600080fd5b634e487b7160e01b600052604160045260246000fd5b600067ffffffffffffffff80841115611e5e57611e5e611e2d565b604051601f8501601f19908116603f01168101908282118183101715611e8657611e86611e2d565b81604052809350858152868686011115611e9f57600080fd5b858560208301376000602087830101525050509392505050565b600060208284031215611ecb57600080fd5b813567ffffffffffffffff811115611ee257600080fd5b8201601f81018413611ef357600080fd5b61130384823560208401611e43565b600060208284031215611f1457600080fd5b610fca82611d81565b801515811461113957600080fd5b60008060408385031215611f3e57600080fd5b611f4783611d81565b91506020830135611f5781611f1d565b809150509250929050565b60008060008060808587031215611f7857600080fd5b611f8185611d81565b9350611f8f60208601611d81565b925060408501359150606085013567ffffffffffffffff811115611fb257600080fd5b8501601f81018713611fc357600080fd5b611fd287823560208401611e43565b91505092959194509250565b60008060408385031215611ff157600080fd5b611ffa83611d81565b915061200860208401611d81565b90509250929050565b600181811c9082168061202557607f821691505b60208210810361204557634e487b7160e01b600052602260045260246000fd5b50919050565b634e487b7160e01b600052601160045260246000fd5b600082198211156120745761207461204b565b500190565b60008160001904831182151516156120935761209361204b565b500290565b6000602082840312156120aa57600080fd5b5051919050565b6000602082840312156120c357600080fd5b8151610fca81611f1d565b6000600182016120e0576120e061204b565b5060010190565b6020808252818101527f4f776e61626c653a2063616c6c6572206973206e6f7420746865206f776e6572604082015260600190565b60208082526031908201527f4552433732313a207472616e736665722063616c6c6572206973206e6f74206f6040820152701ddb995c881b9bdc88185c1c1c9bdd9959607a1b606082015260800190565b634e487b7160e01b600052603260045260246000fd5b601f8211156106ec57600081815260208120601f850160051c810160208610156121aa5750805b601f850160051c820191505b818110156121c9578281556001016121b6565b505050505050565b815167ffffffffffffffff8111156121eb576121eb611e2d565b6121ff816121f98454612011565b84612183565b602080601f831160018114612234576000841561221c5750858301515b600019600386901b1c1916600185901b1785556121c9565b600085815260208120601f198616915b8281101561226357888601518255948401946001909101908401612244565b50858210156122815787850151600019600388901b60f8161c191681555b5050505050600190811b01905550565b600083516122a3818460208801611cfd565b8351908301906122b7818360208801611cfd565b01949350505050565b60208082526032908201527f4552433732313a207472616e7366657220746f206e6f6e20455243373231526560408201527131b2b4bb32b91034b6b83632b6b2b73a32b960711b606082015260800190565b634e487b7160e01b600052601260045260246000fd5b60008261233757612337612312565b500490565b60008282101561234e5761234e61204b565b500390565b60008261236257612362612312565b500690565b60006001600160a01b038087168352808616602084015250836040830152608060608301526123996080830184611d29565b9695505050505050565b6000602082840312156123b557600080fd5b8151610fca81611cca565b634e487b7160e01b600052603160045260246000fdfea26469706673582212206abdd8d32c20c3e97c3b3b623fb05436fe370eb2cfe87ef8b413a05c56a3abf464736f6c634300080f0033",
  "deployedBytecode": "0x608060405234801561001057600080fd5b50600436106101f05760003560e01c80635fc4442b1161010f578063a2a7b0f2116100a2578063e43252d711610071578063e43252d714610410578063e985e9c514610423578063ef704bc81461045f578063f2fde38b1461047257600080fd5b8063a2a7b0f2146103c7578063b88d4fde146103e2578063c7d6d9c5146103f5578063c87b56dd146103fd57600080fd5b80638da5cb5b116100de5780638da5cb5b1461039357806395d89b41146103a457806398d5fdca146103ac578063a22cb465146103b457600080fd5b80635fc4442b1461035d5780636352211e1461036557806370a0823114610378578063715018a61461038b57600080fd5b806323b872dd1161018757806345a8d86f1161015657806345a8d86f146102f85780634e17700a1461032a5780634f6ccce71461033757806355f804b31461034a57600080fd5b806323b872dd146102ac5780632f745c59146102bf5780633e9f610b146102d257806342842e0e146102e557600080fd5b80630debc023116101c35780630debc0231461027257806318160ddd146102855780631ce9edc71461029b5780631ed40559146102a457600080fd5b806301ffc9a7146101f557806306fdde031461021d578063081812fc14610232578063095ea7b31461025d575b600080fd5b610208610203366004611ce0565b610485565b60405190151581526020015b60405180910390f35b6102256104b0565b6040516102149190611d55565b610245610240366004611d68565b610542565b6040516001600160a01b039091168152602001610214565b61027061026b366004611d9d565b6105dc565b005b610270610280366004611d68565b6106f1565b61028d610a2d565b604051908152602001610214565b61028d600d5481565b610270610a3d565b6102706102ba366004611dc7565b610a7b565b61028d6102cd366004611d9d565b610aac565b6102706102e0366004611e03565b610b42565b6102706102f3366004611dc7565b610ba0565b600c5461031190610100900467ffffffffffffffff1681565b60405167ffffffffffffffff9091168152602001610214565b600c546102089060ff1681565b61028d610345366004611d68565b610bbb565b610270610358366004611eb9565b610c4e565b610270610c84565b610245610373366004611d68565b610d34565b61028d610386366004611f02565b610dab565b610270610e32565b600a546001600160a01b0316610245565b610225610e66565b600d5461028d565b6102706103c2366004611f2b565b610e75565b600c5461031190600160481b900467ffffffffffffffff1681565b6102706103f0366004611f62565b610e80565b610270610eb8565b61022561040b366004611d68565b610ef6565b61027061041e366004611f02565b610fd1565b610208610431366004611fde565b6001600160a01b03918216600090815260056020908152604080832093909416825291909152205460ff1690565b61027061046d366004611e03565b61104d565b610270610480366004611f02565b6110a1565b60006001600160e01b0319821663780e9d6360e01b14806104aa57506104aa8261113c565b92915050565b6060600080546104bf90612011565b80601f01602080910402602001604051908101604052809291908181526020018280546104eb90612011565b80156105385780601f1061050d57610100808354040283529160200191610538565b820191906000526020600020905b81548152906001019060200180831161051b57829003601f168201915b5050505050905090565b6000818152600260205260408120546001600160a01b03166105c05760405162461bcd60e51b815260206004820152602c60248201527f4552433732313a20617070726f76656420717565727920666f72206e6f6e657860448201526b34b9ba32b73a103a37b5b2b760a11b60648201526084015b60405180910390fd5b506000908152600460205260409020546001600160a01b031690565b60006105e782610d34565b9050806001600160a01b0316836001600160a01b0316036106545760405162461bcd60e51b815260206004820152602160248201527f4552433732313a20617070726f76616c20746f2063757272656e74206f776e656044820152603960f91b60648201526084016105b7565b336001600160a01b038216148061067057506106708133610431565b6106e25760405162461bcd60e51b815260206004820152603860248201527f4552433732313a20617070726f76652063616c6c6572206973206e6f74206f7760448201527f6e6572206e6f7220617070726f76656420666f7220616c6c000000000000000060648201526084016105b7565b6106ec838361118c565b505050565b600c5460ff1615156001146107485760405162461bcd60e51b815260206004820152601c60248201527f53616c65206973206e6f742063757272656e746c79206163746976650000000060448201526064016105b7565b600c54600160481b900467ffffffffffffffff168161076633610dab565b6107709190612061565b11156107d55760405162461bcd60e51b815260206004820152602e60248201527f43616e6e6f74206d696e74206d6f7265207468616e20606d61784e6f6465506560448201526d7257616c6c657460206e6f64657360901b60648201526084016105b7565b600c5467ffffffffffffffff61010090910416816107f2600b5490565b6107fc9190612061565b106108495760405162461bcd60e51b815260206004820152601d60248201527f4e6f206d6f7265206469616d6f6e64206e6f64657320746f206d696e7400000060448201526064016105b7565b80670de0b6b3a7640000600d546108609190612079565b61086a9190612079565b6011546040516370a0823160e01b81523360048201526001600160a01b03909116906370a0823190602401602060405180830381865afa1580156108b2573d6000803e3d6000fd5b505050506040513d601f19601f820116820180604052508101906108d69190612098565b10156109245760405162461bcd60e51b815260206004820152601860248201527f496e73756666756369656e74204441492062616c616e6365000000000000000060448201526064016105b7565b601154600d546001600160a01b03909116906323b872dd90339073aef6bd49e374c067672babc554a7aee36fb7126790859061096990670de0b6b3a764000090612079565b6109739190612079565b6040516001600160e01b031960e086901b1681526001600160a01b03938416600482015292909116602483015260448201526064016020604051808303816000875af11580156109c7573d6000803e3d6000fd5b505050506040513d601f19601f820116820180604052508101906109eb91906120b1565b5060005b81811015610a2957610a05600b80546001019055565b610a1733610a12600b5490565b6111fa565b80610a21816120ce565b9150506109ef565b5050565b6000610a38600b5490565b905090565b600a546001600160a01b03163314610a675760405162461bcd60e51b81526004016105b7906120e7565b600c805460ff19811660ff90911615179055565b610a853382611214565b610aa15760405162461bcd60e51b81526004016105b79061211c565b6106ec83838361130b565b6000610ab783610dab565b8210610b195760405162461bcd60e51b815260206004820152602b60248201527f455243373231456e756d657261626c653a206f776e657220696e646578206f7560448201526a74206f6620626f756e647360a81b60648201526084016105b7565b506001600160a01b03919091166000908152600660209081526040808320938352929052205490565b600a546001600160a01b03163314610b6c5760405162461bcd60e51b81526004016105b7906120e7565b600c805467ffffffffffffffff909216600160481b0270ffffffffffffffff00000000000000000019909216919091179055565b6106ec83838360405180602001604052806000815250610e80565b6000610bc660085490565b8210610c295760405162461bcd60e51b815260206004820152602c60248201527f455243373231456e756d657261626c653a20676c6f62616c20696e646578206f60448201526b7574206f6620626f756e647360a01b60648201526084016105b7565b60088281548110610c3c57610c3c61216d565b90600052602060002001549050919050565b600a546001600160a01b03163314610c785760405162461bcd60e51b81526004016105b7906120e7565b600e610a2982826121d1565b600a546001600160a01b03163314610cae5760405162461bcd60e51b81526004016105b7906120e7565b600c5467ffffffffffffffff61010090910416610cca600b5490565b10610d175760405162461bcd60e51b815260206004820152601d60248201527f4e6f206d6f7265206469616d6f6e64206e6f64657320746f206d696e7400000060448201526064016105b7565b610d25600b80546001019055565b610d3233610a12600b5490565b565b6000818152600260205260408120546001600160a01b0316806104aa5760405162461bcd60e51b815260206004820152602960248201527f4552433732313a206f776e657220717565727920666f72206e6f6e657869737460448201526832b73a103a37b5b2b760b91b60648201526084016105b7565b60006001600160a01b038216610e165760405162461bcd60e51b815260206004820152602a60248201527f4552433732313a2062616c616e636520717565727920666f7220746865207a65604482015269726f206164647265737360b01b60648201526084016105b7565b506001600160a01b031660009081526003602052604090205490565b600a546001600160a01b03163314610e5c5760405162461bcd60e51b81526004016105b7906120e7565b610d3260006113f6565b6060600180546104bf90612011565b610a29338383611448565b610e8a3383611214565b610ea65760405162461bcd60e51b81526004016105b79061211c565b610eb284848484611516565b50505050565b600a546001600160a01b03163314610ee25760405162461bcd60e51b81526004016105b7906120e7565b600f805460ff19811660ff90911615179055565b6000818152600260205260409020546060906001600160a01b0316610f755760405162461bcd60e51b815260206004820152602f60248201527f4552433732314d657461646174613a2055524920717565727920666f72206e6f60448201526e3732bc34b9ba32b73a103a37b5b2b760891b60648201526084016105b7565b6000610f7f611549565b90506000815111610f9f5760405180602001604052806000815250610fca565b80610fa984611558565b604051602001610fba929190612291565b6040516020818303038152906040525b9392505050565b600a546001600160a01b03163314610ffb5760405162461bcd60e51b81526004016105b7906120e7565b601080546001810182556000919091527f1b6847dc741a1b0cd08d278845f9d819d87b734759afb55fe2de5cb82a9ae6720180546001600160a01b0319166001600160a01b0392909216919091179055565b600a546001600160a01b031633146110775760405162461bcd60e51b81526004016105b7906120e7565b600c805467ffffffffffffffff9092166101000268ffffffffffffffff0019909216919091179055565b600a546001600160a01b031633146110cb5760405162461bcd60e51b81526004016105b7906120e7565b6001600160a01b0381166111305760405162461bcd60e51b815260206004820152602660248201527f4f776e61626c653a206e6577206f776e657220697320746865207a65726f206160448201526564647265737360d01b60648201526084016105b7565b611139816113f6565b50565b60006001600160e01b031982166380ac58cd60e01b148061116d57506001600160e01b03198216635b5e139f60e01b145b806104aa57506301ffc9a760e01b6001600160e01b03198316146104aa565b600081815260046020526040902080546001600160a01b0319166001600160a01b03841690811790915581906111c182610d34565b6001600160a01b03167f8c5be1e5ebec7d5bd14f71427d1e84f3dd0314c0f7b2291e5b200ac8c7c3b92560405160405180910390a45050565b610a29828260405180602001604052806000815250611659565b6000818152600260205260408120546001600160a01b031661128d5760405162461bcd60e51b815260206004820152602c60248201527f4552433732313a206f70657261746f7220717565727920666f72206e6f6e657860448201526b34b9ba32b73a103a37b5b2b760a11b60648201526084016105b7565b600061129883610d34565b9050806001600160a01b0316846001600160a01b031614806112d35750836001600160a01b03166112c884610542565b6001600160a01b0316145b8061130357506001600160a01b0380821660009081526005602090815260408083209388168352929052205460ff165b949350505050565b600f5460ff16156113eb57600160005b6010548110156113a257601081815481106113385761133861216d565b6000918252602090912001546001600160a01b038681169116148061138657506010818154811061136b5761136b61216d565b6000918252602090912001546001600160a01b038581169116145b1561139057600091505b8061139a816120ce565b91505061131b565b5080156113e95760405162461bcd60e51b81526020600482015260156024820152742a3930b739b332b91034b9903337b93134b23232b760591b60448201526064016105b7565b505b6106ec83838361168c565b600a80546001600160a01b038381166001600160a01b0319831681179093556040519116919082907f8be0079c531659141344cd1fd0a4f28419497f9722a3daafe3b4186f6b6457e090600090a35050565b816001600160a01b0316836001600160a01b0316036114a95760405162461bcd60e51b815260206004820152601960248201527f4552433732313a20617070726f766520746f2063616c6c65720000000000000060448201526064016105b7565b6001600160a01b03838116600081815260056020908152604080832094871680845294825291829020805460ff191686151590811790915591519182527f17307eab39ab6107e8899845ad3d59bd9653f200f220920489ca2b5937696c31910160405180910390a3505050565b61152184848461130b565b61152d84848484611833565b610eb25760405162461bcd60e51b81526004016105b7906122c0565b6060600e80546104bf90612011565b60608160000361157f5750506040805180820190915260018152600360fc1b602082015290565b8160005b81156115a95780611593816120ce565b91506115a29050600a83612328565b9150611583565b60008167ffffffffffffffff8111156115c4576115c4611e2d565b6040519080825280601f01601f1916602001820160405280156115ee576020820181803683370190505b5090505b84156113035761160360018361233c565b9150611610600a86612353565b61161b906030612061565b60f81b8183815181106116305761163061216d565b60200101906001600160f81b031916908160001a905350611652600a86612328565b94506115f2565b6116638383611934565b6116706000848484611833565b6106ec5760405162461bcd60e51b81526004016105b7906122c0565b826001600160a01b031661169f82610d34565b6001600160a01b0316146117035760405162461bcd60e51b815260206004820152602560248201527f4552433732313a207472616e736665722066726f6d20696e636f72726563742060448201526437bbb732b960d91b60648201526084016105b7565b6001600160a01b0382166117655760405162461bcd60e51b8152602060048201526024808201527f4552433732313a207472616e7366657220746f20746865207a65726f206164646044820152637265737360e01b60648201526084016105b7565b611770838383611a82565b61177b60008261118c565b6001600160a01b03831660009081526003602052604081208054600192906117a490849061233c565b90915550506001600160a01b03821660009081526003602052604081208054600192906117d2908490612061565b909155505060008181526002602052604080822080546001600160a01b0319166001600160a01b0386811691821790925591518493918716917fddf252ad1be2c89b69c2b068fc378daa952ba7f163c4a11628f55a4df523b3ef91a4505050565b60006001600160a01b0384163b1561192957604051630a85bd0160e11b81526001600160a01b0385169063150b7a0290611877903390899088908890600401612367565b6020604051808303816000875af19250505080156118b2575060408051601f3d908101601f191682019092526118af918101906123a3565b60015b61190f573d8080156118e0576040519150601f19603f3d011682016040523d82523d6000602084013e6118e5565b606091505b5080516000036119075760405162461bcd60e51b81526004016105b7906122c0565b805181602001fd5b6001600160e01b031916630a85bd0160e11b149050611303565b506001949350505050565b6001600160a01b03821661198a5760405162461bcd60e51b815260206004820181905260248201527f4552433732313a206d696e7420746f20746865207a65726f206164647265737360448201526064016105b7565b6000818152600260205260409020546001600160a01b0316156119ef5760405162461bcd60e51b815260206004820152601c60248201527f4552433732313a20746f6b656e20616c7265616479206d696e7465640000000060448201526064016105b7565b6119fb60008383611a82565b6001600160a01b0382166000908152600360205260408120805460019290611a24908490612061565b909155505060008181526002602052604080822080546001600160a01b0319166001600160a01b03861690811790915590518392907fddf252ad1be2c89b69c2b068fc378daa952ba7f163c4a11628f55a4df523b3ef908290a45050565b6001600160a01b038316611add57611ad881600880546000838152600960205260408120829055600182018355919091527ff3f7a9fe364faab93b216da50a3214154f22a0a2b415b23a84c8169e8b636ee30155565b611b00565b816001600160a01b0316836001600160a01b031614611b0057611b008382611b3a565b6001600160a01b038216611b17576106ec81611bd7565b826001600160a01b0316826001600160a01b0316146106ec576106ec8282611c86565b60006001611b4784610dab565b611b51919061233c565b600083815260076020526040902054909150808214611ba4576001600160a01b03841660009081526006602090815260408083208584528252808320548484528184208190558352600790915290208190555b5060009182526007602090815260408084208490556001600160a01b039094168352600681528383209183525290812055565b600854600090611be99060019061233c565b60008381526009602052604081205460088054939450909284908110611c1157611c1161216d565b906000526020600020015490508060088381548110611c3257611c3261216d565b6000918252602080832090910192909255828152600990915260408082208490558582528120556008805480611c6a57611c6a6123c0565b6001900381819060005260206000200160009055905550505050565b6000611c9183610dab565b6001600160a01b039093166000908152600660209081526040808320868452825280832085905593825260079052919091209190915550565b6001600160e01b03198116811461113957600080fd5b600060208284031215611cf257600080fd5b8135610fca81611cca565b60005b83811015611d18578181015183820152602001611d00565b83811115610eb25750506000910152565b60008151808452611d41816020860160208601611cfd565b601f01601f19169290920160200192915050565b602081526000610fca6020830184611d29565b600060208284031215611d7a57600080fd5b5035919050565b80356001600160a01b0381168114611d9857600080fd5b919050565b60008060408385031215611db057600080fd5b611db983611d81565b946020939093013593505050565b600080600060608486031215611ddc57600080fd5b611de584611d81565b9250611df360208501611d81565b9150604084013590509250925092565b600060208284031215611e1557600080fd5b813567ffffffffffffffff81168114610fca57600080fd5b634e487b7160e01b600052604160045260246000fd5b600067ffffffffffffffff80841115611e5e57611e5e611e2d565b604051601f8501601f19908116603f01168101908282118183101715611e8657611e86611e2d565b81604052809350858152868686011115611e9f57600080fd5b858560208301376000602087830101525050509392505050565b600060208284031215611ecb57600080fd5b813567ffffffffffffffff811115611ee257600080fd5b8201601f81018413611ef357600080fd5b61130384823560208401611e43565b600060208284031215611f1457600080fd5b610fca82611d81565b801515811461113957600080fd5b60008060408385031215611f3e57600080fd5b611f4783611d81565b91506020830135611f5781611f1d565b809150509250929050565b60008060008060808587031215611f7857600080fd5b611f8185611d81565b9350611f8f60208601611d81565b925060408501359150606085013567ffffffffffffffff811115611fb257600080fd5b8501601f81018713611fc357600080fd5b611fd287823560208401611e43565b91505092959194509250565b60008060408385031215611ff157600080fd5b611ffa83611d81565b915061200860208401611d81565b90509250929050565b600181811c9082168061202557607f821691505b60208210810361204557634e487b7160e01b600052602260045260246000fd5b50919050565b634e487b7160e01b600052601160045260246000fd5b600082198211156120745761207461204b565b500190565b60008160001904831182151516156120935761209361204b565b500290565b6000602082840312156120aa57600080fd5b5051919050565b6000602082840312156120c357600080fd5b8151610fca81611f1d565b6000600182016120e0576120e061204b565b5060010190565b6020808252818101527f4f776e61626c653a2063616c6c6572206973206e6f7420746865206f776e6572604082015260600190565b60208082526031908201527f4552433732313a207472616e736665722063616c6c6572206973206e6f74206f6040820152701ddb995c881b9bdc88185c1c1c9bdd9959607a1b606082015260800190565b634e487b7160e01b600052603260045260246000fd5b601f8211156106ec57600081815260208120601f850160051c810160208610156121aa5750805b601f850160051c820191505b818110156121c9578281556001016121b6565b505050505050565b815167ffffffffffffffff8111156121eb576121eb611e2d565b6121ff816121f98454612011565b84612183565b602080601f831160018114612234576000841561221c5750858301515b600019600386901b1c1916600185901b1785556121c9565b600085815260208120601f198616915b8281101561226357888601518255948401946001909101908401612244565b50858210156122815787850151600019600388901b60f8161c191681555b5050505050600190811b01905550565b600083516122a3818460208801611cfd565b8351908301906122b7818360208801611cfd565b01949350505050565b60208082526032908201527f4552433732313a207472616e7366657220746f206e6f6e20455243373231526560408201527131b2b4bb32b91034b6b83632b6b2b73a32b960711b606082015260800190565b634e487b7160e01b600052601260045260246000fd5b60008261233757612337612312565b500490565b60008282101561234e5761234e61204b565b500390565b60008261236257612362612312565b500690565b60006001600160a01b038087168352808616602084015250836040830152608060608301526123996080830184611d29565b9695505050505050565b6000602082840312156123b557600080fd5b8151610fca81611cca565b634e487b7160e01b600052603160045260246000fdfea26469706673582212206abdd8d32c20c3e97c3b3b623fb05436fe370eb2cfe87ef8b413a05c56a3abf464736f6c634300080f0033",
  "devdoc": {
    "kind": "dev",
    "methods": {
      "approve(address,uint256)": {
        "details": "See {IERC721-approve}."
      },
      "balanceOf(address)": {
        "details": "See {IERC721-balanceOf}."
      },
      "getApproved(uint256)": {
        "details": "See {IERC721-getApproved}."
      },
      "isApprovedForAll(address,address)": {
        "details": "See {IERC721-isApprovedForAll}."
      },
      "name()": {
        "details": "See {IERC721Metadata-name}."
      },
      "owner()": {
        "details": "Returns the address of the current owner."
      },
      "ownerOf(uint256)": {
        "details": "See {IERC721-ownerOf}."
      },
      "renounceOwnership()": {
        "details": "Leaves the contract without owner. It will not be possible to call `onlyOwner` functions anymore. Can only be called by the current owner. NOTE: Renouncing ownership will leave the contract without an owner, thereby removing any functionality that is only available to the owner."
      },
      "safeTransferFrom(address,address,uint256)": {
        "details": "See {IERC721-safeTransferFrom}."
      },
      "safeTransferFrom(address,address,uint256,bytes)": {
        "details": "See {IERC721-safeTransferFrom}."
      },
      "setApprovalForAll(address,bool)": {
        "details": "See {IERC721-setApprovalForAll}."
      },
      "supportsInterface(bytes4)": {
        "details": "See {IERC165-supportsInterface}."
      },
      "symbol()": {
        "details": "See {IERC721Metadata-symbol}."
      },
      "tokenByIndex(uint256)": {
        "details": "See {IERC721Enumerable-tokenByIndex}."
      },
      "tokenOfOwnerByIndex(address,uint256)": {
        "details": "See {IERC721Enumerable-tokenOfOwnerByIndex}."
      },
      "tokenURI(uint256)": {
        "details": "See {IERC721Metadata-tokenURI}."
      },
      "totalSupply()": {
        "details": "See {IERC721Enumerable-totalSupply}."
      },
      "transferFrom(address,address,uint256)": {
        "details": "See {IERC721-transferFrom}."
      },
      "transferOwnership(address)": {
        "details": "Transfers ownership of the contract to a new account (`newOwner`). Can only be called by the current owner."
      }
    },
    "title": "Defo Diamond Omega Node Minting Contract",
    "version": 1
  },
  "userdoc": {
    "kind": "user",
    "methods": {
      "mintNode(uint256)": {
        "notice": "allows users to mint diamond nodes"
      },
      "setBaseURI(string)": {
        "notice": "allows the owner to set the baseURI"
      },
      "setMaxPerWallet(uint64)": {
        "notice": "allows the owner to set the max amount of nodes one wallet can hold"
      },
      "setMaxTotalDiamondNodes(uint64)": {
        "notice": "allows the owner to set the total amount of diamond nodes"
      },
      "setSaleState()": {
        "notice": "allows the owner to render the sale inactive/active, in other words pausing and resuming"
      }
    },
    "notice": "Contract for minting diamond nodes",
    "version": 1
  },
  "storageLayout": {
    "storage": [
      {
        "astId": 1317,
        "contract": "contracts/presale/presaleDiamondOmega.sol:DiamondNodeOmega",
        "label": "_name",
        "offset": 0,
        "slot": "0",
        "type": "t_string_storage"
      },
      {
        "astId": 1319,
        "contract": "contracts/presale/presaleDiamondOmega.sol:DiamondNodeOmega",
        "label": "_symbol",
        "offset": 0,
        "slot": "1",
        "type": "t_string_storage"
      },
      {
        "astId": 1323,
        "contract": "contracts/presale/presaleDiamondOmega.sol:DiamondNodeOmega",
        "label": "_owners",
        "offset": 0,
        "slot": "2",
        "type": "t_mapping(t_uint256,t_address)"
      },
      {
        "astId": 1327,
        "contract": "contracts/presale/presaleDiamondOmega.sol:DiamondNodeOmega",
        "label": "_balances",
        "offset": 0,
        "slot": "3",
        "type": "t_mapping(t_address,t_uint256)"
      },
      {
        "astId": 1331,
        "contract": "contracts/presale/presaleDiamondOmega.sol:DiamondNodeOmega",
        "label": "_tokenApprovals",
        "offset": 0,
        "slot": "4",
        "type": "t_mapping(t_uint256,t_address)"
      },
      {
        "astId": 1337,
        "contract": "contracts/presale/presaleDiamondOmega.sol:DiamondNodeOmega",
        "label": "_operatorApprovals",
        "offset": 0,
        "slot": "5",
        "type": "t_mapping(t_address,t_mapping(t_address,t_bool))"
      },
      {
        "astId": 2169,
        "contract": "contracts/presale/presaleDiamondOmega.sol:DiamondNodeOmega",
        "label": "_ownedTokens",
        "offset": 0,
        "slot": "6",
        "type": "t_mapping(t_address,t_mapping(t_uint256,t_uint256))"
      },
      {
        "astId": 2173,
        "contract": "contracts/presale/presaleDiamondOmega.sol:DiamondNodeOmega",
        "label": "_ownedTokensIndex",
        "offset": 0,
        "slot": "7",
        "type": "t_mapping(t_uint256,t_uint256)"
      },
      {
        "astId": 2176,
        "contract": "contracts/presale/presaleDiamondOmega.sol:DiamondNodeOmega",
        "label": "_allTokens",
        "offset": 0,
        "slot": "8",
        "type": "t_array(t_uint256)dyn_storage"
      },
      {
        "astId": 2180,
        "contract": "contracts/presale/presaleDiamondOmega.sol:DiamondNodeOmega",
        "label": "_allTokensIndex",
        "offset": 0,
        "slot": "9",
        "type": "t_mapping(t_uint256,t_uint256)"
      },
      {
        "astId": 690,
        "contract": "contracts/presale/presaleDiamondOmega.sol:DiamondNodeOmega",
        "label": "_owner",
        "offset": 0,
        "slot": "10",
        "type": "t_address"
      },
      {
        "astId": 10571,
        "contract": "contracts/presale/presaleDiamondOmega.sol:DiamondNodeOmega",
        "label": "supply",
        "offset": 0,
        "slot": "11",
        "type": "t_struct(Counter)316_storage"
      },
      {
        "astId": 10574,
        "contract": "contracts/presale/presaleDiamondOmega.sol:DiamondNodeOmega",
        "label": "activeSale",
        "offset": 0,
        "slot": "12",
        "type": "t_bool"
      },
      {
        "astId": 10577,
        "contract": "contracts/presale/presaleDiamondOmega.sol:DiamondNodeOmega",
        "label": "maxTotalDiamondNodes",
        "offset": 1,
        "slot": "12",
        "type": "t_uint64"
      },
      {
        "astId": 10580,
        "contract": "contracts/presale/presaleDiamondOmega.sol:DiamondNodeOmega",
        "label": "maxNodesPerWallet",
        "offset": 9,
        "slot": "12",
        "type": "t_uint64"
      },
      {
        "astId": 10583,
        "contract": "contracts/presale/presaleDiamondOmega.sol:DiamondNodeOmega",
        "label": "diamondNodePrice",
        "offset": 0,
        "slot": "13",
        "type": "t_uint256"
      },
      {
        "astId": 10585,
        "contract": "contracts/presale/presaleDiamondOmega.sol:DiamondNodeOmega",
        "label": "baseURI",
        "offset": 0,
        "slot": "14",
        "type": "t_string_storage"
      },
      {
        "astId": 10596,
        "contract": "contracts/presale/presaleDiamondOmega.sol:DiamondNodeOmega",
        "label": "transferLock",
        "offset": 0,
        "slot": "15",
        "type": "t_bool"
      },
      {
        "astId": 10599,
        "contract": "contracts/presale/presaleDiamondOmega.sol:DiamondNodeOmega",
        "label": "whitelist",
        "offset": 0,
        "slot": "16",
        "type": "t_array(t_address)dyn_storage"
      },
      {
        "astId": 10603,
        "contract": "contracts/presale/presaleDiamondOmega.sol:DiamondNodeOmega",
        "label": "DAIToken",
        "offset": 0,
        "slot": "17",
        "type": "t_contract(IERC20)461"
      }
    ],
    "types": {
      "t_address": {
        "encoding": "inplace",
        "label": "address",
        "numberOfBytes": "20"
      },
      "t_array(t_address)dyn_storage": {
        "base": "t_address",
        "encoding": "dynamic_array",
        "label": "address[]",
        "numberOfBytes": "32"
      },
      "t_array(t_uint256)dyn_storage": {
        "base": "t_uint256",
        "encoding": "dynamic_array",
        "label": "uint256[]",
        "numberOfBytes": "32"
      },
      "t_bool": {
        "encoding": "inplace",
        "label": "bool",
        "numberOfBytes": "1"
      },
      "t_contract(IERC20)461": {
        "encoding": "inplace",
        "label": "contract IERC20",
        "numberOfBytes": "20"
      },
      "t_mapping(t_address,t_bool)": {
        "encoding": "mapping",
        "key": "t_address",
        "label": "mapping(address => bool)",
        "numberOfBytes": "32",
        "value": "t_bool"
      },
      "t_mapping(t_address,t_mapping(t_address,t_bool))": {
        "encoding": "mapping",
        "key": "t_address",
        "label": "mapping(address => mapping(address => bool))",
        "numberOfBytes": "32",
        "value": "t_mapping(t_address,t_bool)"
      },
      "t_mapping(t_address,t_mapping(t_uint256,t_uint256))": {
        "encoding": "mapping",
        "key": "t_address",
        "label": "mapping(address => mapping(uint256 => uint256))",
        "numberOfBytes": "32",
        "value": "t_mapping(t_uint256,t_uint256)"
      },
      "t_mapping(t_address,t_uint256)": {
        "encoding": "mapping",
        "key": "t_address",
        "label": "mapping(address => uint256)",
        "numberOfBytes": "32",
        "value": "t_uint256"
      },
      "t_mapping(t_uint256,t_address)": {
        "encoding": "mapping",
        "key": "t_uint256",
        "label": "mapping(uint256 => address)",
        "numberOfBytes": "32",
        "value": "t_address"
      },
      "t_mapping(t_uint256,t_uint256)": {
        "encoding": "mapping",
        "key": "t_uint256",
        "label": "mapping(uint256 => uint256)",
        "numberOfBytes": "32",
        "value": "t_uint256"
      },
      "t_string_storage": {
        "encoding": "bytes",
        "label": "string",
        "numberOfBytes": "32"
      },
      "t_struct(Counter)316_storage": {
        "encoding": "inplace",
        "label": "struct Counters.Counter",
        "members": [
          {
            "astId": 315,
            "contract": "contracts/presale/presaleDiamondOmega.sol:DiamondNodeOmega",
            "label": "_value",
            "offset": 0,
            "slot": "0",
            "type": "t_uint256"
          }
        ],
        "numberOfBytes": "32"
      },
      "t_uint256": {
        "encoding": "inplace",
        "label": "uint256",
        "numberOfBytes": "32"
      },
      "t_uint64": {
        "encoding": "inplace",
        "label": "uint64",
        "numberOfBytes": "8"
      }
    }
  }
}